Rank,Musica,Artista,Letra
47,Vegas,Doja Cat," 
Yeah, ah, get it
Yeah, ah, get it
Yeah, yeah, ah, get it
Yeah, ah, get it
Yeah, ah, get it
Yeah

You ain't nothin' but a
Dog player, I get it
Fraud player, I get it
I understand, I understand
You ain't the man, you ain't a man
You ain't nothin' but a
Hound dog, hound dog, hound dog
You ain't nothin' but a

Player gettin' valeted around in that ho whip
Two fingers up, one down when my toes ten
Flewed out with my boobs out, put a cork in it
Love it when you be cryin' out when I'm corseted
I don't think he gon' make it, do not let me start ragin'
****, I'm losin' my patience, this ain't stayin' in Vegas (You ain't nothin' but a)
There's more sides to the story, I'ma tell everybody
Had your ass sittin' courtside with your arm around me
Had your ass sittin' first class with your burnt ass out in Abu Dhabi
Coulda been what we shoulda been
But you lost a bet, now you gotta find me
Find a seat
I ain't playin', that's hide and seek
High school when you finally peaked
Hound dog, couldn't find a treat
I'm a bad bitch, but

You ain't nothin' but a
Dog player, I get it
Fraud player, I get it
I understand, I understand
You ain't the man, you ain't a man
You ain't nothin' but a
Hound dog, hound dog, hound dog (Yeah, yeah, said)
You ain't nothin' but a

I get it, I know you got some other **** you on
And I get it, you needed someone that could prove you wrong
So I reckon you leave all of your problems at the door to my city
You gon' need to tell my brothers where you from
And I admit it, I still got empathy
And you gon' feel it for two weeks when I release you in them sheets (You ain't nothin' but a)
And keep my nina indiscreet, keep the cleaner in my Jeep
Then put that Yeezy in your teeth, let my demons off they leashes
If you even think to speak, I'ma give a whole new meanin'
When you said you livin' a dream, we can keep that **** asleep
And you gon' laugh with all your Gs
Countin' them sheep, sheep, sheep, sheep
Talkin' 'bout Z-Z-Z-Z-Z-Z-Z, R.I.P

You ain't nothin' but a
Dog player, I get it
Fraud player, I get it
I understand, I understand
You ain't the man, you ain't a man
You ain't nothin' but a
Hound dog, hound dog, hound dog
You ain't nothin' but a
Dog player, I get it
Fraud player, I get it
I understand, I understand
You ain't the man, you ain't a man
You ain't nothin' but a
Hound dog, hound dog, hound dog
You ain't nothin' but a
Yeah, ah, get it
Yeah, ah, get it
Yeah, yeah, ah, get it
Yeah, ah, get it
Yeah, yeah, ah, get it
Yeah, you ain't nothin' but a "
48,Pushin P,Gunna ," 
(Wheezy outta here)
Pushin' P
Yeah, pushin' P, turn me up
Turn me up, P, uh-ah

Pointers in the Patek and my piece, I'm pushin' P
Copped new hammers for my P, we don't want no peace
Got a spot across the spot, just for P's
Dropped the dot and then we plot, exotic P's
She not a lesbian, for P, she turn Pesbian (Pushin' P, I'm pushin' P)
Off capital P, I rock these presidents, count presidents (Pushin' P)
Portuguese on her knees, moppin' down the P
She let me squeeze, then she lеave 'cause she keep it P
Privatе suite, private seat, bitch, I'm pushin' P
Purple pint, pussy pink, bitch, I'm pushin' P

Pushin' P, I'm pushin' P, pushin' P, I'm pushin' P, yeah (Know what I'm sayin')
Pushin' P, I'm pushin' P, pushin' P, I'm pushin' P, yeah
Pop a P, I'm paranoid, I can't just sleep
My pockets deep, got racks on me
Why they watchin' me?
I'm pushin' P, I'm pushin' P, pushin' P, I'm pushin' P, yeah

Look, I just, uh, uh, bought the 'Ghini
The opps outside, uh, ah, uh
Okay, bought her a P, not a pill, a Porsche (Pushin' P)
Three P's, pop, pourin', Porsches (Skrrt, pushin' P)
I just fucked a cup of water (I did)
Pushin' P, red bandana, Cardinals (Ayy, pushin' P)
I'ma peel you out yo' whole endorsement (Yeah, pushin' P)
She ain't veneer for me, she simply porcelains (I never)
I never saw opps, now we finally tusslin' (I never)
She ready to get in the streets for me, no question (Of course, skrrt)
Too rich to text, I let my shawty forward it (Yeah)
Take the P out the alphabets, nigga, try to sort it (Ayy)

I'm pushin' P, I'm pushin' P, I'm pushin' P
Pushin' P, I'm pushin' P, P, ah-ah
Pushin' P, I'm pushin' P, pushin' P
I'm pushin' P, yeah, ah-ah "
49,Buy Dirt,Jordan Davis Luke Bryan," 
Few days before he turned 80
He was sitting out back in a rocker
He said ""What you been up to lately?""
I told him chasing a dollar
And in between sips of coffee
He poured this wisdom out
Said ""If you want my two cents on making a dollar count

Buy dirt
Find the one you can't live without
Get a ring, let your knee hit the ground
Do what you love but call it work
And throw a little money in the plate at church
Send your prayers up and your roots down deep
Add a few limbs to your family tree
And watch their pencils marks, and the grass in the yard
All grow up
'Cause the truth about it is it all goes by real quick
You can't buy happiness
But you can buy dirt""

Before you get caught on that ladder
Let me tell you what it's all about
Find you a few things that matter
That you can put a fence around
And then he laid it out

Buy dirt
Find the one you can't live without
Get a ring, let your knee hit the ground
Do what you love but call it work
And throw a little money in the plate at church
Send you prayers up and your roots down deep
And add a few limbs to your family tree
And watch their pencils marks, and the grass in the yard
All grow up
'Cause the truth about it is it all goes by real quick
You can't buy happiness
But you can buy dirt

You can buy dirt
And thank the good Lord for it
'Cause He ain't makin' any more of it

So buy dirt
Find the one you can't live without
Get a ring, let your knee hit the ground
Do what you love but call it work
And throw a little money in the plate at church
Send your prayers up and your roots down deep
Add a few limbs to your family tree
And watch their pencils marks, and the grass in the yard
All grow up
'Cause the truth about it is it all goes by real quick
You can't buy happiness
But you can buy dirt "
50,I Hate U,SZA," 
I be so sick of you niggas, y'all contradicting
I be so bored with myself, can you come and fuck me?
I feel so ordinary, sad when you around me
Treat me like corduroy, wear me out
Arguments, you air me out
Tripping 'bout your whereabouts
I can't keep no conflict with you, boy, can we just rub it out?
I don't want no static with you, you know you my plug
And I can't shake this habit, no

I've been up, baby
Heavy reminiscin'
Heavy on the missing you
Wish it was different than what it was (Oh, no)
I've been up, baby
Lost in the lie of us
Lost, ain't no findin' us
I've been up, baby

And if you wonder if I hate you (I do)
Shitty of you to make me feel just like this
What I would do to make you feel just like this
And if you wondered if I hate you (Fuck you)
Shitty of you to make me feel just likе this
What I would do to make you feel just like this

Used to bе too solid 'til you scrambled me
Used to be your rider, you mishandle me
Used to be nonviolent 'til you ambushed me
Now I'm out here wildin' with you
Now I'm out here, silent treatment, that mean no permission (No)
Missionary gettin' boring, can you switch positions? (Yeah)
Hard to save your soul, you don't ever listen, no (No)

I've been up, baby
Heavy reminiscin'
Heavy on the missing you
Wish it was different than what it was (Oh, no)
I've been up, baby
Lost in the lie of us
Lost, ain't no findin' us
I've been up, baby

And if you wonder if I hate you (I do)
Shitty of you to make me feel just like this
What I would do to make you feel just like this
And if you wondered if I hate you (Fuck you)
Shitty of you to make me feel just like this
What I would do to make you feel just like this "
51,Boyfriend,Dove Cameron," 
I can't believe we're finally alone
I can't believe I almost went home
What are the chances? Everyone's dancing
And he's not with you (Hmm, hmm, hmm, hmm)

The universe must have divined this
What am I gonna do? Not grab your wrist?

I could be a better boyfriend than him
I could do the shit that he never did
Up all night, I won't quit
Thinking I'm gonna steal you from him
I could be such a gentleman
Plus all my clothes would fit
I could be a better boyfriend

I don't need to tell you twice
All the ways hе can't suffice
If I could give you some advicе
I would leave with me tonight

The universe must have divined this (Mmm, mmm)
Ladies first, baby, I insist
I could be a better boyfriend than him
I could do the shit that he never did
Up all night, I won't quit
Thinking I'm gonna steal you from him
I could be such a gentleman
Plus all my clothes would fit
I could be a better boyfriend than him
I could be a better boyfriend

I never would have left you alone
Here on your own, glued to your phone
Never would have left you alone
For someone else to take you home

I could be a better boyfriend than him
I could do the shit that he never did
Up all night, I won't quit
I'm gonna steal you from him
I could be such a gentleman
Plus you know my clothes would fit
I could be a better boyfriend than him
I could do the shit that he never did
Up all night, I won't quit
Thinking I'm gonna steal you from him
I could be such a gentleman
Plus all my clothes would fit "
52,Glimpse of Us,Joji," 
She'd take the world off my shoulders
If it was ever hard to move
She'd turn the rain to a rainbow
When I was living in the blue
Why then, if she's so perfect
Do I still wish that it was you?
Perfect don't mean that it's workin'
So what can I do? (Ooh)

When you're out of sight
In my mind

'Cause sometimes, I look in her eyes
And that's where I find a glimpse of us
And I try to fall for her touch
But I'm thinkin' of the way it was
Said I'm fine and said I moved on
I'm only here passing time in her arms
Hopin' I'll find a glimpse of us

Tell me he savors your glory
Does he laugh the way I did?
Is this a part of your story?
One that I had never lived
Maybe one day, you'll feel lonely
And in his eyes, you'll get a glimpse
Maybe you'll start slippin' slowly and find me again

When you're out of sight
In my mind

'Cause sometimes, I look in her eyes
And that's where I find a glimpse of us
And I try to fall for her touch
But I'm thinkin' of the way it was
Said I'm fine and said I moved on
I'm only here passing time in her arms
Hopin' I'll find a glimpse of us

Ooh
Ooh-ooh-ooh
Ooh
Ooh-ooh-ooh

'Cause sometimes, I look in her eyes
And that's where I find a glimpse of us
And I try to fall for her touch
But I'm thinkin' of the way it was
Said I'm fine and said I moved on
I'm only here passing time in her arms
Hopin' I'll find a glimpse of us "
53,Surface Pressure,Jessica Darrow,"
I'm the strong one, I'm not nervous
I'm as tough as the crust of the Earth is
I move mountains, I move churches
And I glow, 'cause I know what my worth is
I don't ask how hard the work is
Got a rough, indestructible surface
Diamonds and platinum, I find 'em, I flatten 'em
I take what I'm handed, I break what's demanded, but

Under the surface
I feel berserk as a tightrope walker in a three-ring circus
Under the surface
Was Hercules ever like, ""Yo, I don't wanna fight Cerberus?""
Under the surface
I'm pretty surе I'm worthless if I can't be of servicе

A flaw or a crack, the straw in the stack
That breaks the camel's back
What breaks the camel's back, it's

Pressure like a drip, drip, drip that'll never stop, whoa
Pressure that'll tip, tip, tip 'til you just go pop, whoa-oh-oh
Give it to your sister, your sister's older
Give her all the heavy things we can't shoulder
Who am I if I can't run with the ball?
If I fall to
Pressure like a grip, grip, grip, and it won't let go, whoa
Pressure like a tick, tick, tick 'til it's ready to blow, whoa-oh-oh
Give it to your sister, your sister's stronger
See if she can hang on a little longer
Who am I if I can't carry it all?
If I falter

Under the surface
I hide my nerves and it worsens, I worry somethin' is gonna hurt us
Under the surface
The ship doesn't swerve, has it heard how big the iceberg is?
Under the surface
I think about my purpose, can I somehow preserve this?
Line up the dominoes, a light wind blows
You try to stop it tumbling, but on and on it goes

But wait, if I could shake the crushing weight of expectations
Would that free some room up for joy
Or relaxation, or simple pleasure?
Instead, we measure this growing pressure
Keeps growing, keep going, 'cause all we know is

Pressure like a drip, drip, drip that'll never stop, whoa
Pressure that'll tip, tip, tip 'til you just go pop, whoa-oh-oh
Give it to your sister, it doesn't hurt and
See if she can handle every family burden
Watch as she buckles and bends but never breaks
No mistakes, just
Pressure like a grip, grip, grip, and it won't let go, whoa
Pressure like a tick, tick, tick 'til it's ready to blow, whoa-oh-oh
Give it to your sister and never wonder
If the same pressure would've pulled you under
Who am I if I don't have what it takes?
No cracks, no breaks
No mistakes, no pressure! "
54,Fall in Love,Bailey Zimmerman," 
Heard you moved out to South Carolina
Just like you always said we would
Packed your bags in that old 4Runner
That I bought you when things were good
I'm glad to see the stop sign didn't hit ya
Bring you back to your senses
Oh, it waved you gone, goodbye
Yeah, it waved you gone, goodbye

I heard you found yourself a brand-new man
Put a rock on your finger and he vowed you a second chance
Built a house right by the coast
That ocean view is beautiful, but baby, I just want you to know
He don't know you like I did
Money talks, but I ain't buyin'

'Cause love's a smoke ring wrapped around your finger
One second, it's a blessin', and the next, it's already gone
A broken heart, I'm a walkin' testimony
My confession is a lesson that I'm pourin' out in this song
Oh-woah-woah, oh-woah-woah
You don't wanna fall in love
Oh-woah-woah, oh-woah-woah
You don't wanna fall in love

I seen your mama walkin' out the county market
And I stopped to ask her how she's been
Said she's missin' ya and tried to go convincin' ya
Not to settle down with him
She ain't wrong, the whole town knows it
You had a bed of roses, but girl, you couldn't walk that line
You can act like you're doin' fine

'Cause love's a smoke ring wrapped around your finger
One second, it's a blessin', and the next, it's already gone
A broken heart, I'm a walkin' testimony
My confession is a lesson that I'm pourin' out in this song
Oh-woah-woah, oh-woah-woah
You don't wanna fall in love
Oh-woah-woah, oh-woah-woah
You don't wanna fall in love


'Cause love's a smoke ring wrapped around your finger
One second, it's a blessin', and the next, it's already gone
A broken heart, I'm a walkin' testimony
My confession is a lesson that I'm pourin' out in this song
Oh-woah-woah, oh-woah-woah
You don't wanna fall in love
Oh-woah-woah, oh-woah-woah
You don't wanna fall in love
Oh-woah-woah, oh-woah-woah
You don't wanna fall in love
Oh-woah-woah, oh-woah-woah
Heard you moved out to South Carolina
Just like you always said we would"
55,Love Nwantiti Ah Ah Ah,CKay,"
(Tu-tu-tu, tu-tu-tu-tu-tu)
(Tu-tu-tu-tu, tu-tu-tu-tu-tu) Yeah

My baby, my valentine, yeah
Girl, na you dey make my temperature dey rise
If you leave me, I go die, I swear
You are like the oxygen I need to survive
I'll be honest
Your loving dey totori me
I am so obsessed
I want to chop your nkwobi

Ule, your body dey gbakam isi
Ule, open am make I see
Ule, nyem love nwantiti
Wey fit make a bad man sing ""Oh-ahh""

Ahh, ah-ah-ah-ah-ah, ah-ah-ah, ah-ah, ah-ah-ah
Ahh, ah-ah-ah-ah-ah, ah-ah-ah, ah-ah, ah-ah-ah
Ahh, ah-ah-ah-ah-ah, ah-ah-ah, ah-ah, ah-ah-ah
Ahh, ah-ah-ah-ah-ah, ah-ah-ah, ah-ah, ah-ah-ah

Baby girl, where you from come? Yeah
Your body na follow come, yeah
No be silicon, uh
Baba God e finish work, eh-eh-eh-eh-eh
Without you, I go fit lose my mind
Without you, I go fit fall and die
Without you, I go give all my life
Without you, without you

Ule, your body dey gbakam isi
Ule, open am make I see
Ule, nyem love nwantiti
Wey fit make a bad man sing ""Oh-ahh""

Ahh, ah-ah-ah-ah-ah, ah-ah-ah, ah-ah, ah-ah-ah
Ahh, ah-ah-ah-ah-ah, ah-ah-ah, ah-ah, ah-ah-ah
Ahh, ah-ah-ah-ah-ah, ah-ah-ah, ah-ah, ah-ah-ah
Ahh, ah-ah-ah-ah-ah, ah-ah-ah, ah-ah, ah-ah-ah

You mean the world to me
You're my living fantasy
I-I-I, I love you
I-I-I put no one above of you
Lover, don't give this love to nobody
Lover, don't call another nigga ""honey""
Lover, lover, I wanna be your lover
Forever, forever
Tu-tu-tu, tu-tu-tu-tu-tu
Tu-tu-tu-tu, tu-tu-tu-tu-tu "
56,Super Freaky Girl,Nicki Minaj," 
She's alright
That girl’s alright with me, yeah
Ayo (Hey, hey, hey, hey)

I can lick it, I can ride it while you slippin' and slidin'
I can do all them little tricks and keep the dick up inside it
You can smack it, you can grip it, you can go down and kiss it
And every time he leave me ’lone, he always tell me he miss it

He want a F-R-E-A-K (Freaky girl)
F-R-E-A-K (Freaky girl)
A-K, A-K, A-K
E-A-K (Freaky girl)
F-R-E-A-K (Freaky girl)

One thing about me, I'm the baddest alive
He know the prettiest bitch didn't come until I arrive
I don't let bitches get to me, I fuck they man if they try
I got a princess face, a killer body, samurai mind
They can't be Nicki, they so stupid, I just laugh when they try
A thong bikini up my ass, I think I'll go for a dive
His ex-bitch went up against me, but she didn't survive
On applications I write ""pressure"" 'cause that’s what I apply (Brr)
P-P-P-Pressure applied, can’t fuck a regular guy
Wetter than umbrellas and stickier than apple pie

I can lick it, I can ride it while you slippin' and slidin’
I can do all them little tricks and keep the dick up inside it
You can smack it, you can grip it, you can go down and kiss it
And every time he leave me 'lone, he always tell me he miss it

He want a F-R-E-A-K (Freaky girl)
F-R-E-A-K (Freaky girl)
A-K, A-K, A-K
E-A-K (Freaky girl)
F-R-E-A-K (Freaky girl)

'Cause, what the fuck? This ain't Chanel, nigga, custom down?
Like, what the fuck? This ain’t Burberry, custom brown
He said ""Could you throw it back while you touch the ground?""
Then he said ""Do that pussy purr?"" I said ""Yup, meow""
Hold up, fuck-boys, ain't need no for you to roll up
Ain't no need for you to double tap neither, scroll up
Keep these bitches on they toes like Manolo
Be on the lookout when I come through, BOLO
Oh, woah, elegant bitch with a ho glow
If it ain't big, then I won't blow
Eeny, meeny, miny, moe
Fuck is the tea? I just F'd a G (Let's go)
Made him say ""Uh,"" just ask Master P (Let's go)
Ball so hard, I just took a knee (Let's go)
Get me rocky ASAP, nigga, word to Rih (Let's go)
Freak
F-F-Freak
Some gyal a freak, gyal a freak
Gyal a freak, freak, freak, freak

I can lick it, I can ride it while you slippin' and slidin'
I can do all them little tricks and keep the dick up inside it
You can smack it, you can grip it, you can go down and kiss it
And every time he leave me 'lone, he always tell me he miss it

He want a F-R-E-A-K (Freaky girl)
F-R-E-A-K (Freaky girl)
A-K, A-K, A-K
E-A-K (Freaky girl)
F-R-E-A-K (Freaky girl) "
57,Hrs and Hrs,Muni Long,"
Oh, yeah
I don't usually do this, but, hm
Can I sing to you?
Yeah (yeah)

Yours, mine, ours
I could do this for hours
Sit and talk to you for hours
I wanna give you your flowers
And some champagne showers
Order shrimp and lobster towers
But it's me that gets devoured

Oh, when you do what you do, I'm empowered
You give me a superpower
Together the world could be ours
You sit me up on the counter
Instantly, it's thundershowers
Stormin' for a couple hours
When we finished, take a shower

I could do this for hours
And hours and hours
I could do this for hours
And hours and hours

I could do this for hours
And hours and hours
I could do this for hours
And hours, hours, I

Usually don't like nobody
And when I say nobody, I mean nobody
All thеse niggas full of shit
You're just a homie oncе they hit
Felt like givin' up on love
These niggas almost made me quit

Then I met you
When I met you
I knew this was it
I've never been in love like this

A love like ours
I pray for it on my knees
Every night for some hours
And hours, and hours, and hours, and hours, and hours

I could do this for hours
And hours and hours
I could do this for hours
And hours and hours

What's yours is mine and ours
And yours, mine and ours

I could sit and talk to you for hours
Sit and look at you for hours
Makin' love to you for hours
Layin' on your chest for hours
Tellin' you jokes for hours
Holdin' you close for hours
And hours and hours

Oh, oh, oh, oh
Ah, I
Oh, oh, oh, oh (hours and hours)
Ah, I (hours and hours)
Oh, oh, oh, oh (hours and hours)
Ah, I (hours and hours)
Yeah"
58,Sand in My Boots,Morgan Wallen," 
She asked me where I's from
I said ""Somewhere you've never been to
Little town outside of Knoxville""
Hiddin' by some dogwood trees
She tried talkin' with my accent
We held hands and waded into
That blue water
She left her flip-flops by my Red Wings on the beach

Yeah, but now I'm dodging potholes in my sunburnt Silverado
Like a heart-broke Desperado, headin' right back to my roots
Somethin' 'bout the way she kissed mе tells me she'd lovе Eastern Tennessee
Yeah, but all I brought back with me was some sand in my boots

I said ""Let's go shoot tequila""
So we walked back to that beach bar
She said ""Don't cowboys drink whiskey?"" (Huh)
So we drank bottom shelf
She said ""Damn, that sky looks perfect""
I said ""Girl, you've never seen stars like the ones back home""
And she said ""Maybe I should, see 'em for myself""

Yeah, but now I'm dodging potholes in my sunburnt Silverado
Like a heart-broke Desperado, headin' right back to my roots
Somethin' 'bout the way she kissed me tells me she'd love Eastern Tennessee
Yeah, but all I brought back with me was some sand in my boots

I said ""Meet me in the mornin'""
And she told me I was crazy
Yeah, but I still thought that maybe she'd show up

Aw, but now I'm dodging potholes in my sunburnt Silverado
Like a heart-broke Desperado, headin' right back to my roots
Somethin' 'bout the way she kissed me tells me she'd love Eastern Tennessee
Yeah, but all I brought back with me was some sand in my boots
Yeah, but all I brought back with me was some sand in my boots "
59,Mamiii,Becky G and Karol G," 

O-O-Ovy On The Drums
Salud, mami
Ah, ah, ah, ay

Lo que no sirve que no estorbe
Te metiste autogol por torpe
Te quedó grande este torque
Ya no estoy pa' que de mí te enamores, baby (Chi)
Sin Visa ni pasaporte (No)
Mandé tu falso amor de vacaciones (Chi, chi, chi, chi, chi, chi)
Pa' la mierda y nunca vuelvas
Que todo se te devuelva, no
De lo que me hiciste si no te acuerda'

No me vuelvas a llamar, que hasta boté el cеlular
De lo tóxico que erеs, se volvió perjudicial
Lo que se va, se va
Conmigo no te equivoques
De lo tóxico que eres, no te quiero ver más (Chi)

Llegué pa'l party, saca la botella
La que te quería, no sé quién es ella
Te dejé el review, no te puse ni una estrella
Y te olvidé porque no dejaste huella
Ya no miro pa'trás, ni pa' parquearme
Tengo a uno que está listo pa' llevarme
El segundo está esperando en el hotel
Y el tercero lo conozco esta noche (No, no)
No me llames, que mi número cambié (Cambié)
Si quieres que te lo dé (Dé)
Llama 1-800-jódete
No sé si me escuchaste
No me llames, que mi número cambié (Cambié)
Si quieres que te lo dé (Dé)
Llama 1-800-jódete (Jódete)

No me vuelvas a llamar, hasta boté el celular
De lo tóxico que eres, se volvió perjudicial
Lo que se va, se va, ah-ah
Conmigo no te equivoques
De lo tóxico que eres, no te quiero ver más (Ey)

Ay, yo lo lamento (Ah)
Tu' gana' de volver (Ey) murieron en el intento (Ah)
Lo hiciste ver como que perdiste el tiempo
Quedaste bien porque lo mío ni lo cuento (Papi)
Te veo en la' rede', no puedo creerlo, qué pena de ti (Pena de ti)
Yo que fui buena y tú qué gonorrea pagándome así (Nea, qué gonorrea)
Rata de dos patas, lo dijo Paquita
Un animal rastrero (Jaja)
Que se come todo lo que se atraviesa
Diablo, tú ere' un cuero (Cuero)
No digas ""Te quiero,"" mejor sé sincero (Ey)
No digas ""Te amo"" (Ah) porque eso fue en vano (Ah)
Llorando estaba' tú y como no te salí
Andas comiéndote a otra, pero estás pensando en mí (Chi)

No me vuelvas a llamar, hasta boté el celular
De lo tóxico que eres, se volvió perjudicial
Lo que se va, se va, ah-ah
Conmigo no te equivoques
De lo tóxico que eres, no te quiero ver más
Ouh
Repítelo, mami
""Que a veces no te cambian por algo mejor
Y ni siquiera por algo más rico""
KAROL G y Becky G
It's the real G's, baby (Jaja)
Ovy On The Drums "
