Rank,Musica,Artista,Letra
23,Stitches,Shawn Mendes," 

I thought that I'd been hurt before
But no one's ever left me quite this sore
Your words cut deeper than a knife
Now, I need someone to breathe me back to life

Got a feeling that I'm goin' under
But I know that I'll make it out alive
If I quit calling you my lover
Move on

You watch me bleed until I can't breathe, shaking
Falling onto my knees
And now that I'm without your kisses
I'll be needin' stitches
Trippin' over myself, aching
Begging you to come help
And now that I'm without your kisses
I'll be needin' stitches

Just like a moth drawn to a flame
Oh, you lured me in, I couldn't sense the pain
Your bitter heart, cold to the touch
Now, I'm gonna reap what I sow
I'm left seein' red on my own

Got a feeling that I'm goin' under
But I know that I'll make it out alive
If I quit calling you my lover
Move on

You watch me bleed until I can't breathe, shaking
Falling onto my knees
And now that I'm without your kisses
I'll be needin' stitches
Trippin' over myself, aching
Begging you to come help
And now that I'm without your kisses
I'll be needin' stitches

Needle and the thread, gotta get you outta my head
Needle and the thread, gonna wind up dead
Needle and the thread, gotta get you outta my head
Needle and the thread, gonna wind up dead
Needle and the thread, gotta get you outta my head
Needle and the thread, gonna wind up dead
Needle and the thread, gotta get you outta my head
Get you outta my head
You watch me bleed until I can't breathe, shaking
Falling onto my knees (Falling onto my knees)
And now that I'm without your kisses
I'll be needin' stitches (I'll be needin' stitches)
Trippin' over myself, aching
Begging you to come help (Begging, baby, please)
And now that I'm without your kisses
I'll be needin' stitches

Now that I'm without your kisses
Yeah, I'll be needin' stitches
Now that I'm without your kisses
Yeah, I'll be needin' stitches "
24,Hotline Bling,Drake," 
You used to call me on my
You used to, you used to
Yeah

You used to call me on my cell phone
Late-night when you need my love
Call me on my cell phone
Late-night when you need my love
And I know when that hotline bling
That can only mean one thing
I know when that hotline bling
That can only mean one thing

Ever since I left the city, you
Got a reputation for yourself now
Everybody knows and I feel left out
Girl, you got me down, you got me stressed out
'Cause ever since I left the city, you
Started wearin' less and goin' out more
Glasses of champagne out on the dance floor
Hangin' with some girls I never seen before

You used to call me on my cell phone
Late-night when you need my love
Call me on my cell phone
Late-night when you need my love
I know when that hotline bling
That can only mean one thing
I know when that hotline bling
That can only mean one thing

Ever since I left the city, you, you, you
You and me, we just don't get along
You make me feel like I did you wrong
Goin' places where you don't belong
Ever since I left the city, you
You got exactly what you asked for
Runnin' out of pages in your passport
Hangin' with some girls I've never seen before

You used to call me on my cell phone
Late-night when you need my love
Call me on my cell phone
Late-night when you need my love
And I know when that hotline bling
That can only mean one thing
I know when that hotline bling
That can only mean one thing

These days, all I do is
Wonder if you're bendin' over backwards for someone else
Wonder if you're rollin' up a Backwoods for someone else
Doing things I taught you, gettin' nasty for someone else
You don't need no one else
You don't need nobody else, no
Why you never alone?
Why you always touchin' road?
Used to always stay at home
Be a good girl, you was in the zone
Yeah, you should just be yourself
Right now, you're someone else
You used to call me on my cell phone
Late-night when you need my love
Call me on my cell phone
Late-night when you need my love
And I know when that hotline bling
That can only mean one thing
I know when that hotline bling
That can only mean one thing

Ever since I left the city—
 "
25,Cold Water,Major Lazer," 
Everybody gets high sometimes, you know
What else can we do when we're feelin' low?
So take a deep breath and let it go
You shouldn't be drowning on your own

And if you feel you're sinking, I will jump right over
Into cold, cold water for you
And although time may take us into different places
I will still be patient with you
And I hope you know

I won't let go
I'll be your lifeline tonight
I won't let go
I'll be your lifeline tonight

'Cause we all get lost sometimes, you know?
It's how we learn and how we grow
And I wanna lay with you 'til I'm old, o-old
You shouldn't be fighting on your own

And if you feel you're sinking, I will jump right over
Into cold, cold water for you
And although time may take us into different places
I will still be patient with you
And I hope you know

I won't let go (And I won't let go, no-no, no-no, no, I won't)
I'll be your lifeline tonight
I won't let go
I'll be your lifeline tonight (I won't let, yeah, yeah)

Come on, come on, save me from my rocking boat
I just wanna stay afloat, I'm all alone (Float, float, float, float)
And I hope, I hope someone's gonna take me home
Somewhere I can rest my soul (Rest my soul)
I need to know

You won't let go (And I won't let go, no-no, no-no, no, I won't)
I'll be your lifeline tonight
You won't let go
I'll be your lifeline tonight

I won't let go
I won't let go "
26,Send My Love To Your New Lover,Adele,"
Just the guitar
Okay, cool

This was all you, none of it me
You put your hands on, on my body and told me, mmm
You told me you were ready
For the big one, for the big jump
I'd be your last love, everlasting, you and me, mmm
That was what you told me

I'm giving you up
I've forgiven it all
You set me free

Send my love to your new lover
Treat her better
We've gotta let go of all of our ghosts
We both know we ain't kids no more
Send my love to your new lover
Treat her better
We've gotta let go of all of our ghosts
We both know we ain't kids no more

I was too strong, you were trembling
You couldn't handle the hot heat rising (Rising), mmm
Baby, I'm still rising
I was running, you were walking
You couldn't keep up, you were falling down (Down), mmm
There's only one way down

I'm giving you up
I've forgiven it all
You set me free, oh

Send my love to your new lover
Treat her better
We've gotta let go of all of our ghosts
We both know we ain't kids no more
Send my love to your new lover
Treat her better
We've gotta let go of all of our ghosts
We both know we ain't kids no more

If you're ready, if you're ready
If you're ready, I am ready
If you're ready, if you're ready
We both know we ain't kids no more
No, we ain't kids no more
I'm giving you up
I've forgiven it all
You set me free

Send my love to your new lover
Treat her better
We've gotta let go of all of our ghosts
We both know we ain't kids no more
Send my love to your new lover
Treat her better
We've gotta let go of all of our ghosts
We both know we ain't kids no more

If you're ready, if you're ready
(Send my love to your new lover)
If you're ready, are you ready?
(Treat her better)
We've gotta let go of all of our ghosts
We both know we ain't kids no more
If you're ready, if you're ready
(Send my love to your new lover)
If you're ready, are you ready?
(Treat her better)
We've gotta let go of all of our ghosts
We both know we ain't kids no more "
27,Roses,The Chainsmokers," 
Take it slow, but it's not typical
He already knows that my love is fire
His heart was a stone, but then his hands roam
I turned him to gold and took him higher

Well, I'll be your daydream, I'll be your favorite things
We could be beautiful
Get drunk on the good life, I'll take you to paradise
Say you'll never let me go

Deep in my bones, I can feel you
Take me back to a time only we knew, hideaway
We could waste the night with an old film
Smoke a little weed on my couch in the back room, hideaway
Say you'll never let me go
Say you'll never let me go

Ahh, ahh, ahh
Ahh, ahh, ahh
Ahh, ahh, ahh
Say you'll never let me go

Say you'll never let me go
Say you'll never let me go

Ahh, Ahh
Ahh, Ahh
Say you'll never let me go

Deep in my bones, I can feel you
Take me back to a time only we knew, hideaway
We could waste the night with an old film
Smoke a little weed on my couch in the back room, hideaway
Say you'll never let me go
Say you'll never let me go

Ahh, ahh, ahh
Ahh, ahh, ahh
Ahh, ahh, ahh
Say you'll never let me go

Ahh
Say you'll never let me go
Ahh "
28,Treat You Better,Shawn Mendes," 
I won't lie to you
I know he's just not right for you
And you can tell me if I'm off, but I see it on your face
When you say that he's the one that you want
And you're spending all your time in this wrong situation
And anytime you want it to stop

I know I can treat you better than he can
And any girl like you deserves a gentleman
Tell me, why are we wasting time
On all your wasted cryin'
When you should be with me instead?
I know I can treat you better
Better than he can

I'll stop time for you
The second you say you'd like me to
I just wanna give you the loving that you're missing
Baby, just to wake up with you
Would be everything I need and this could be so different
Tell me what you want to do

'Cause I know I can treat you better than he can
And any girl like you deserves a gentleman
Tell me, why are we wasting time
On all your wasted cryin'
When you should be with me instead?
I know I can treat you better
Better than he can
Better than he can

Give me a sign
Take my hand, we'll be fine
Promise I won't let you down
Just know that you don't
Have to do this alone
Promise I'll never let you down

'Cause I know I can treat you better than he can
And any girl like you deserves a gentleman
Tell me, why are we wasting time
On all your wasted cryin'
When you should be with me instead?
I know I can treat you better
Better than he can
Better than he can
Better than he can "
29,Too Good,Drake," 
Oh yeah, yeah, yeah
Oh yeah, yeah, yeah
Yeah

Look...I don't know how to talk to you
I don't know how to ask you if you're okay
My friends always feel the need to tell me things
Seems like they're just happier than us these days
Yeah
These days I don't know how to talk to you
I don't know how to be there when you need me
It feels like the only time you see me
Is when you turn your head to the side and look at me differently
Yeah

And last night I think I lost my patience
Last night, I got high as your expectations
Last night, I came to a realization
And I hope you can take it
I hope you can take it, oh

I'm too good to you
I'm way too good to you
You take my love for granted
I just don't understand it
No, I'm too good to you
I'm way too good to you
You take my love for granted
I just don't understand it

I don't know how to talk to you
I just know I found myself getting lost with you
Lately you just make me work too hard for you
Got me on flights overseas, and I still can't get across to you

And last night I think I lost my patience
Last night, I got high as your expectations
Last night, I came to a realization
And I hope you can take it
I hope you can take it, oh

I'm too good to you
I'm way too good to you
You take my love for granted
I just don't understand it
No, I'm too good to you
I'm way too good to you
You take my love for granted
I just don't understand it

Years go by too fast
I can't keep track
How long did we last?
I feel bad for asking
It can't end like this
We gotta take time with this
Cock up yuh bumper, sit down pon it
Let me see if this is something I can fix (Six)
You got somebody other than me
Don't play the victim when you're with me
Free time is costing me more than it seems
Sacrificing things
And I wanna tell you my intentions
I wanna do the things that I mention
I wanna benefit from the friendship
I wanna get the late night message from you, from you
I put my hands around you
Gotta get a handle on you
Gotta get a handle on the fact that I
I'm too good to you
I'm way too good to you
You take my love for granted
I just don't understand it
No, I'm too good to you
I'm way too good to you
You take my love for granted
I just don't understand it
Gyal a you mi waan
Pay fi yuh visa meck yo fly out regular
Baby, cock up yuh bumper, sit down pon it
Gyal yo pum pum good and yuh fit
Mi wi give you everything weh deh in my wallet
And in my pocket
Cock up yuh bumper, sit down pon it
Gyal yo pum pum good and yuh fit
Mi wi give you everything weh deh in my wallet
And in my pocket "
30,Low Life,Future,"
High, high, get, get, gettin' high, everybody gettin' high
Get, get, get, gettin' high, you're unbelievably high

I just took some molly, what else? (Hey)
Got some bitch from Follies with us ('Scuse me, 'scuse me)
She gon' fuck the squad, what else? (I swear)
I'ma fuck her broads, what else? (Yeah, yeah!)
Bitch from Pakistan, what up? ('Rari!)
Ferraris and them Lambs, what else? (Skrrt, skrrt!)
'Bout to fuck this club up, what else? (Yeah, yeah!)

(Metro Boomin want some more, nigga!) (Turn up)

I turn the Ritz into a poor house (Turn up)
It's like eviction number four now (Woo)
Go 'head and ash it on the floor now (Swear)
Girl, go 'head and show me how you go down
And I feel my whole body peakin' (Yeah)
And I'm fuckin' anybody with they legs wide (Racks)
Gettin' faded with some bitches from the West Side (Woo)
East coast nigga reppin' North Side, never waste a ho's time (Freebandz)
Bitch, I'm on my own time, fuck a nigga co-sign (Woo)
Always change my number and my phone line (And my, and my)
Baby girl, I don't lie, used to have no money for a crib (Turn up)
Now my room service bill cost your whole life (Ayy)
If they try to stunt me, I go all out military (Turn up)
I'm camo'd all out, like I'm in the military (Turn up)
And free up all my niggas locked up in the penitenti' (Swear)
'Cause I'm always reppin' for that low life

Reppin' for that low life (Turn up), low life, low life
Low life, know I'm reppin' for that low
Low life (Representin'), yeah (I'm representin')
Said I'm reppin' for that low life (Representin')
Low life, low life, low life, low life (I'm representin' for that low life)
Said I'm repping for that low life (I'm reppin', that's reppin', I'm reppin')
Low life, low life, low life (Rep, rep, rep, rep, rep, rep, rep, woo, woo, woo, woo)
Yeah
Wake up, take a sip of Ace of Spade like it's water
I been on the molly and them Xans with your daughter
If she catch me cheating, I won't ever tell her, ""sorry""
If she catch me cheating, I will never tell her, ""sorry""
Porsches in the valet, I got Bentleys, I got 'Raris
Taking pain pills on the plane, gettin' chartered
Poppin' tags on tags, I was starvin'
Bitch, I got the juice and the carbine
Turn a five star hotel to a traphouse
Roaches everywhere, like we forgot to take the trash out
Flood my cross with ice, gettin' money my religion
Got my baby momma and my side bitch kissin'
I turn the Ritz into a lean house
This the sixth time gettin' kicked out
I can't feel my face, I'm on Adderall, nauseous
Niggas tryna ride my fuckin' wave, now they salty
Runnin' with the wave, get you killed quick
Shoot you in your back like you Ricky
Li'l Mexico, with no life to afterlife
My whole life, my whole life
'Cause I'm always reppin' for that low life (Wait), low life, low life
Low life, know I'm reppin' for that low
Low life (Representin'), yeah (I'm representin')
Said I'm reppin' for that low life (Representin', wait)
Low life, low life, low life, low life (I'm representin' for that low life, for the low life)
Said I'm repping for that low life (For the low life, I'm reppin' for the low life)
Low life, low life, low life (Wait, wait, low life)
Yeah

Yeah, they stereotypin'
'Cause they know a nigga keep ten rifles (Ten rifles)
And they know a nigga keep ten snipers (Ten snipers)
Keepin' baby bottles like we wearin' diapers
Yeah, they stereotypin'
'Cause they know a nigga keep twenty rifles
And they know a nigga keep twenty snipers
And they know a nigga keep ten wifeys (Ha-ha-ha!)
Sniper, sniper, sniper, sniper, sniper
Wifey, wifey, wifey, wifey, wifey
That's your wifey, wifey, wifey, wifey, wifey?
I think I like her, like her, like her, like her
That's your wifey, wifey, wifey, wifey, wifey?
I think I like her, like her, like her, like her
Oh, that's your wifey, wifey, wifey, wifey, wifey?
I think I like her, like her, like her, like her, ha
Getting high, getting high, getting high, everybody getting high
Getting high, getting high, getting high, everybody getting high
Getting high, getting high, getting high, everybody getting high
Getting high, getting high, getting high, and I'm the reason why
I just took some molly, what else? (Getting high, getting high, getting high, everybody getting high)
Got some bitch from Follies with us (Getting high, getting high, getting high, everybody getting high)
She gon' fuck the squad, what else? (Getting high, getting high, getting high, everybody getting high)
I'ma fuck her broads, what else? (Getting high, getting high, getting high, and I'm the reason why)
Bitch from Pakistan, what up?
Ferraris and them Lambs, what else?
'Bout to fuck this club up, what else?

We 'bout to fuck this club up, what else? "
31,What Do You Mean?,Justin Bieber,"

What do you mean?  Oh, oh
When you nod your head yes, but you wanna  say no
What do you mean?  Hey, yeah
When you don't want me to move, but you tell me to go
What do  you mean? Oh,  what do you mean?
Said you're runnin' outta time,  what do you mean?
Oh, oh, oh, what do you mean?
Better make up your mind, what do you mean?

You're so indecisive of what I'm sayin'
Tryna catch the beat, make up your heart
Don't know if you're happy or complainin'
Don't want for us to end, where do I start?

First you wanna go to the left, then you wanna turn right (Right)
Wanna argue all day, makin' love all night (All night)
First you're up, then you’re down, and then  between ('Tween)
Oh, I really wanna know

What do you mean? Oh, oh
When you nod your head yes, but you wanna say no
What do you mean? Hey, yeah
When you don't want me to move, but you tell me to go
What do you mean? Oh, what do you mean?
Said you're runnin' outta time, what do you mean?
Oh, oh, oh, what do you mean? Better make up your mind
What do you mean?

You're overprotective when I'm leavin'
Tryna compromise, but I can’t win
You wanna make a point, but you keep preachin'
You had me from the start, won't let this end

First you wanna go to the left, then you wanna turn right
(Turn right)
Wanna argue all day, makin' love all night (All night)
First you're up, then you’re down, and then between ('Tween)
Oh, I really wanna know

What do you mean? Oh, oh (Yeah, yeah, yeah, yeah)
When you nod your head yes, but you wanna say no
What do you mean? (Oh, what do you mean?) Hey, yeah
When you don't want me to move, but you tell me to go
What do you mean? (I wanna know, ooh)
Oh, what do you mean? (Ooh)
Said you're runnin' outta time, what do you mean? (Oh, baby)
Oh, oh, oh, what do you mean? Better make up your mind
What do you mean? (Don't be so selfish, baby, yeah, yeah) Oh, oh
When you nod your head yes, but you wanna say no
What do you mean? (You're so confusin', baby) Hey, yeah
When you don't want me to move (Hey), but you tell me to go
What do you mean? (Be more straightforward)
Oh, what do you mean? (Hey, ah, ah, ah)
Said you're runnin' outta time, what do you mean? (Hey, ah, ah, ah)
Oh, oh, oh, what do you mean?
Better make up your mind, what do you mean? "
32,The Hills,The Weeknd," 
Yeah
Yeah
Yeah

Your man on the road, he doin' promo
You said, ""Keep our business on the low-low""
I'm just tryna get you out the friend zone
'Cause you look even better than the photos
I can't find your house, send me the info
Drivin' through the gated residential
Found out I was comin', sent your friends home
Keep on tryna hide it, but your friends know

I only call you when it's half-past five
The only time that I'll be by your side
I only love it when you touch me, not feel me
When I'm fucked up, that's the real me
When I'm fucked up, that's the real me, yeah
I only call you when it's half-past five
The only time I'd ever call you mine
I only love it when you touch me, not feel me
When I'm fucked up, that's the real me
When I'm fucked up, that's the real me, babe

I'ma let you know and keep it simple
Tryna keep it up don't seem so simple
I just fucked two bitches 'fore I saw you
And you gon' have to do it at my tempo
Always tryna send me off to rehab
Drugs started feelin' like it's decaf
I'm just tryna live life for the moment
And all these motherfuckers want a relapse

I only call you when it's half-past five
The only time that I'll be by your side
I only love it when you touch me, not feel me
When I'm fucked up, that's the real me
When I'm fucked up, that's the real me, yeah
I only call you when it's half-past five
The only time I'd ever call you mine
I only love it when you touch me, not feel me
When I'm fucked up, that's the real me
When I'm fucked up, that's the real me, babe

Hills have eyes, the hills have eyes
Who are you to judge? Who are you to judge?
Hide your lies, girl, hide your lies (Hide your lies, oh, baby)
Only you to trust, only you
I only call you when it's half-past five
The only time that I'll be by your side
I only love it when you touch me, not feel me
When I'm fucked up, that's the real me
When I'm fucked up, that's the real me, yeah
I only call you when it's half-past five
The only time I'd ever call you mine
I only love it when you touch me, not feel me
When I'm fucked up, that's the real me
When I'm fucked up, that's the real me, babe
"
33,Just Like Fire,Pink," 
I know that I am runnin' out of time
I want it all, mm-mm
And I'm wishin' they'd stop tryin' to turn me off
I want it on, mm-mm
And I'm walkin' on a wire, tryin' to go higher
Feels like I'm surrounded by clowns and liars
Even when I give it all away
I want it all, mm-mm

We came here to run it, run it, run it
We came here to run it, run it, run it

Just like fire, burnin' up the way
If I could light the world up for just one day
Watch this madness, colorful charade
No one can be just like me any way
Just like magic, I'll be flyin' free
I'mma disappear when they come for me
I kick that ceiling, what you gonna say?
No one can be just like me anyway
Just like fire, uh

And people like to laugh at you cause they are all the same, mmm
See I would rather we just go a different way than play the game
And no matter the weather, we can do it better
You and me together, forever and ever
We don't have to worry 'bout a thing, 'bout a thing

We came here to run it, run it, run it
We came here to run it, run it, run it

Just like fire, burnin' up the way
If I could light the world up for just one day
Watch this madness, colorful charade
No one can be just like me any way
Just like magic,  I'll be flyin' free
I'mma disappear when they come for me
I kick that ceiling, what you gonna say?
No one can be just like me anyway
Just like fire, fire, fire
Run it, run it, run it
We came here to run it, run it, run it

So look, I came here to run it
Just cause nobody's done it
Y'all don't think I can run it
But look, I been here, I done it
Impossible? Please
Watch, I do it with ease
You just gotta believe
Come uh, come uh with me
Oh, what's a girl to do? (What, what?)
Hey, what's a girl to do? (What, what?)
Oh, what's a girl to do? (What, what?)
Mmmm, what's a girl to do?
Just like fire, burnin' up the way
If I could light the world up for just one day
Watch this madness, colorful charade
No one can be just like me any way

Just like fire, burnin' up the way
If I could light the world up for just one day
Watch this madness, colorful charade
No one can be just like me any way
Just like magic,  I'll be flyin' free
I'mma disappear when they come for me
I kick that ceiling, what you gonna say?
No one can be just like me anyway
Just like fire, fire

Run it, run it, run it
Just like fire
Run it, run it, run it "
