Rank,Musica,Artista,Letra
44,Beat Box,SpotemGottem," 
Let go
(D— Damn E, this shit exclusive) Stretch gang
Face shots to the face, don't trip on your lace
Mafia

Bur— Bur— Burn away a carbon beam, knock your legs off
Tried to get away from me, had a standoff
Hit him in the spine, knock his dreads off
My woadie just caught a body, I nicknamed him Randy Moss
Thuggin' in my Reeboks, riding with a G-SHOCK
Shh, I heard he shot, Draco make 'em beat box
He made that sharp turn, woadie spot 'em, peeled the car
Had a mask on, Draco make 'em beat box

In Miami with my motherfuckin' heat out
With another nigga bitch, said she got her feet out
I walked in the party, I'm on my big four shit
Ready to get it started, bitch, I got no sense
Oh, he the plug, ridin' 'round with four bricks
Call me Kobe, twenty-four on me
Can't fuck wit' her no more, bad lil' bitch, she do the most
I get my groove on every time I see them folks
I got the antidote, I'm thinking that's something you need to know
I'm smooth and I'm cold, she know my wrist on froze
Skinny jeans on with a big bankroll
She playin' my song, I got her takin' off her thong
I'm tryna get it on, she feeling all over my Peter bone
Two rights don't make a wrong, it just go on and on
I'm kickin' shit like Jackie Chan today, got my kicks on
I aim, I hit my target, I'ma up this bitch regardless

Bur— Bur— Burn away a carbon beam, knock your legs off
Tried to get away from me, had a standoff
Hit him in the spine, knock his dreads off
My woadie just caught a body, I nicknamed him Randy Moss
Th— Th— Thuggin' in my Reeboks, riding with a G-SHOCK
Shh, I heard he shot, Draco make 'em beat box
OG made that sharp turn, woadie spot 'em, peeled the car
Had a mask on, Draco make 'em beat box "
45,Laugh Now Cry Later,Drake," 
Woah, woah
Yeah

Sometimes we laugh and sometimes we cry, but I guess you know now, baby
I took a half and she took the whole thing, slow down, baby
We took a trip, now we on your block and it's like a ghost town, baby
Where do these niggas be at when they say they doin' all this and all that?

Tired of beefin' you bums, you can't even pay me enough to react
Been wakin' up in the crib and sometimes I don't even know where I'm at
Please don't play that nigga songs in this party, I can't even listen to that
Anytime that I ran into somebody, it must be a victory lap, ayy
Shawty, come sit on my lap, ayy, they sayin' Drizzy just snap
Distance between us is not like a store, this isn't a closeable gap, ayy
I've seen some niggas attack and don't end up makin' it back

I know that they at the crib goin' crazy, down bad
What they had didn't last, damn, baby

Sometimes we laugh and sometimes we cry, but I guess you know now, baby
I took a half and she took the whole thing, slow down, baby
We took a trip, now we on your block and it's like a ghost town, baby
Where do these niggas be at when they say they doin' all this and all that?

I'm in the trenches, relax
Can you not play that lil' boy in the club? 'Cause we do not listen to rats
We in Atlanta, I buy her a wig, she tellin' me Tae is the best
Point at the nigga who act like a killer, but you only one from the 'net
I'm like DaBaby, I'm not just a rapper, you play with me, you gon' get stretched
Ooh-oh
Bring Drake to the hood, surround Drake around Dracs
Even though I got a case, I'ma do what it take
And I never been embraced
And the money's hard to make
So I bet they on they face right now

I know that they at the crib goin' crazy, down bad
What they had didn't last, damn, baby

Sometimes we laugh and sometimes we cry, but I guess you know now, baby
I took a half and she took the whole thing, slow down, baby
We took a trip, now we on your block and it's like a ghost town, baby
Where do these niggas be at when they say they doin' all this and all that?

When he tell the story, that's not how it went
Know they be lyin', a hundred percent
Moved out the Ritz and forgot 'bout the Bent'
Valet just called me to tell me come get it
Knocked that boy off and I don't want no credit
If it was me, they wouldn't regret it
Left me for dead and now they wan' dead it, yeah
Heart is still beatin', my niggas still eatin'
Backyard, it look like the Garden of Eden
Pillow talk with 'em, she spillin' the tea
And then shawty came back and said she didn't mean it
It's hard to believe it
I know that they at the crib goin' crazy, down bad
What they had didn't last, damn, baby

Sometimes we laugh and sometimes we cry, but I guess you know now, baby
I took a half and she took the whole thing, slow down, baby
We took a trip, now we on your block and it's like a ghost town, baby
Where do these niggas be at when they say they doin' all this and all that? "
46,Need to Know,Doja Cat," 
Yeah

Wanna know what it's like (Like)
Baby, show me what it's like (Like)
I don't really got no type (Type)
I just wanna fuck all night
Yeah-yeah, oh-woah-woah (Oh, ooh, mmm)
Baby, I need to know, mmm (Yeah, need to know)
I just been fantasizin' (Size)
And we got a lotta time (Time)
Baby, come throw the pipe (Pipe)
Gotta know what it's like (Like)
Yeah-yeah, oh-woah-woah
Baby, I need to know, mmm

What's your size? (Size)
Add, subtract, divide ('Vide)
Daddy don't throw no curves (Curves)
Hold up, I'm goin' wide (Wide)
We could just start at ten (Ten)
Then we can go to five (Five)
I don't play with my pen (Pen)
I mean what I writе
Yeah-yeah, woah-woah-woah
I just can't help but bе sexual (Oh)
Tell me your schedule (Yeah)
I got a lotta new tricks for you, baby
Just sayin' I'm flexible (I will)
I do what I can to get you off (I will)
Might just fuck him with my makeup on (I will)
Eat it like I need an apron on (Yeah, oh)
Eat it 'til I need to change my thong (Yeah, ayy)
We could do it to your favorite song (Yeah, ayy)
Take a ride into the danger zone
You know my nigga be buggin' me
I just be wonderin' if you can fuck on me better
Itchin' for me like an ugly sweater
Need it in me like a Chuck E. need cheddar
I need to know

Wanna know what it's like (Like)
Baby, show me what it's like (Like)
I don't really got no type (Type)
I just wanna fuck all night
Yeah-yeah, oh-woah-woah (Oh, ooh, mmm)
Baby, I need to know, mmm (Yeah, need to know)
I just been fantasizin' (Size)
And we got a lotta time (Time)
Baby, come throw the pipe (Pipe)
Gotta know what it's like (Like)
Yeah-yeah, oh-woah-woah
Baby, I need to know, mmm

You're exciting, boy, come find me
Your eyes told me, ""Girl, come ride me""
Fuck that feeling both us fighting
Could he try me? (Yeah) Mmm, most likely

Tryna see if you could handle this ass
Prolly give his ass a panic attack
Sorry if I gave a random erection
Prolly thinkin' I'm a telekinetic
Oh, wait, you a fan of the magic?
Poof, pussy like an Alakazam
I heard from a friend of a friend
That that dick was a ten out of ten
I can't stand it, just one night me
Clink with the drink, gimme a sip
Tell me what's your kink, gimme the dick
Spank me, slap me, choke me, bite me (Ew)
Oh, wait, I can take it (Ah)
Give a fuck 'bout what your wifey's sayin' (Yeah)
Wanna know what it's like (Like)
Baby, show me what it's like (Like)
I don't really got no type (Type)
I just wanna fuck all night
Yeah-yeah, oh-woah-woah (Oh, ooh, mmm)
Baby, I need to know, mmm (Yeah, need to know)
I just been fantasizin' (Size)
And we got a lotta time (Time)
Baby, come throw the pipe (Pipe)
Gotta know what it's like (Like)
Yeah-yeah, oh-woah-woah
Baby, I need to know, mmm "
47,Wants and Needs,Drake," 
(Six)
Yeah
Yeah
Yeah

Leave me out the comments, leave me out the nonsense
Speakin' out of context, people need some content
Niggas tryna keep up, shit is not a contest
Whippin' Benz concept
Heaven-sent, God-sent
Least that's what my mom says
Proof is in the progress, money's not a object
Busy than a motherfucker, you know how my job get
Barkin' up the wrong tree, you know how the dogs get
Haven't fallen off yet, yee
Come with a classic, they come around years later and say it's a sleeper
The earrings are real, the petty is real, might charge my ex for a feature
Deposit the money to Brenda, LaTisha, or Linda, Felicia
She came for me twice, I didn't even nut for her once, you know I'm a pleaser
Forty-two millimeter, was made in Geneva
Yeah, I probably should go to Yeshiva, we went to Ibiza
Yeah, I probably should go link with Yeezy, I need me some Jesus
But soon as I started confessin' my sins, he wouldn't believe us

Sins, I got sins on my mind
And some M's, got a lot of M's on my mind
And my friends, yeah, I keep my friends on my mind
I'm in love, I'm in love with two girls at one time
And they tens, that's why I got ten on my mind
I got M's, got a lot of M's on my mind
And my friends, yeah, I keep my friends on my mind
Should repent, I need me some Jesus in my life
Amen

I'm from the four, but I love me a threesome
DM her, delete it, she my lil' secret
He tryna diss me to blow up, I peep it
I can't respond, we just go at your people
If I left some racks on the bed, you can keep it
This shit gettin' deeper and deeper, I dig it
My shovel wasn't bent, I was broke, had to fix it
A shark in the water, you swim with the lil' fishes
I hit today, by tomorrow, she miss it
I grab her neck, she look up, then I kiss it
I'm not a GOAT, but I fit the description
I like to pour, so I get the prescription
We walk around with them bands in our britches
This gun ain't gon' jam, when I blow, I ain't missin'
I'm droppin' hit after hit, I'm just chillin'
But I'll send a hit while I chill with my children
Bigger the business, the bigger the office
I fucked 'round and found me a swag, then I caught up
They call for my artists, they makin' me offers
I don't even bargain, I'll start from the bottom
I lost a Ferrari, Las Vegas, Nevada
I woke up the followin' day and went harder
I'm crackin' my shell now, they see that I'm smarter
I gotta get money, I love to get charter
I gave her four Birkins and one's for her daughter
I can't let 'em down, walk around with my guard up
I'm screamin' out ""YOLO,"" yeah, that's still the motto
I know I be on some shit that they ain't thought of
Sins, I got sins on my mind
And some M's, got a lot of M's on my mind
And my friends, yeah, I keep my friends on my mind
I'm in love, I'm in love with two girls at one time
And they tens, that's why I got ten on my mind
I got M's, got a lot of M's on my mind
And my friends, yeah, I keep my friends on my mind
Should repent, I need me some Jesus in my life
Amen "
48,Way 2 Sexy,Drake," 
I'm too sexy for my shirt
Too sexy for my shirt
So sexy, it hurts
I'm too sexy for Milan
Too sexy for Milan
New York or Japan

Yeah, woah, woah, woah
I'm too sexy for this syrup
Too sexy for your girl
Too sexy for this world
Too sexy for this ice
Too sexy for that jack, yeah, yeah
I'm too sexy for this chain
Too sexy for your gang
Too sexy for this fame, yeah, yeah
I'm too sexy for the trap
Too sexy for that cap
Too sexy for that jack, yeah, yeah

Okay, alright, that's fine, okay (Okay)
I'm feelin' too sexy to accept requests (Way too sexy)
And I'm way too sexy to go unprotected (Way too sexy)
And she popped a Tesla, now she goin' electric
Okay, alright, that's fine, okay
Think we got too sexy for that metro housin' (Way too sexy)
Diamond popped out, almost swallowed sixty thousand (Sixty piece)
Section need more tings in here, I like it crowded, ayy (Woah, woah)
Yeah, I like it crowded
Oh, you like the boy? Well, tell me what you like about him
You a turnt up little thotty, ain't no wife about it
I'ma fuck her friends and send her back to Metro housin'

Yeah, woah, woah, woah
I'm too sexy for this syrup
Too sexy for your girl
Too sexy for this world
Too sexy for this ice
Too sexy for that jack, yeah, yeah
I'm too sexy for this chain
Too sexy for your gang
Too sexy for this fame, yeah, yeah
I'm too sexy for the trap
Too sexy for that cap
Too sexy for that jack, yeah, yeah (Yeah)

I pop out, get ghost on a bitch, she don't know where I went (Where I go?)
Pray for all my dogs, all my niggas behind the fence (Prayer)
Drippin' in it, I be spillin' in it, new designer gear bicoastal
Pay attention to the detail, goin' two-tone on a choker
Young niggas always ready to murk somethin', call them some smokers
Young nigga havin' motion, he gon' make sure the car get—
Did a 360 windmill when I left the scene
That's that action, her best work on her knees
Too sexy for this cash
Too sexy for this syrup
Too sexy for these pills, I'm too sexy for this
I get cash wherever I fly, got bitches sexin' on me
Money, cars, and all this jewelry make a bitch look sexy
I get cash wherever I fly, got bitches sexin' on me
Yeah, woah, woah, woah
I'm too sexy for this syrup
Too sexy for your girl
Too sexy for this world
Too sexy for this ice
Too sexy for that jack, yeah, yeah
I'm too sexy for this chain
Too sexy for your gang
Too sexy for this fame, yeah, yeah
I'm too sexy for the trap
Too sexy for that cap
Too sexy for that jack, yeah, yeah

Too sexy to count (Ah), fetty (Oh)
My neck baguetty (Hoo)
Red diamonds, spaghetti (Oh)
This paper, I shred it (Yeah)
I swindled, no sweatin'
I saw you (Bitch), beggin' (Ho)
Goddamn, you petty (Ha)
I ain't done spending (Yeah)
No penny pinch, I spend it (Spend)
Bags in and out (Let's get bags)
My man ain't gon' steal it (On God)
Hundred bags for her (Hundred bags)
Make these young hoes wish they was rich (Woo)
All-green gators, they look like a switch
Giorgio, I spent twenty-six licks ('Mani)
I'm too sexy (Yeah)
My neck (Yeah), baguetties
Molest me (Woah), caress me (Woah)
I'll let you (Ah), todayski (Ski)
I been kickin' shit (Woah, woah), might need a prosthetic (Yeah)
I pray to the chopper under my pillow, tooth fairy (Woo) "
49,Telepatia,Kali Uchis," 

Quién lo diría que se podría
Hacer el amor por telepatía
La luna está llena, mi cama vacía
Lo que yo te haría
Si te tuviera de frente, la mente te la volaría
De noche y de día, de noche y de día

You know I'm just a flight away
If you want it, you could take a private plane
A kilómetros estamos conectando
Y me prendes aunque no me estés tocando
You know I got a lot to say
All these voices in the background of my brain
Y me dicen todo lo que estás pensando
Me imagino lo que ya estás maquinando

Quién lo diría que se podría
Hacer el amor por telepatía
La luna está llena, mi cama vacía
Lo que yo te haría
Si te tuviera de frente, la mente te la volaría
De noche y de día, de noche y de día

You know that I can see right through you
I can read your mind, I can read your mind
What you wanna do?
It's written all over your face, times two
'Cause I can read your mind, I can read your mind
I can hear your thoughts like a melody
Listen while you talk when you're fast asleep
You stay on the phone just to hear me breathe
(On repeat)

Quién lo diría que se podría
Hacer el amor por telepatía
La luna está llena, mi cama vacía
Lo que yo te haría
Si te tuviera de frente, la mente te la volaría
De noche y de día, de noche y de día

(You know I got a lot to say)
(All these voices in the background of my brain) "
