Rank,Musica,Artista,Letra
48,Escapism,Raye ,"
Sleazin' and teasin', I'm sittin' on him
All of my diamonds are drippin' on him
I met him at the bar, it was twelve or something
I ordered two more wines 'cause tonight, I want him

A little context if you care to listen
I find myself in a shit position
The man that I love sat me down last night
And he told me that it's over, dumb decision
And I don't wanna feel how my heart is rippin'
In fact, I don't wanna feel, so I stick to sippin'
And I'm out on the town with a simple mission
In my little black dress and this shit is sittin'

Just a heart broke bitch, high heels six inch
In the back of the nightclub, sippin' champagne
I don't trust any of these bitches I'm with
In the back of the taxi sniffin' cocaine
Drunk calls, drunk texts, drunk tears, drunk sex
I was lookin' for a man who was on the same page
Now it's back to the intro, back to the bar
To the Bentley, to the hotel, to my old ways

'Cause I don't wanna feel how I did last night
I don't wanna feel how I did last night
Doctor, doctor, anything, please
Doctor, doctor, have mercy on me
Take this pain away
You're askin' me my symptoms, doctor, I don't wanna feel

Toke this joint how I'm blowin' this steam
Back to my ways like 2019
Not twenty-four hours since my ex did dead it
I got a new man on me, it's about to get sweaty
Last night really was the cherry on the cake
Been some dark days lately and I'm findin' it cripplin'
Excuse my state, I'm as high as your hopes
That you'll make it to my bed, get me hot and sizzlin'
If I take a step back to see the glass half-full
At least it's the Prada two-piece that I'm trippin' in
And I'm already actin' like a dick, know what I mean?
So you might as well stick it in (What?)

Just a heart broke bitch, high heels six inch
In the back of the nightclub, sippin' champagne
I don't trust any of these bitches I'm with
In the back of the taxi sniffin' cocaine
Drunk calls, drunk texts, drunk tears, drunk sex
I was lookin' for a man who was on the same page
Now it's back to the intro, back to the bar
To the Bentley, to the hotel, to my old ways
'Cause I don't wanna feel how I did last night
I don't wanna feel how I did last night
Doctor, doctor, anything, please
Doctor, doctor, have mercy on me
Take this pain away
You're askin' me my symptoms, doctor, I don't wanna feel, mm (What?)

'Cause I don't wanna feel like I felt last night
I don't wanna feel like I felt last night
Be at peace with the things you can't change (Last night)
I'll be naked when I leave and I was naked when I came, yeah
Out of reach, out of touch
Too numb, I don't feel no way
Toast up, so what?
Street small, but it go both ways
So, you'll run, yeah
But you'll never escape
Sunset in the maze
(You're askin' me my symptoms, doctor, I don't wanna feel)

I don't wanna feel how I did last night
I don't wanna feel how I did last night, oh
Doctor, doctor, anything, please
Doctor, doctor, have mercy on me
You're askin' me my symptoms, doctor, I don't wanna feel
I don't wanna feel how I did last night
I don't wanna feel how I did last night
How I did, how I did, how I did last night

Mm, lipstick smudged like modern art
I don't know where the fuck I am or who's drivin' the fuckin' car
Speedin' down the highway, sippin'
Mixin' pills with the liquor 'cah fuck these feelings
I left everyone I love on read (Uh-huh)
Spilling secrets to the stranger in my bed (Uh-huh)
I remember nothing so there's nothing to regret (Uh-uh)
Other than this 4/4 kick drum poundin' in my head (Mm) "
49,Un x100to,Grupo Frontera Bad Bunny," 

Me queda 1%
Y lo usaré solo para decirte lo mucho que lo siento
Que si me ven con otra en una disco solo es perdiendo el tiempo
Baby, ¿pa' qué te miento?
Eso de que me vieron feliz, no, no es cierto

Ya nada me hace reír
Solo cuando veo las fotos y los videos que tengo de ti
Salí con otra para olvidarte y tenía el perfume que te gusta a ti
Prendo para irme a dormir
Porque duermo mejor si sueño que estás aquí
Si supieras que te escribí
No he mandado los mensajes, siguen todos ahí
Wow, qué mucho me ha costa'o
Quizás te hice un favor cuando me fui de tu lado
Borracho viendo tus fotos, me duele ver que tú sí has mejorado
No tienes días grises, ya no te duelen las cicatrices
Y yo pensando si decirte que

Me queda 1%
Y lo usaré solo para decirte lo mucho que lo siento
Que si me ven con otra en una disco solo es perdiendo el tiempo
Baby, ¿pa' qué te miento?
Eso de que me vieron feliz, no, no es cierto (Ey)

Hace tiempo no pensaba en ti
Borracho a tu Insta me metí
Baby, ya yo sé que a ti te va bien
Que de mí tú no quieres saber, ey, ey
Viviendo en un infierno que yo mismo incendié
Jugando contigo como si fuese el die'
Siento que ya no estoy en tu corazón, ahora estoy en tus pie'
Rogándote, en el tequila ahogándome
Los muchacho' están invitándome a salir
La paso bien, pero siempre termino extrañándote
En el tequila ahogándome, ey
Las morritas texteándome, ey
Que dónde es la peda hoy, pero

Me queda 1%
Y lo usaré solo para decirte lo mucho que lo siento
Que si me ven con otra en una disco solo es perdiendo el tiempo
Baby, ¿pa' qué te miento?
Eso de que me vieron feliz no es cierto, ey

Y esto es Grupo Frontera
Y el compa Bad Bunny "
50,Until I Found You,Stephen Sanchez," 
Georgia, wrap me up in all your
I want ya in my arms
Oh, let me hold ya
I'll never let you go again like I did
Oh, I used to say

I would never fall in love again until I found her
I said I would never fall, unless it's you I fall into
I was lost within the darkness, but then I found her
I found you

Georgia pulled me in
I asked to love her once again
You fell, I caught ya
I'll never let you go again like I did
Oh, I used to say

I would never fall in love again until I found her
I said I would never fall unless it's you I fall into
I was lost within the darkness, but then I found her
I found you


I would never fall in love again until I found her
I said I would never fall unless it's you I fall into
I was lost within the darkness, but then I found her
I found you "
51,Shirt,SZA," 
Kiss me dangerous
Been so lost without you all around me
Get anxious
Lead me, don't look back
It's all about you

In the dark right now
Feelin' lost, but I like it
Comfort in my sins and all about me
All I got right now
Feel the taste of resentment
Simmer in my skin, it's all about

Bloodstain on my shirt
New bitch on my nerves
Old nigga got curved
Goin' back on my word
Damn, bitch, you so thirsty
Still don't know my worth
Still stressin' perfection
Let you all in my mental
Got me lookin' too desperate
Damn (You ain't deserve)

Broad day, sunshine
I'll find a way to fuck it up still
Can't cry about the shit that I can't change
Just my mind
Gotta get outta here
Tough crowd, hate it
Can't stay

In the dark right now
Feelin' lost, but I like it
Comfort in my sins and all about me 
All I got right now
Feel the tastе of resentment 
Simmеr in my skin, it's all about

Bloodstain on my shirt
New bitch on my nerves
Old nigga got curved
Goin' back on my word
Damn, bitch, you so thirsty
Still don't know my worth
Still stressin' perfection
Let you all in my mental
Got me lookin' too desperate 
Damn
It's what you say and how you do me
How I'm 'posed to trust, baby? 'Posed to love?
It ain't 'posed to hurt this way
All I need is the best of you
Baby, how I got to say it? Give me all of you

In the dark right now
Feelin' lost, but I like it
Comfort in my sins and all about me
All I got right now
Feel the taste of resentment
Simmer in my skin, it's all about

Bloodstain on my shirt
New bitch on my nerves
Old nigga got curved
Goin' back on my word
Damn, bitch, you so thirsty
Still don't know my worth
Still stressin' perfection
Let you all in my mental
Got me lookin' too desperate
Damn (You ain't deserve) "
52,Paint the Town Red,Doja Cat," 
By
Walk on by
Walk on by
Walk on by
Walk on by

Yeah, bitch, I said what I said
I'd rather be famous instead
I let all that get to my head
I don’t care, I paint the town red
Bitch, I said what I said
I'd rather be famous instead
I let all that get to my head
I don't care, I paint the town red

Mm, she the devil
She a bad lil’ bitch, she a rebel
She put her foot to the pedal
It'll take a whole lot for me to settle
Mm, she the devil
She a bad lil' bitch, she a rebel
She put her foot to the pedal
It'll take a whole lot for me to settle (Yeah, yeah)

Said my happiness is all of your misery
I put good dick all in my kidneys
This Margiel' don't come with no jealousy
My illness don't come with no remedy
I am so much fun without Hennessy
They just want my love and my energy
You can't talk no shit without penalties
Bitch, I’m in yo’ shit if you send for me
I'm going to glow up one more time
Trust me, I have magical foresight
You gon’ see me sleepin' in courtside
You gon' see me eatin' ten more times
Ugh, you can’t take that bitch nowhere
Ugh, I look better with no hair
Ugh, ain't no sign I can't smoke here
Ugh, gimme the chance and I'll go there (Yeah)

Yeah, bitch, I said what I said
I'd rather be famous instead
I let all that get to my head
I don't care, I paint the town red
Bitch, I said what I said
I'd rather be famous instead
I let all that get to my head
I don't care, I paint the town red
Mm, she the devil
She a bad lil' bitch, she a rebel
She put her foot to the pedal
It'll take a whole lot for me to settle
Mm, she the devil
She a bad lil' bitch, she a rebel
She put her foot to the pedal
It'll take a whole lot for me to settle (Yeah, yeah)

Said pop make money, now you try, bitch
You could use a revamp with a new vibe, sis
I don't need a big feature or a new sidekick
I don't need a new fan 'cause my boo like it
I don't need to wear a wig to make you like it
I'm a two-time bitch, you ain't knew I'd win?
Throw a shot like you tryna have a food fight then
All my opps waitin' for me to be you, I bet
Said I got drive, I don't need a car
Money really all that we fiendin' for
I'm doin' things they ain't seen before
Fans ain't dumb, but extremists are
I'm a demon lord
Fall off what? I ain't seen the horse
Called your bluff, better cite the source
Fame ain't somethin' that I need no more
'Cause, bitch, I said what I said
I'd rather be famous instead
I let all that get to my head
I don't care, I paint the town red
Bitch, I said what I said
I'd rather be famous instead
I let all that get to my head
I don't care, I paint the town red

Mm, she the devil
She a bad lil' bitch, she a rebel
She put her foot to the pedal
It'll take a whole lot for me to settle
Mm, she the devil
She a bad lil' bitch, she a rebel
She put her foot to the pedal
It'll take a whole lot for me to settle
Walk on by
Walk on by
Walk on by
Walk on by
Walk on by "
53,Made You Look,Meghan Trainor," 
I could have my Gucci on
I could wear my Louis Vuitton
But even with nothin' on
Bet I made you look (I made you look)

I'll make you double take soon as I walk away
Call up your chiropractor just in case your neck break
Ooh, tell me what you, what you, what you gon' do, ooh
'Cause I'm 'bout to make a scene, double up that sunscreen
I'm 'bout to turn the heat up, gonna make your glasses steam
Ooh, tell me what you, what you, what you gon' do, ooh

When I do my walk, walk
I can guarantee your jaw will drop, drop
'Cause they don't make a lot of what I got, got
Ladies, if you feel me, this your bop, bop (Bop, bop, bop)

I could have my Gucci on (Gucci on)
I could wear my Louis Vuitton
But even with nothin' on
Bet I made you look (I made you look)
Yeah, I look good in my Versacе dress (Take it off)
But I'm hotter whеn my morning hair's a mess
'Cause even with my hoodie on
Bet I made you look (I made you look)
Mhm-hm-hm

And once you get a taste (Woo), you'll never be the same
This ain't that ordinary, this that 14 karat cake
Ooh, tell me what you, what you what you gon' do, ooh

When I do my walk, walk
I can guarantee your jaw will drop, drop (I guarantee your jaw will drop, drop)
'Cause they don't make a lot of what I got, got
Ladies, if you feel me, this your bop, bop (Bop, bop, bop)

Ooh, I could have my Gucci on (Gucci on)
I could wear my Louis Vuitton (Louis Vuitton)
But even with nothin' on
Bet I made you look (Said, I made you look)
Yeah, I look good in my Versace dress (Take it off, baby)
But I'm hotter when my morning hair's a mess
'Cause even with my hoodie on
Bet I made you look (Said, I made you look) "
54,Wait in the Truck,Hardy Lainey Wilson,"
I got turned around in some little town
I'd never been to before
Workin' my way through a middle of June
Midnight thunderstorm
There was somethin' in the headlights
That stopped me on a dime
Well, she was scared to death
So I said, ""Climb in,"" and in she climbed
Oh, yeah

Well, she was bruised and broke from head to toe
With a tear in her blood-stained shirt
She didn't tell the whole truth, but she didn't have to
I knew what had happenеd to her
I didn't load her down with questions
That girl had been through еnough
I just threw it in drive, looked in those eyes
And asked her where he was

I don't know if he's an angel
'Cause angels don't do what he did
He was hellbent to find the man behind
All the whiskey scars I hid
I never thought my day of justice
Would come from a judge under his seat
But I knew right then I'd never get hit again when he said to me
""Wait in the truck
Just wait in the truck""

Well, I knocked and knocked and no one came
So I kicked in his double-wide door
I let the hammer drop before he got
To that 12 he was reachin' for
I didn't try to hide my pistol
I didn't even try to run
I just sat on the porch, smokin' one of his cigarettes
And waited for the cops to come

I don't know if he's an angel
'Cause angels don't do what he did
He was hellbent to find the man behind
All the whiskey scars I hid
I never thought my day of justice
Would come from a judge under his seat
But I knew right then I'd never get hit again when he said to me
""Wait in the truck
Just wait in the truck""

Whoa (Oh)
Have mercy on me, Lord
Have mercy on me
Have mercy on me, Lord (Oh)
It's been sixty months and she still comes
To see me from time to time
It was worth the price to see a brighter side
Of the girl I picked up that night
And I might be here forever
It ain't paradise, that's true
But it's a whole hell of a lot better
Than the place I sent him to
Yeah

(Have mercy, have mercy, have mercy on me)
""Wait in the truck, just wait in the truck""
(Have mercy on me, oh)
(Have mercy, have mercy, have mercy on me)
""Wait in the truck, just wait in the truck""
(Lord, have mercy)
(Have mercy, have mercy, have mercy on me)
(Have mercy on me, Lord, have mercy on me)
(Have mercy, have mercy, have mercy on me)
(Have mercy on me, Lord, have mercy on me)
(Have mercy, have mercy, have mercy on me)
""Wait in the truck, just wait in the truck""
(I need You to have mercy, oh, have mercy)
(Have mercy, have mercy, have mercy on me)
""Wait in the truck, just wait in the truck""
(Please have mercy, please have mercy) "
55,All I Want for Christmas Is You,Mariah Carey," 
I don't want a lot for Christmas
There is just one thing I need
I don't care about the presents
Underneath the Christmas tree
I just want you for my own
More than you could ever know
Make my wish come true
All I want for Christmas is you, yeah

I don't want a lot for Christmas
There is just one thing I need (And I)
Don't care about the presents
Underneath the Christmas tree
I don't need to hang my stocking
There upon the fireplace (Ah)
Santa Claus won't make me happy
With a toy on Christmas Day

I just want you for my own (Ooh)
More than you could ever know (Ooh)
Make my wish come true
All I want for Christmas is you
You, baby

Oh, I won't ask for much this Christmas
I won't even wish for snow (And I)
I'm just gonna keep on waiting
Underneath the mistletoe
I won't make a list and send it
To the North Pole for Saint Nick (Ah)
I won't even stay awake to
Hear those magic reindeer click

'Cause I just want you here tonight (Ooh)
Holding on to me so tight (Ooh)
What more can I do?
Oh baby, all I want for Christmas is you
You, baby

Oh, all the lights are shining
So brightly everywhere (So brightly, baby)
And the sound of children's
Laughter fills the air (Oh, oh yeah)
And everyone is singing (Oh yeah)
I hear those sleigh bells ringing (Oh)
Santa, won't you bring me the one I really need? (Yeah, oh, oh)
Won't you please bring my baby to me?
Oh, I don't want a lot for Christmas
This is all I'm asking for (Ah)
I just wanna see my baby
Standing right outside my door

Oh, I just want you for my own (Ooh)
More than you could ever know (Ooh)
Make my wish come true
Oh baby, all I want for Christmas is you

You, baby
All I want for Christmas is you, baby (You)
All I want for Christmas is you, baby (Ah, oh, ah, oh)
All I want for Christmas is you, baby (You)
All I want for Christmas is you, baby (All I really want, baby, ooh)
All I want for Christmas is you, baby (All I want, all I really want is you) "
56,Everything I Love,Morgan Wallen," 
I wish I woulda met you anywhere but where I did
Some old high-rise town that I won't ever go again
I wish we woulda rolled around in some old cab and chased them city lights
And hit bars I don't like

We were listenin' to ""one more silver dollar""
Hangin' out my Silverado down a road I love to ride

Wish I woulda known that by now you'd be good and gone
And you'd leave us in a cloud of dust
Can't you see what you're doin', girl?
You ruined damn near everything I love

I don't care how much they're bitin', I won't even crank the boat
Soon as that bobber hits thе water, girl, your memory starts to float
Baby, why'd l evеr take the bait and take you places that I love to go?
Hell, I'll never know

I even took you to my hometown to meet my mama
Now I'm gonna see you every time I see that welcome sign

Wish I woulda known that by now you'd be good and gone
And you'd leave us in a cloud of dust
Can't you see what you're doin', girl?
You ruined damn near everything I love


I don't wanna hear ""one more silver dollar""
I can't take my Silverado down them roads we used to ride

Wish I woulda known that by now you'd be good and gone
And you'd leave us in a cloud of dust
Can't you see what you're doin', girl?
You ruined damn near everything I love
I can't go nowhere near the whiskey 'cause you used to drink it with me
In the bed of my truck and now I can't get drunk
Can't you see what you're doin', girl?
You ruined damn near everything I love
Can't you see what you're doin', girl?
You ruined damn near everything I love"
57,Chemical,Post Malone," 
Oxytocin makin' it all okay
When I come back down, it doesn't feel the same
Now, I'm sittin' 'round waitin' for the world to end all day
'Cause I couldn't leave you if I tried

You break me, then I break my rules
Last time was the last time too
It's fucked up, I know, but I'm still

Outside of the party, smokin' in the car with you
Seven-nation army fightin' at the bar with you
Tell you that I'm sorry, tell me what I gotta do
'Cause I can't let go, it's chemical
No, I can't let go, it's chemical

Every time I'm ready to make a change (Mhm)
You turn around and fuck out all my brains (Woo)
I ain't tryna fight fate, it's too late to save face
I can't get away, maybe there's no mistakes (Maybe there's no mistakes)

You break me, then I break my rules
Last time was the last time too
It's fucked up, I know, but I'm still, still

Outside of the party, smokin' in the car with you
Seven-nation army fightin' at the bar with you
Tell you that I'm sorry, tell me what I gotta do
'Cause I can't let go, it's chemical (Chemical)
No, I can't let go, it's chemical (Chemical)
No, I can't let go, it's chemical

I can't let go, it's chemical
Ah-ah-ah, ah-ah-ah, ah-ah-ah

Tell you that I'm sorry, tell me what I gotta do
No, I can't let go, it's chemical "
58,Heart Like a Truck,Lainey Wilson," 
I never stay in one place too long
The dirt road's singin' me a siren song
I gotta find a field
I need to spin my wheels
I gotta hankerin' for four wide tires
And I can't help it, it's the way I'm wired
Boy, you get too close
Boy, you need to know

I got a heart like a truck
It's been drug through the mud
Runs on dreams and gasoline
And that old highway holds the key
It's got a lead foot down when it's leavin'
Lord knows it's taken a hell of a beatin'
A little bit of love is all that it's needin'
But it's good as it is tough
I got a heart like a truck

There ain't no brakin' when I throw it in drive
Don't always keep it in-between the lines
If you're a ready for a ridе, pedal-down state of mind
Boy, I tell you what, you bеtter buckle up

I got a heart like a truck
It's been drug through the mud
Runs on dreams and gasoline
And that old highway holds the key
It's got a lead foot down when it's leavin'
Lord knows it's taken a hell of a beatin'
A little bit of love is all that it's needin'
But it's good as it is tough
I got a heart like a truck

Go on and see if you can knock off the dust, yeah
Shine it up, rev it up, and let it run, yeah
It gets a high ridin' off into the sun, yeah

I got a heart like a truck
It's been drug through the mud
Runs on dreams and gasoline
And that old highway holds the key
It's got a lead foot down when it's leavin'
Lord knows it's taken a hell of a beatin'
A little bit of love is all that it's needin'
But it's good as it is tough
I got a heart like a truck
Go on and see if you can knock off the dust, yeah
Shine it up, rev it up, and let it run, yeah
It gets a high ridin' off into the sun, yeah
It gets a high ridin' off into the sun "
59,Going Going Gone,Luke Combs,"
Some things in life are meant to fly
And others, they were born to run
You can't tie them up and leave 'em
Like the changing of the seasons
Good things, they come and then they go

Like a runaway Southbound train
Like an Arizona desert rain
Like lightning in the sky
Like fireworks in July
Like a left field home run ball
Like a whiskey shot at last call
It's like she was made for moving on
That girl is going, going, gone

I can say it wasn't meant to be
But maybe meant to be is misunderstood
I can't hold on to letting go
Change the way the river flows
Lovin' her's like roping in the wind

Like a runaway Southbound train
Like an Arizona desert rain
Like lightning in the sky
Like fireworks in July
Like a left field homerun ball
Like a whiskey shot at last call
It's like she was made for moving on
That girl is going, going, gone


She ain't got one bit of stick around
There's no sense in tryin' to slow her down

Like a runaway Southbound train
Like an Arizona desert rain
Like lightning in the sky
Like fireworks in July
Like a left field homerun ball
Like a whiskey shot at last call
It's like she was made for moving on
That girl is going, going, gone

Going, going, gone
Going, going, gone"
60,Rockin' Around the Christmas Tree,Brenda Lee,"
Rockin' around the Christmas tree
At the Christmas party hop
Mistletoe hung where you can see
Every couple tries to stop
Rockin' around the Christmas tree
Let the Christmas spirit ring
Later, we'll have some pumpkin pie
And we'll do some caroling

You will get a sentimental feeling
When you hear
Voices singing, ""Let's be jolly
Deck the halls with boughs of holly""

Rockin' around the Christmas tree
Have a happy holiday
Everyone's dancin' merrily
In the new old-fashioned way


You will get a sentimental feeling
When you hear
Voices singing, ""Let's be jolly
Deck the halls with boughs of holly""

Rockin' around the Christmas tree
Have a happy holiday
Everyone's dancin' merrily
In the new old-fashioned way "
61,Dancin' in the Country,Tyler Hubbard,"
Them neon lights
Look good on you, so good on you
But we ain't got
No room to move, no room to move
We need some space and I know a place
Outside of town where it don't ever close down
No, we never close down

Yeah, we can two-step
Put your boots on, baby, we can do that
Girl, cut a little loose, you can move that
Move that, aw, yeah

I'll take you dancin' in the country, Levi's in them low beams
Spin you in some red dirt, sweep you off of both feet
Out here where the sun sets, Silverado backbeat
You'll never wanna go home and never wanna not be
Dancin' in the country
Dancin' in the country

Yeah, it goes left, right, left
You makin' me wanna sway
You makin' me wanna play
Some Alabama and Jackson
Got you 'round my neck
You makin' me wanna stay
You makin' me wanna lay
You down here in the pasture

Yeah, we can two-step
Put your boots on, baby, we can do that
Girl, cut a little loose, you can move that
Move that, aw, yeah

I'll take you dancin' in the country, Levi's in them low beams
Spin you in some red dirt, sweep you off of both feet
Out here where the sun sets, Silverado backbeat
You'll never wanna go home and never wanna not be
Dancin' in the country
Dancin' in the country
Oh, yeah

I know you feel that heat
Watermelon summer
Get them Luccheses
Stompin' like the thunder, yeah

We can two-step
Put your boots on, baby, we can do that
Girl, cut a little loose, you can move that (Woo)
Move that, aw, yeah
I'll take you dancin' in the country, Levi's in them low beams
Spin you in some red dirt, sweep you off of both feet (Oh, yeah)
Out here where the sun sets, Silverado backbeat
You'll never wanna go home and never wanna not be
Dancin' in the country (Don't stop, don't stop, keep it movin')
Dancin' in the country (Don't stop, don't stop, keep it movin')
Dancin' in the country (Don't stop, don't stop, keep it movin')
Oh, yeah
Dancin' in the country (Don't stop, don't stop, keep it movin')
Oh, dancin' in the country (Let's go) "
