Rank,Musica,Artista,Letra
47,Waiting on the World to Change,John Mayer," 
One, two
One, two, three

Me and all my friends
We're all misunderstood
They say we stand for nothing and
There's no way we ever could
Now we see everything that's going wrong
With the world and those who lead it
We just feel like we don't have the means
To rise above and beat it

So we keep waiting (Waiting)
Waiting on the world to change
We keep on waiting (Waiting)
Waiting on the world to change
It's hard to beat the system
When we're standing at a distance
So we keep waiting (Waiting)
Waiting on the world to change

Now if we had the power
To bring our neighbors home from war
They would have never missed a Christmas
No more ribbons on their door
And when you trust your television
What you get is what you got
'Cause when they own the information, oh
They can bend it all they want

That's why we're waiting (Waiting)
Waiting on the world to change
We keep on waiting (Waiting)
Waiting on the world to change
It's not that we don't care
We just know that the fight ain't fair
So we keep on waiting (Waiting)
Waiting on the world to change


And we're still waiting (Waiting)
Waiting on the world to change
We keep on waiting (Waiting)
Waiting on the world to change
One day our generation
Is gonna rule the population
So we keep on waiting (Waiting)
Waiting on the world to change

Now we keep on waiting (Waiting)
Waiting on the world to change
We keep on waiting (Waiting)
Waiting on the world to change
Waiting on the world to change
Waiting on the world to change
Waiting on the world to change "
48,Lost Without U,Robin Thicke," 
I'm lost without you, can't help myself
How does it feel to know that I love you, baby?
I'm lost without you, can't help myself
How does it feel to know that I love you, baby?

Tell me how you love me more
And how you think I'm sexy, baby
That you don't want nobody else
You don't want this guy, you don't want that guy
You wanna touch yourself when you see me
Tell me how you love my body
And how I make you feel, baby
You wanna roll with me, you wanna hold with me
You wanna stay warm and get out of the cold with me
I just love to hear you say it
It makes a man feel good, baby
Tell me you depend on it, I need to hear it

I'm lost without you, can't help myself
How does it feel to know that I love you, baby?
I'm lost without you, can't help myself
How does it feel to know that I love you, baby?

Baby, you're the perfect shape
Baby, you're the perfect weight
Treat me like my birthday
I want it this way, I want it that way, I want it
Tell me you don't want me to stop (Don't stop)
Tell me it would break your heart
But you love me and all my dirty
You wanna roll with me, you wanna hold with me
You wanna make fires and get Norwegian wood with me
I just love to hear you say it
It makes a man feel good, baby

I'm lost without you, can't help myself
How does it feel to know that I love you baby?
I'm lost without you, can't help myself
How does it feel to know that I love you, baby?

Cause you will tell me every morning
Ooh, alright, baby
Oh, yeah, oh, baby
Oh, darling, alright

I'm lost without you! Can't help myself
How does it feel to know that I love you, baby?
I'm lost without you, can't help myself
How does it feel to know that I love you, baby?
Ooh yeah, oh baby
Oh darlin', all right-right
Oh baby, oh darlin'
Ooh, ooh, baby, all right-right
Yeah "
49,I'm a Flirt,R. Kelly,"
I'm a, I'm a, I'm a, I'm a flirt

Soon as I see her walk up in the club, I'm a flirt
Winking eyes at me when I roll up on them dubs, I'm a flirt
Sometimes when I'm with my chick on the low, I'm a flirt
And when she's with her man looking at me damn right, I'm a flirt
So homie don't bring your girl to meet me cuz, I'm a flirt
And baby don't bring your girlfriend to eat cuz, I'm a flirt
Please believe it, unless your game is tight and you trust her
Then don't bring her around me because, I'm a flirt

Now swear to tell the truth and the whole truth
When it comes to hoes I be pimping like I supposed to
Rolling like I supposed to, shining like I supposed to
In the club fucking with honeys like I supposed to
I don't understand when a nigga bring his girlfriend to the club
Freaking all on the floor with his girlfriend in the club
And wonder why all these playas trying to holler at her
Just soon as she go to the bathroom, nigga I'm gon' holler at her
A dog on the prowl when I'm walking through the mall
If I could man I would probably fuck with all of y'all
Yeah, yeah homie you say she your girlfriend
But when I step up to her I'mma be like cousin
Believe me man this is how them playas do it in the Chi
And plus we got them playerette flirters in the Chi
Now the moral of this story is cuff your bitch
Cuz hey, I'm black, handsome, I sing plus I'm rich
And I'm a flirt

Hey homie if you ain't got no money
You better keep her away from me ya dig

Well if ya love ya girl and wanna keep ya girl
Don't be walkin' up and askin' me to meet ya girl
Because I'm well enough a flirt when I speak to ya girl
She winked her eyes on the sly, I seen cha girl
Better treat girl right cuz another man will
Better eat eat ya girl like another man will
Cuz you leave ya wife and I see ya wife
Now be for real, how long ya think that's fixin' to be ya wife
Well I'm livin' the life, you just gettin' it right
Ya old lady look at me cuz you ain't hittin' it right
She probably used to like you cuz you the business type
That's till I came along and put some dick in her life
Wanna see how that ass lookin' thick in the light
I noticed she was checkin' me and diggin' the ice
And if I get that tonight bet I hit that twice
I can even make her mine if I hit that right
You know, smack that thang, sit that right
Up on that dress, see yeah that's right
Pullin' on her hair like we gettin' in a fight
Yeah, I know it's kind of tight but it'll sweat just right
So if ya girl sexy and she test me
Don't be upset G cuz you might catch me
Tryin' to catch a glance up her skirt, put my plan in reverse
If I see her and I like her then I'm a flirt
When I, when I, when I
When I pull up to club all the shorties be like, damn twenty-eights
Then I be like girl you know just who I am, don't hate
See I done fell in love with a stripper y'all
All I do is flirt with her and I get them draws
And I don't need no help, I got it down pact
Teddy Pain was born to flirt now you can't down that
Now I'mma flirt with her whether I'm in or out of town
That's why they call me Teddy Bend-Er-Ass Down
I be like como se llamo, lil' mama me llamo Pain
What is your name
I'm feeling your vibe and I'm hoping you feel the same
I'mma wink my eye and let you know I got the game
When I pass by I know exactly what you say
He's so fly, yes he's so cool
Hey shorty, hey shorty what it do
He mad cuz I'm looking but I already fucked her
I got these niggas mad cuz I'm a flirt


Oh, it's the remix
Now if you walk in up in the club with a bad chick
And if she lookin' at me then I'm gon' hit
Man jackin' for chicks, I tried to quit it
But I'm a playa homie so I had to hit it
While you buying her drinks in the club
Acting like you in love
Stunting like you all thug
We was switching numbers
She looking at you and I walk by
You turn your head, she wink her eye
I can't help it if she checking for a platinum type of guy
She be calling my daddy and I be calling her mommy
She be calling you Kelly, when your name is Tommy
I don't know what y'all be thinking when you bring 'em around me
Let me remind you that I am the king of R&B
Do you know what that means
That means if you love your chick don't bring her to the V.I.P
Cuz I might leave with your chick
Just keeping it real my nigga, it's a playa's field my nigga
Don't take no bitch to the club when you just met her my nigga
Cuz I'mma flirt with her, right
He gon' flirt with her, right
And if she lickin' that good shit
She gon' flirt with her
I'm a flirt
 "
50,If Everyone Cared,Nickelback," 
From underneath the trees
We watch the sky
Confusing stars for satellites
I never dreamed that you'd be mine
But here we are, we're here tonight

Singing, Amen, I
I'm alive (I'm alive)
Singing Amen, I
I am alive

If everyone cared and nobody cried
If everyone loved and nobody lied
If everyone shared and swallowed their pride
Then we'd see the day, when nobody died

And I'm singing
Amen, I, Amen, I
I am alive
Amen, I, Amen, I, Amen, I
I am alive

And in the air, the fireflies
Our only light in paradise
We'll show the world they were wrong
And teach them all to sing along

Singing Amen, I
I'm alive (I'm alive)
Singing Amen, I
I am alive

If everyone cared and nobody cried
If everyone loved and nobody lied
If everyone shared and swallowed their pride
Then we'd see the day when nobody died
If everyone cared and nobody cried
If everyone loved and nobody lied
If everyone shared and swallowed their pride
Then we'd see the day when nobody died
When nobody died

And as we lie beneath the stars
We realize how small we are
If they could love like you and me
Imagine what the world could be
If everyone cared and nobody cried
If everyone loved and nobody lied
If everyone shared and swallowed their pride
Then we'd see the day when nobody died
If everyone cared and nobody cried
If everyone loved and nobody lied
If everyone shared and swallowed their pride
Then we'd see the day when nobody died

We'd see the day, we'd see the day
When nobody died
We'd see the day, we'd see the day
When nobody died
We'd see the day when nobody died (Died) "
51,Get It Shawty,Lloyd," 
I guess if I can let this moment slip away
Cause I got my eye on you
I see you looking over your shoulder
Let me make my way over

Excuse me, miss lady how you doing
Your body looking right
You're the type I like
Can I pursue and
Can I get a little closer
So I can get to know you
And exchange names and thangs
Before the night is over

All I really want is for you to back it up
Go on and put your weight on it
Cause it's alright
Do what you wanna
Make me believe ya
Oooh, I wanna see ya
Get it shawty, get it shawty
Get-get-get-get-get
Get it shawty, get it shawty

I guess if we can let the night just drift away
So baby, what you gon' do
Cause I don't wanna lose it
Come on, keep it moving

Excuse me, miss lady how you doing
Your body looking right
You're the type I like
Can I pursue and
Can I get a little closer
So I can get to know you
And exchange names and thangs
Before the night is over

All I really want is for you to back it up
Go on and put your weight on it
Cause it's alright
Do what you wanna
Make me believe ya
Oooh, I wanna see ya
Get it shawty, get it shawty
Get-get-get-get-get
Get it shawty, get it shawty
Jeans tight, high heels
This is how you make me feel
Lips glossed, teeth white
Apple bottoms, let me bite
Spend the night, catch a flight
We can do what-what you like
Feeling right, ya smelling good
Let get this understood
Is there something you're not telling me
Are you the daughter of Frankie Beverly
It's the way you move
The way you groove
I'm a fan and you're the celebrity
She doing freaky stuff
Shawty got me geeked up
Like Fabo I got Play-doh
Let me show you street love

All I really want is for you to back it up
Go on and put your weight on it
Cause it's alright
Do what you wanna
Make me believe ya
Oooh, I wanna see ya
Get it shawty, get it shawty
Get-get-get-get-get
Get it shawty, get it shawty "
52,Face Down,The Red Jumpsuit Apparatus," 
Hey girl, you know you drive me crazy
One look puts the rhythm in my hand
Still, I'll never understand why you hang around
I see what's going down
Cover up with makeup in the mirror
Tell yourself, ""It's never gonna happen again""
You cry alone, and then
He swears he loves you

Do you feel like a man when you push her around?
Do you feel better now, as she falls to the ground?
Well, I'll tell you my friend, one day this world's going to end
As your lies crumble down, a new life she has found

A pebble in the water makes a ripple effect
Every action in this world'll bear a consequence
If you wade around forever, you will surely drown
I see what's going down

I see the way you go and say you're right again
Say you're right again, heed my lecture

Do you feel like a man when you push her around?
Do you feel better now as she falls to the ground?
Well, I'll tell you my friend, one day this world's going to end
As your lies crumble down, a new life she has found

Face down in the dirt, she said, ""This doesn't hurt""
She said, ""I finally had enough""
Face down in the dirt, she said, ""This doesn't hurt""
She said, ""I finally had enough""

One day she will tell you that she has had enough
It’s coming 'round again

Do you feel like a man when you push her around?
Do you feel better now as she falls to the ground?
Well, I'll tell you my friend, one day this world's going to end
As your lies crumble down, a new life she has found
Do you feel like a man when you push her around?
Do you feel better now as she falls to the ground?
Well, I'll tell you my friend, one day this world's going to end
As your lies crumble down, a new life she has found
Face down in the dirt, she said, ""This doesn't hurt""
She said, ""I finally had enough"" "
53,The Way I Live,Baby Boy da Prince,
54,Shortie Like Mine,Bow Wow ," 
L-B, Dub
Y'all know what this is

Only thing that keeps me up (Ha) when I'm feeling down
I don't know about you, but I gotta keep mines around
'Cause I done looked, I done searched, and it's hard to find
Another shortie like mine (Uh-huh), baby, yes, I'm
Addicted to how we kick it, everything you say to me (This is going out to all the shorties around the world)
Never knew it could be so wicked, hoping that you stay with me
Search around the world but you will never find (Uh)
Another shortie like mine (C'mon), shortie like mine

I tell my niggas that, uh
You got a girl but she ain't nothing like mine (Uh)
Cute face, nice size like mine
Stay kitted, hood with it like mine (Ha)
Mean walk, talk the talk, let me tell you some more (Woo)

I knew that when I ran into this one
She would be the redrum of my pimpin' (Uh-huh)
Knew she would be the one to make me stop
Carin' about other girls on my jock and gettin' them (Oh)
She was the one to slow me down, hold me down
I roll with it know
Go with it now, I'ma grow with it now
I'ma go get it, that's how I got her (Let's go)
Don't be mad you can't get one hotter (Uh-huh)
Broke the mold when they made lil' momma (Uh)
I don't care what my niggas​ say
She been there every day for my drama (C'mon)
Some of the homies hate 'cause they want her
Wish they the ones was datin' my woman (Oh)
Gon' get a good look 'cause she fine (Uh-huh)
And I don't mind 'cause she mine (Say what?)

Only thing that keeps me up (Up) when I'm feeling down (Yeah)
I don't know about you, but I gotta keep mines around
'Cause I done looked, I done searched, and it's hard to find
Another shortie like mine (Uh-huh), baby, yes, I'm (Ooh, and I'm so addicted)
Addicted to how we kick it, everything you say to me (Addicted to shawty, don't be afraid to snap your fingers)
Never knew it could be so wicked, hoping that you stay with me (Got her hoping, shortie)
Search around the world but you will never find
Another shortie like mine, shortie like mine (Uh, uh, uh, uh)

I tell my niggas that, uh
You got a girl but she ain't nothing like mine (Nah)
Cute face, nice size like mine (Yeah)
Stay kitted, hood with it like mine (Yeah)
Mean walk, talk, Chris, help me tell 'em wassup

I got all this love inside of me
And all I wanna do is give it to her
(Break it down, break it down, break it down)
I don't care what the fellas say 'bout it (No, uh)
'Cause I got something to say 'bout it (Yeah, uh)
What I'm about to say is straight up
Real talk, no cut, I don't play 'bout it (Haha)
There ain't a price you can put on a girl who knows (Uh-huh)
Just what to say when you need to hear it the most
And I'ma tell you something else
If I don't know nothing else, I know
Only thing that keeps me up when I'm feeling down (Only thing that I need, yeah)
I don't know about you, but I gotta keep mines around (I gotta have it all)
'Cause I done looked, I done searched, and it's hard to find
Another shortie like mine (Hey), baby, yes, I'm
Addicted to how we kick it, everything you say to me (Oh, yeah-yeah)
Never knew it could be so wicked, hoping that you stay with me
Search around the world (Searching) but you will never find (Never find)
Another shortie like mine (Ha), shortie like mine

I tell my niggas that, uh
You got a girl but she ain't nothing like mine (Uh-huh)
Cute face, nice size like mine (Mine)
Stay kitted, hood with it like mine
Mean walk, talk the talk, let me tell you some more (Bow Wow, let it go)

I wanna give her the world
And I ain't ever tryna lose her (Uh-huh)
I'm addicted to my girl
And the way that she twirls in that little skirt (Uh-huh)
Just for me in the club, in the crib, in the streets
She reps for L-B, Dub, E-N-T
She a nice size with the pretty brown bright eyes
I'm a winner with the right prize (Come on)
I'ma give it to her to the rhythm of a hi-hat
She got a beautiful mind, you can't buy that (Nuh-uh)
And the sight from behind when she walk on by
Make a nigga wanna try that (Yeah)
She got the prettiest smile and she gangsta (Uh-huh)
Keep me from runnin' wild and I thank her
And we can talk about anythin', she got good conversation
My homie, little friend, and plus she patient (Oh)
Only thing that keeps me up (Up) when I'm feeling down
I don't know about you, but I gotta keep mines around
'Cause I done looked, I done searched, and it's hard to find
Another shortie like mine (Like mine), baby, yes, I'm (Yes, I'm)
Addicted to how we kick it, everything you say to me (Everything)
Never knew it could be so wicked (You wicked, girl), hoping that you stay with me (And playboy)
You can search around the world but you will never find
Another shortie like mine (Ha), shortie like mine

I tell my niggas that, uh
You got a girl but she ain't nothing like mine
Cute face, nice size like mine (Oh, oh)
Stay kitted, hood with it like mine (Oh, oh)
Mean walk, talk the talk, let me tell you some more

Only thing that keeps me up when I'm feeling down
I don't know about you (Uh-huh), but I gotta keep mines around (Uh-huh)
'Cause I done looked, I done searched, and it's hard to find
Another shortie like mine (That's right), baby, yes, I'm
Addicted to how we kick it, everything you say to me
Never knew it could be so wicked, hoping that you stay with me "
55,It Ends Tonight,The All-American Rejects," 
Your subtleties, they strangle me
I can't explain myself at all
And all the wants and all the needs
All I don't want to need at all

The walls start breathing, my mind's unweaving
Maybe it's best you leave me alone
A weight is lifted on this evening
I give the final blow

When darkness turns to light
It ends tonight, it ends tonight

A falling star, at least I fall alone
I can't explain what you can't explain
You're finding things that you didn't know
I look at you with such disdain

The walls start breathing, my mind's unweaving
Maybe it's best you leave me alone
A weight is lifted on this evening
I give the final blow

When darkness turns to light
It ends tonight, it ends tonight
Just a little insight won't make this right
It's too late to fight, it ends tonight
It ends tonight

Now I'm on my own side
It's better than being on your side
It's my fault when you're blind
It's better that I see it through your eyes
All these thoughts locked inside
Now you're the first to know

When darkness turns to light
It ends tonight, it ends tonight
Just a little insight won't make this right
It's too late to fight, it ends tonight
It ends, when darkness turns to light
It ends tonight, it ends tonight
Just a little insight won't make this right
It's too late to fight, it ends tonight

It ends tonight
Tonight, insight
When darkness turns to light
It ends tonight "
56,A Bay Bay,Hurricane Chris," 
This is Baby 3. everybody say A Bay Bay
A Bay Bay, A Bay Bay, A Bay Bay
A Bay Bay, A Bay Bay, A Bay Bay
A Bay Bay, A Bay Bay, A Bay Bay
A Bay Bay, A Bay Bay, A Bay Bay

You wanna know what we say in the club (A Bay Bay)
White folks, gangstas, and the thugs (A Bay Bay)
Stuntin' with a stacks of them dubs (A Bay Bay)
Ridin' in the 'lac with a mug (A Bay Bay)
I'm in the club hollering
A Bay Bay, A Bay Bay, A Bay Bay, A Bay Bay, A Bay Bay
A Bay Bay, A Bay Bay, A Bay Bay, A Bay Bay, A Bay Bay
I'm in da club hollerin'

Now when I holla A Bay Bay, I'm finna get my groove on
It's so hot up in the club that I ain't got no shoes on
Holdin' up a big stack of dem hunnids in a rubber band
So don't ask me for no cash
Cause I'm not that other man
Everybody tripping cause I'm limping when I'm walking
And I'm pimping when I'm talking
I don't trick 'em when I'm talking
Them boys in the back
They be rollin' up they dopey
And they blow until choke
And that's what got his got his game flossin'
Wen I see a bad chick I'm hollerin' out A Bay Bay
Hope ya'll ain't with your boyfriend
Cuz I don't care what they say
And I don't care what he say, or she say
I'm in the DJ booth takin' pics. with the DJ
You wanna know what we say
When the clubs get crunk (wat) A Bay Bay
Let it play that's my song turn it up (ok)
You wanna know what we say
When the clubs get crunk (wat) A Bay Bay
Let it play that's my song turn it up

You wanna know what we say in the club (A Bay Bay)
White folks, gangstas, and the thugs (A Bay Bay)
Stuntin' with a stacks of them dubs (A Bay Bay)
Ridin' in the 'lac with a mug (A Bay Bay)

Now if you looking for me baby
You can find me banging in the Chevy
Candy painted swinging 90
Big cars creep with my people right behind me
I showed 'em my chain
And now she hollering where you finding me
Show my mouth piece to them freaks
Now they hiring me
Oh you gotta fire them well I hope you ain't trying me
Throw the car in park then I reach under my seat
Hop out with my hand under my shirt
That's where that 9 be
Yellow bone chirpin me
She tryna see where I be
You goin' to let me get in your mouth
Well that's where I'mma be
Unpop trunk with lights, that's where the chopper be
Straight to the hotel
All the baddest chicks followin me
I know you like my style
I ain't trippin I'm just trying to see
Gurl is you drunk
Well tell me why you leaning on me
And if you thinking I'mma stunt? You tripping
I pulled up in an expedition with the roof missin'
You wanna know what we say in the club (A Bay Bay)
White folks, gangstas, and the thugs (A Bay Bay)
Stuntin' with a stacks of them dubs (A Bay Bay)
Ridin' in the 'lac with a mug (A Bay Bay)

A Bay Bay let it play that's my song turn it up
I'm in the club hot, crunk, sweating, burning up
I'm bouncin' thru the crowd
Bucking, and hollering wassup
When I done fell out on the dance floor, and now I can't get up
J's on ya feet but you can't get these
Louis Vuitton brown, white, and yellow trick please
I go to Saint Louis and let my chain hang low
Canary yellow diamonds mixed with rose gold
I shine real bright in the light cause I'm a star
8 shots of patron now I'm standing on the bar
Tried to get drunk as a skunk and put the keys in the wrong car
Prolly got drunk as a skunk and put the keys in the wrong car

You wanna know what we say in the club (A Bay Bay)
White folks, gangstas, and the thugs (A Bay Bay)
Stuntin' with a stacks of them dubs (A Bay Bay)
Ridin' in the 'lac with a mug (A Bay Bay)
A Bay Bay let it play that's my song turn it up
A Bay Bay let it play that's my song turn it up
A Bay Bay let it play that's my song turn it up
A Bay Bay let it play that's my song turn it up
A Bay Bay let it play that's my song turn it up
A Bay Bay let it play that's my song turn it up
A Bay Bay let it play that's my song turn it up
A Bay Bay let it play that's my song turn it up
A Bay Bay let it play that's my song turn it up
A Bay Bay let it play that's my song turn it up "
