Rank,Musica,Artista,Letra
64,Glad You Exist,Dan + Shay," 
Here's to all the late-night drunk phone calls that you picked up
Here's to all the bad decisions that you didn't judge
All the love you's and the hate you's and the secrets that you told me
Here's to everyone but mostly us

There's a couple billion people in the world
And a million other places we could be, but you're here with me
Take a moment just to take it in
'Cause еvery high and every low lеd to this
I'm just so glad you exist
Ooh, ooh-ooh, ooh-ooh, ooh, ooh-ooh, ooh-ooh, ooh, ooh
Ooh, ooh-ooh, ooh-ooh, ooh, ooh-ooh, ooh-ooh, ooh, ooh

Hey look what a hello from a stranger turned into
Caught up in a moment like it's just us in this room
All the right words at the right time
And you know 'em 'cause you know me better than anyone else
We don't need anyone else

There's a couple billion people in the world (Yeah-yeah-yeah)
And a million other places we could be, but you're here with me (Yeah-yeah-yeah)
Take a moment just to take it in
'Cause every high and every low led to this
I'm just so glad you exist
Ooh, ooh-ooh, ooh-ooh, ooh, ooh-ooh, ooh-ooh, ooh, ooh
Ooh, ooh-ooh, ooh-ooh, ooh, ooh-ooh, ooh-ooh, ooh, ooh

Don't you ever go, don't you ever go, don't you ever go changing
Never let me go, never let me go, never let me go, baby
Don't you ever go, don't you ever go, don't you ever go changing
Never let me go, never ever let me go, never let me go, baby

There's a couple billion people in the world (In the world, yeah-yeah-yeah)
And a million other places we could be, but you're here with me (Yeah-yeah-yeah)
Take a moment just to take it in (Just to take it in, yeah-yeah-yeah)
'Cause every high and every low led to this
I'm just so glad you exist
Ooh, ooh-ooh, ooh-ooh, ooh, ooh-ooh, ooh-ooh, ooh, ooh
I'm glad you exist
Ooh, ooh-ooh, ooh-ooh, ooh, ooh-ooh, ooh-ooh, ooh, ooh "
65,Lonely,Justin Bieber & Benny Blanco," 
Everybody knows my name now
But somethin' 'bout it still feels strange
Like lookin' in a mirror, tryna steady yourself
And seein' somebody else
And everything is not the same now
It feels like all our lives have changed
Maybe when I'm older, it'll all calm down
But it's killin' me now

What if you had it all
But nobody to call?
Maybe then you'd know me
'Cause I've had everything
But no one's listening
And that's just fuckin' lonely

I'm so lo-o-o-onely
Lo-o-o-onely

Everybody knows my past now
Like my house was always made of glass
And maybe that's the price you pay
For the money and fame at an early age
And everybody saw me sick
And it felt like no one gave a shit
They criticized the things I did as an idiot kid

What if you had it all
But nobody to call?
Maybe then you'd know me
'Cause I've had everything
But no one's listening
And that's just fuckin' lonely

I'm so lo-o-o-onely
Lo-o-o-onely
I'm so lo-o-o-onely
Lo-o-o-onely "
66,Beggin',Maneskin," 
Put your lovin' hand out, baby
'Cause I'm beggin'

I'm beggin', beggin' you
So put your loving hand out, baby
I'm beggin', beggin' you
So put your loving hand out, darlin'

Riding high when I was king
I played it hard and fast, 'cause I had everything
I walked away, you won me then
But easy come and easy go and it would end

So anytime I bleed, you let me go
Yah, anytime I feed, you get me, no
Anytime I seek, you let me know
But I plant and seed, just let me go
I'm on my knees when I'm beggin'
'Cause I don't wanna lose you
Hey, yeah, ra-ta-ta-ta!

'Cause I'm beggin', beggin' you
Uh, put your loving hand out, baby
I'm beggin', beggin' you, ah
And put your loving hand out, darlin'

I need you to understand
Tried so hard to be your man
The kind of man you want in the end
Only then can I begin to live again

An empty shell, I used to be
The shadow of my life was hangin' over me
A broken man that I don't know
Won't even stand the devil's dance to win my soul

What we doin'? What we chasin'?
Why the bottom? Why the basement?
Why we got good shit, don't embrace it?
Why the feel for the need to replace me?
You're the wrong way track from the good
I want to paint a picture tellin' where we could be at
Like a heart in the best way should
You can give it away, you had it and you took the pay
But I keep walkin' on, keep openin' doors
Keep hopin' for, now the door is yours
Keep also home
'Cause I don't wanna live in a broken home, girl, I'm beggin'
Mmm, yeah, yeah, I'm beggin', beggin' you
So put your loving hand out, baby
I'm beggin', beggin' you
So put your loving hand out, darlin'

I'm fighting hard to hold my own
Just can't make it all alone
I'm holdin' on, I can't fall back
I'm just a calm, 'bout to fade to black

I'm beggin', beggin' you
Put your loving hand out, baby
I'm beggin', beggin' you
So put your loving hand out, darlin'
I'm beggin', beggin' you
So put your loving hand out, baby
I'm beggin', beggin' you
So put your loving hand out, darlin'

I'm beggin', beggin' you
So put your loving hand out, baby
I'm beggin', beggin' you
So put your loving hand out "
67,Streets,Doja Cat," 
I've been goin' through some things (Oh)
I struggle with my inner man (Yeah, yeah)
I hustle, I'll do what I can to get this money
Blaq Tuxedo
Don Dada on the, Don Dada on the beat

Like you, like you
Like you, ooh
I found it hard to find someone like you
Like you, like you
Send your location, come through

I can't sleep no more
In my head, we belong
And I can't be without you
Why can't I find no one like you?
I can't sleep no more
In my head, we belong
And I can't be without you
Why can't I find no one like you?

Baby, we tried to fight it
We all been there some days
Thought I needed something else
And acted like I was okay
We just had to work it out
And baby, I needed space
Ain't nobody 'round here on your level
You're so far away
You're pouring your heart out
I'm acting like I knew
You held me so down
So down I never grew, oh
I tried to find out
When none of them came through
And now I'm stuck in the middle
And baby had to pull me out, oh

Like you, like you
Like you, ooh
I found it hard to find someone like you
Like you, like you
Send your location, come through (Yeah)

Damn papa, you a rare breed, no comparing
And it's motherfuckin' scary
Tryna keep him 'cause I found him
Let a ho know I ain't motherfuckin' sharing
I could take you to the parents, then to Paris
Plan a motherfuckin' wedding
You the type I wanna marry (Yeah) and keep you merry
I'll put the ring on when you ready
We play our fantasies out in real life ways and
No Final Fantasy, can we end these games though?
You give me energy, make me feel lightweight (Woo)
Like the birds of a feather, baby (Woo)
We real life made for each other (Woo)
And it's hard to keep my cool
When other bitches tryna get with my dude and
When other chickens tryna get in my coop
'Cause you're a one in a million
There ain't no man like you
Like you, like you
Like you, ooh
I found it hard to find someone like you
Like you, like you
Send your location, come through

I can't sleep no more
In my head, we belong
And I can't be without you
Why can't I find no one like you?
I can't sleep no more
In my head, we belong
And I can't be without you
Why can't I find no one like you? "
68,What's Next,Drake," 
Ayy, woah
Ayy, ayy
Yeah

I'm makin' a change today
The liquor been takin' the pain away
I heard you was givin' your chain away
That's kinda like givin' your fame away
What's wrong with you?
I sit in a box where the owners do
A boss is a role that I've grown into
I love you to death but I told you the truth

I can't just be with you and only you
Yeah, I got one, Virgil got one and that there is the only two
Man, how many times have I shown improvement?
How many nights I been (Woah)
Swervin' them potholes
Not tryna fuck up the wheels on the road, okay
Funny how life goes
He thought he was sick, now he wipin' his nose, okay
Soon as you give 'em your soul
You blow up and they say you're sеlling your soul, okay
They want my life exposеd
They wanna know about the highs and lows

Well, summer, all I did was rest, okay?
And New Year's, all I did was stretch, okay?
And Valentine's Day, I had sex, okay?
We'll see what's 'bout to happen next
Okay? Okay? Okay?
We'll see what's 'bout to happen next
Okay? Okay? Okay?
We'll see what's 'bout to happen, ayy, ayy
We'll see what's 'bout to happen, ayy
We'll see what's 'bout to happen

I'm makin' a change today
The liquor been takin' the pain away
I heard you was givin' your chain away
That's kinda like givin' your fame away
What's wrong with you?
I sit in a box where the owners do
A boss is a role that I've grown into
I love you to death but I told you the truth
I–

Ayy, yeah
I got one, Laurie got one and that there is the only two
Man, how many times have I told you the truth?
Man, how many nights I been (Woah)
Swervin' them potholes
Not tryna fuck up the wheels or fuck up the deals
I'm posted in Stockholm
It's me, the owls and the twins, it's only the real
I'm movin' way too humble
Weezy had handed it off, I still got no fumbles
I'm on the hot one hundo, numero uno
This one ain't come with a bundle
I'm in the Wynn, a million in chocolate chips
And that's just how my cookie crumble
I put a skirt on a whip and a crown on the six
But there's no need to dress up the numbers
Ayy, ayy, yeah
But I guess they must have they reasons
They wanna know how I'm livin' my day-to-day life in the regular season
Well, summer, all I did was rest, okay?
And New Year's, all I did was stretch, okay?
And Valentine's Day, I had sex, okay?
We'll see what's 'bout to happen next
Okay? Okay? Okay?
We'll see what's 'bout to happen next
Okay? Okay? Okay?
We'll see what's 'bout to happen, ayy, ayy
We'll see what's 'bout to happen, ayy
We'll see what's 'bout to happen

I'm makin' a change today
The liquor been takin' the pain away
I heard you was givin' your chain away
That's kinda like givin' your fame away
What's wrong with you?
I sit in a box where the owners do
A boss is a role that I've grown into
I love you to death but I told you the truth
I– "
69,Famous Friends,Chris Young and Kane Brown," 
My buddy Brandon holds the record
For single-season touchdown throws
And good ol' Johnny, he's the life of every party
It's like Cheers, they know him everywhere he goes

I've got some famous friends you've probably never heard of
But back in Rutherford County, our crowd is second to none
You might not know 'em here in this big city we're in
But when I go back home, I've got some famous friends
Yeah, I do

My buddy Jason, he's the sheriff
He'll flash his lights, but lеt me go
My boy Randy, he's a preachеr
My girl Megan, she's been teacher of the year
I swear for five years in a row

I've got some famous friends you've probably never heard of
But back in Hamilton County, our crowd is second to none
You might not know 'em here in this big city we're in
But when I go back home, I've got some famous friends
Yeah, I do

I got friends in high places, on these small town roads
'Cause 'round here, it's all about the people that you know

And I've got some famous friends you've probably never heard of
But back in Davidson County, our crowd is second to none
You might not know 'em here in this big city we're in
But when I go back home, I've got some famous friends
Yeah, I do

(Ooh) Yeah, I do
Might not know 'em here in this big city we're in
But when I go back home, I've got some famous friends, yeah
I've got some famous friends (I've got some famous friends)
Yeah "
70,Lil Bit,Nelly & Florida Georgia Line," 
What up, Nelly?
You ready to do another one, bruh?
Talk to 'em (Uh, uh, uh, uh), haha

Yeah, runnin' all red lights
Pull up to the club, just to get, to get ahead, right
I do this shit er'ry night
You can call it limelight, I'ma call it my life
Shawty lookin' alright
TK jeans on, skin-skin-skintight
She be shakin' that taillight
Got me froze in the road like a deer in the headlights (Uh, uh, yeah)

Oh, Backwoods, wanna know if you can roll
Got Cîroc on the rocks, ice-cold
Got the coupe on the new town road
Real low, oh

I know we just met, but, girl, let's roll
Let's roll, woah, let's roll, let's roll
I'll go anywhere you wanna go
Let's go, oh

And she said, ""Take me to the country, show me where you from""
I said, ""Shawty, you gon' love me and we gon' have some fun""
I'll break out my big wheel and you can climb on up
Girl, I think you a big deal, now show your boy some love
Huh, just a lil' bit
Just a lil' bit (Uh)
Just a lil' bit (Yeah)
Just a lil' bit (Uh)
We gon' have some fun
Just a lil' bit (Uh)
Just a lil' bit (Yeah)
Just a lil' bit
Yeah, we gon' have some—

Shawty messin' with a pro now (Woo)
I'm a pro now
I'm the who, what, when, where to go now
Shows sold out
From the front to the back, hip-hop or the hoedown
Got the game on the go route
I'm the black Tom Brady in this, I'm the GOAT now (Haha)
Shawty, I'm so wow
Orleans out to SoCal
Better know now
I know we just met, but, girl, let's roll
Let's roll, woah, let's roll, let's roll
I'll go anywhere you wanna go
Let's go, oh (Ayy, ayy, ayy)

And she said, ""Take me to the country, show me where you from"" (Let's ride)
I said, ""Shawty, you gon' love me and we gon' have some fun""
I'll break out my big wheel and you can climb on up
Girl, I think you a big deal, now show your boy some love
Huh, just a lil' bit
Just a lil' bit (Yeah, baby, uh)
Just a lil' bit (Yeah)
Just a lil' bit (Uh)
We gon' have some fun
Just a lil' bit (Uh)
Just a lil' bit (Yeah)
Just a lil' bit (Haha, uh, yeah, yeah)

Oh, Backwoods, wanna know if you can roll
Got Cîroc on the rocks, ice-cold
Got the coupe on the new town road (Uh, uh, uh)
Real low, oh
Oh, Backwoods, wanna know if you can roll (Can she roll?)
Got Cîroc on the rocks, ice-cold
Got the coupe on the new town road
Real low, oh
And she said, ""Take me to the country, show me where you from""
I said, ""Shawty, you gon' love me and we gon' have some fun"" (We back, man)
I'll break out my big wheel and you can climb on up
Girl, I think you a big deal, now show your boy some love
Huh, just a lil' bit (Ayy, ayy)
Just a lil' bit (Come on, ayy, ayy)
Just a lil' bit (Ayy, ayy)
Just a lil' bit
We gon' have some fun (Ayy, ayy)
Just a lil' bit (Ayy, ayy)
Just a lil' bit (Ayy, ayy)
Just a lil' bit
We gon' have some fun "
71,Thot Shit,Megan Thee Stallion," 
(OG Parker)
(And if the beat live, you know Lil Ju made it)

Hands on my knees, shakin' ass, on my thot shit
Post me a pic, finna make me a profit
When the liquor hit, then a bitch get toxic
(Why the fuck you in the club when niggas wildin’?)
I've been lit since brunch, thot shit
Order '42 for the table, let’s pop shit
Missionary or doggystyle, I'ma top shit
Pussy-ass niggas hatin' on me from the closet, ah
Hoes tryna call me a snake, shit, I guess I can relate
'Cause a bitch spit a whole lotta venom
And since these hoes all rats, when they come around me
All I see is a whole lotta dinner
I walk around the house butt-naked
And I stop at every mirror just to stare at my own posterior
I don't give a fuck who talk behind my back
'Cause the bitch knew better than to let me hear her (Ah)

Hands on my knees, shakin' ass, on my thot shit
Hands on my knees, shakin' ass, on my thot shit (Thot shit)
Hands on my knees, shakin’ ass, on my thot shit
Hands on my knees, ha-hands on my knees
Hands on my knees, shakin’ ass, on my thot shit
Hands on my knees, shakin' ass, on my thot shit (Thot shit)
Hands on my knees, shakin’ ass, on my thot shit
Hands on my knees, hands on my knees

Hoes said they wish a bitch would, and I'm a genie
Bitch so hot, gotta stay in bikinis
He got a girl, but he keep beggin' to see me
I love it when a nigga got a mouth full of VVs
No, I'm not a patient, but I let him treat me
I gotta be a doctor how I’m orderin' CCs
Go to your place, no face, no case
Ninety-nine percent tint in a blacked-out Wraith
I remember hoes used to clap for me happily
Now I'm bossed up and them same hoes mad at me
Acting like they ridin', whole time tryna pass me
Watchin' me go through it and still tryna drag me
Actin' like you winnin', if you think about it, actually
Are they supportin' you or really just attackin' me?
I don't give a fuck 'bout a blog tryna bash me
I'm the shit per the Recording Academy (Ah)
Hands on my knees, shakin' ass, on my thot shit
Hands on my knees, shakin' ass, on my thot shit (Thot shit)
Hands on my knees, shakin' ass, on my thot shit
Hands on my knees, ha-hands on my knees
Hands on my knees, shakin' ass, on my thot shit
Hands on my knees, shakin' ass, on my thot shit (Thot shit)
Hands on my knees, shakin' ass, on my thot shit
Hands on my knees, hands on my knees
Drinkin' out the motherfuckin' bottle on my thot shit
Everything I eat go straight to my pockets
2021, finna graduate college
Goth girl shit, I'm a real hot topic
Fuckin' on a nigga, make him sing, on some pop shit
I need a real headbanger, on some rock shit
Pussy like crack, wanna hit it like dope
Got a real hot box, but a bitch don't smoke (Ah)
Hot girl, but I'm still the coldest, hey
I'm the big homie, but I ain't the oldest, hmm
Bitch dry hatin', tryna get noticed
Man, ain't nobody come to see you, Otis, look
How many bitches lyin' if they say they bars is better?
They really puppets, so I really gotta go and Geppetto
I'm really talkin', but it really can apply to whoever
My pen a freak, it'll go after a bitch or a nigga (Huh)
Big bank take lil' bank, bitch, add it up
Hoes takin' shots, but they ain't in my caliber
Booked, but I squeeze a lil' head in my calendar
Lookin' in the mirror like, ""Damn, I don't brag enough""
LVs, double C's, Birkins, I'm workin'
My chain ain't hittin' if a bitch ain't hurtin'
Look, I ain't even finna argue with a bitch
One thing I know, two things for certain
None of these hoes sayin' shit to my face
And none of these hoes finna see me at the bank
And I'ma keep talkin' all the shit that I want
And I dare one of these hoes come tell me I can't
We ain't even speakin' if the nigga ain't spendin'
He could never say that I was one of his women
I don't even let niggas know where I stay
I'll be damned if he thinkin' he poppin' up on this pimpin' (Ah)
Hands on my knees, shakin' ass, on my thot shit
Hands on my knees, shakin' ass, on my thot shit (Thot shit)
Hands on my knees, shakin' ass, on my thot shit
Hands on my knees, ha-hands on my knees
Hands on my knees, shakin' ass, on my thot shit
Hands on my knees, shakin' ass, on my thot shit (Thot shit)
Hands on my knees, shakin' ass, on my thot shit
Hands on my knees, hands on my knees

(OG Parker)
(And if the beat live, you know Lil Ju made it) "
72,Late at Night,Roddy Ricch," 
Late at night
Kiss me in the mornin', late at night
Catch me drivin' down 405
Catch me and your girl late at night, side to side
Mustard on the beat, ho

Late at night
Kiss me in the mornin' or late at night
Long as you come through
I'ma make you cum over and over
I'ma treat you like I'm 'posed to
You better never make no time for these niggas
'Cause when I ride, I'ma ride, ride with you

I can't fuck with nobody
I can't keep livin' like this, I can't
I tell her what it is and I tell her what it ain't
She know that I been all in her walls like I paint
Told her at times I wanna give you trust, but I can't
Bitch, I really got it out the mud, climbin' up the ranks
When they see me outside, I'm a high roller
I've been on a global jet, but nigga, I fly solo
And I got the Gucci splattered all on her knick-knacks
Fifty racks, I'm 'bout to break her off like a KitKat
And her purse got F's like the wheels on the 'Bach
I just fucked off a million, but I still got a sack
Shorty know that I'm the realest, she know I be speakin' facts
She know that I'm the same nigga that was pushin' 'Cat
She know I got the game, but I'm never gon' give it back
Every time that we fuck, I gotta run it back

Late at night
Kiss me in the mornin' or late at night
Long as you come through
I'ma make you cum over and over
I'ma treat you like I'm 'posed to
You better never make no time for these niggas
'Cause when I ride, I'ma ride, ride with you

I told shorty never get too comfortable
I like to feel like the pussy untouchable
I like to feel like it's never goin' one way
I like to see your body drippin' Eliantte
I say I like the way I took ya' on a wave
I had you screamin' my name out

Late at night
Kiss me in the mornin' or late at night
Long as you come through
I'ma make you cum over and over
I'ma treat you like I'm 'posed to
You better never make no time for these niggas
'Cause when I ride, I'ma ride, ride with you
Ride, ride, ride, ride, ride, ride
Ride, ride, ride, ride, ride, ride
Ride, ride, ride, ride, ride
Ride, ride, ride, ride, ride, ride
Ride, ride, ride, ride, ride
Ride, ride, ride, ride, ride
Ride, ride, ride, ride, ride
Ride, ride, ride, ride, ride "
73,Kings & Queens,Ava Max,"
If all of the kings had their queens on the throne
We would pop champagne and raise a toast
To all of the queens who are fighting alone
Baby, you're not dancing on your own

Can't live without me, you wanna, but you can't, nah-nah-nah
Think it's funny, but honey, can't run this show on your own
I can feel my body shake, there's only so much I can take
I'll show you how a real queen behaves (Oh)

No damsel in distress, don't need to save me
Once I start breathin' fire, you can't tame me
And you might think I'm weak without a sword
But if I had one, it'd be bigger than yours

If all of the kings had their queens on the throne
We would pop champagne and raise a toast
To all of the queens who are fighting alone
Baby, you're not dancing on your own

Disobey me, then baby, it's off with your head
Gonna change it and make it a world you won't forget (Oh)

No damsel in distress, don't need to save me
Once I start breathin' fire, you can't tame me
And you might think I'm weak without a sword
But I'm stronger than I ever was before

If all of the kings had their queens on the throne
We would pop champagne and raise a toast
To all of the queens who are fighting alone
Baby, you're not dancing on your own

In chess, a king can move one space at a time
But queens are free to go wherever they like
You get too close, you'll get a royalty high
So breathe it in to feel alive

If all of the kings had their queens on the throne
We would pop champagne and raise a toast
To all of the queens who are fighting alone
Baby, you're not dancing on your own

Oh-oh-oh-oh-oh-oh, oh-oh
Oh-oh-oh-oh-oh-oh, oh-oh "
74,Anyone,Justin Bieber," 
Dance with me under the diamonds
See me like breath in the cold
Sleep with me here in the silence
Come kiss me, silver and gold

You say that I won't lose you, but you can't predict the future
So just hold on like you will never let go
Yeah, if you ever move on without me
I need to make sure you know that

You are the only one I'll ever love (I gotta tell ya, gotta tell ya)
Yeah, you, if it's not you, it's not anyone (I gotta tell ya, gotta tell ya)
Lookin' back on my life, you're the only good I've ever done (Ever done)
Yeah, you, if it's not you, it's not anyone (Anyone)
Not anyone

Forever's not enough time to (Oh)
Love you the way that I want (Love you the way that I want)
'Cause every mornin', I'll find you (Oh)
I fear the day that I don't

You say that I won't lose you, but you can't predict the future
'Cause certain things are out of our control
Yeah, if you ever move on without me
I need to make sure you know that

You are the only one I'll ever love (Only one, I gotta tell ya, gotta tell ya)
Yeah, you, if it's not you, it's not anyone (I gotta tell ya, gotta tell ya)
Lookin' back on my life, you're the only good I've ever done (I've ever done)
Yeah, you, if it's not you, it's not anyone, it's not anyone

Not anyone (Oh-oh-oh-oh)
If it's not you, it's not anyone (Oh-oh-oh-oh)
Oh yeah, woah

Yeah, you are the only one I'll ever love (I gotta tell ya, gotta tell ya)
Yeah, you, if it's not you, it's not anyone (I gotta tell ya, gotta tell ya)
Lookin' back on my life, you're the only good I've ever done (Ever done)
Yeah, you, if it's not you, it's not anyone "
