Rank,Musica,Artista,Letra
75,I Like You A Happier Song,Post Malone Doja Cat,"
Ooh, ooh, ooh
Ooh, ooh

Ooh, girl, I like you, I do
I wanna be your friend, go shoppin' in a Benz
I like you, I do
I’ll hit you when I land, can you fit me in your plans?
I like you, I do
We went to bed in France, then we woke up in Japan
I like you, I do (I do), mm

Oh, girl, I know you only like it fancy (Fancy)
So I pull up in that Maybach Candy
Yeah, your boyfriend'll never understand me (Understand)
'Cause I’m 'bout to pull his girl like a hammy, hammy (Wow)
Let's take a lil' dip, lil' lady
Hit PCH, 180
Hey, I been thinkin' lately
That I need someone to save me
Now that I'm famous, I got hoes all around me
But I need a good girl, I need someone to ground me
So, please be truе, don't fuck around with me
I need someone to sharе this heart with me
Fill you up, then run it back again (Run it back again)

Ooh, girl, I like you, I do (I do)
I wanna be your friend, go shoppin’ in a Benz (Woo)
I like you, I do (I do)
I’ll hit you when I land, can you fit me in your plans?
I like you, I do (I do)
We went to bed in France, then we woke up in Japan
I like you, I do, mm, I do

Let me know when you're free
’Cause I been tryna hit it all week, babe
Why you actin' all sweet?
I know that you want little ol' me
I get a little OD, but ain't shit new to a freak
Let me drop bands, put a jewel in ya teeth
He love the way I drip, turn that pool to the beach
And I coulda copped a Birkin but I cop Celine
Why we got the same taste for the finer things?
Brand new nigga with the same old team
Now he got me on a leash ’cause he said no strings
You know I'm cool with that
Stole the pussy, you ain't get sued for that (Get sued, sued)
Wonder what a nigga might do for that (Do, might do)
I could be your Chaka, where Rufus at? (Where?)
80 in the Benz when that roof go back, ayy
They don't wanna see us get too attached
I just got a feelin' that we might be friends for a long, long time
You don't mind and you know I like you for that
Ooh, girl, I like you, I do (I do)
I wanna be your friend, go shoppin' in a Benz
I like you, I do (I do)
I'll hit you when I land, can you fit me in your plans? (Baby, yeah)
I like you, I do (I do)
We went to bed in France, then we woke up in Japan
I like you, I do (I do), mm, I do

I just want you, I just want you
Your heart's so big, but that ass is huge
Just want you, oh, baby
Do you like me too? (Yeah, I like you too)

Girl, I like you, I do (I do)
I wanna be your friend, go shoppin' in a Benz
I like you, I do, mm, I do

I like you
Don't want it now, I'm with you "
76,What It Is Block Boy,Doechii,"
What it is, ho? What's up?
Every good girl needs a little thug
Every block boy needs a little love
If you put it down, I'ma pick it up, up, up

Can't you just see, it's just me and you?
Panoramic view, that's my point of view, bae
All about me, that's the energy
That's that lemon pepper thing, I'm a ten-piece, baby

Bedroom bully in the bando
He gon' make it flip, do it with no handles
Never switchin' sides, only switchin' angles
Ooh, we go crazy like Rambo

What it is, ho? (What it is?) What's up? (What's up?)
Every good girl needs a little thug (Thug)
Every block boy needs a little love (Love)
If you put it down, I'ma pick it up, up (Ayy), up (Ayy)
What it is, ho? (What it is?) What's up? (What's up?)
Every good girl needs a little thug (Thug)
Every block boy needs a little love (Love)
If you put it down, I'ma pick it up, up (Ayy), up (Ayy)

Hit 'em up, hit 'em up
In the truck, got it tucked
He get it up, like it's stuck
All night, I like
You ain't gotta say it when you know it's on site

She got everything he wanted, a nice body, ass fat
Behind every gangster, a shawty solid that got his back
He know who to come to every-time the world handlin' him bad
The way he call first, but still he always put her last (Always put her last, yeah)
I'm pourin' out this glass, my body fightin' off that gas (Off that gas, yeah)
On smoke box, I kill 'em, that zaza pack kickin' my ass (Kickin' my ass, yeah)
In the studio dosin', all I can keep from falling asleep
I hate that for you niggas ain't got no bread, but trying to beef
Bein' Black in America, is the hardest thing to be (Baby, tell me, yeah)
Every thug need a lil' love too, baby, how ‘bout me?
Told her, ""Don't call me a stink 'cause I smell like money""
I putting down the greatest babe, hold this here for me
I took her from a nigga, we vibin', two weeks out of the country
So she had a lil' situation, but I could tell it ain't 'bout nothin'
Now me and her rappin', bitch
She say, ""Don't hush me"", I say, ""Don't rush me""
And I can tell how much she like a nigga by the way she suck it
Ho, what it is?
What it is, ho? (What it is?) What's up? (What's up?)
Every good girl needs a little thug (Thug)
Every block boy needs a little love (Love)
If you put it down, I'ma pick it up, up (Ayy), up (Ayy)
What it is, ho? (What it is?) What's up? (What's up?)
Every good girl needs a little thug (Thug)
Every block boy needs a little love (Love)
If you put it down, I'ma pick it up, up (Ayy), up (Ayy)

I don't care if you run the streets
Long as you're comin' home to me
I love the way you walk and the way you speak
He gon' keep it real, that's the deal, that's the reason that I speed down, down (Down, down, down, down)
I put that all on my name (All on my name)
Yeah, that's an even exchange (Tell me what it is)
Stay on your deal, we gon' tell 'em, we gon' tell 'em what, babe

What it is, ho? (What it is?) What's up?
Every good girl needs a little thug (Needs a little thug)
Every block boy needs a little love (Needs a little love, yeah)
If you put it down, I'ma pick it up, up, up
What it is, ho? What's up?
Every good girl needs a little thug (Needs a little love)
Every block boy needs a little love (Needs a little love, thug)
If you put it down, I'ma pick it up, up (Ayy), up (Ayy)
Back it up and do, and do it like that, yeah (What it is? What's up?)
Back it up and do it like that, yeah (Ho)
Back it up, back it and do it like that, yeah
Back it up gon' and do it like that, yeah (Woo)
Hey, what it is? Hey, what's up?
J. White Did It (Yup, yup)
More is on the way (Yup, yup, yeah)
We need a lil' love, you know what I mean? (Yeah, ayy-ayy, woo)
Ride out, woah "
77,Nobody Gets Me,SZA," 
Took a long vacation
No make-up, just JAY-Z
You were balls-deep, now we beefin'
Had me butt-naked at the MGM
So wasted, screamin', ""Fuck that""
Blurry now, but I meant it then
Hurry now, baby, stick it in
'Fore the memories get to kickin' in

It's too late, I don't wanna lose

What's left of you
How am I supposed to tell you
I don't wanna see you with anyone but me?
Nobody gets me like you
How am I supposed to let you go?
Only like myself when I'm with you
Nobody gets me, you do (Do)
You do
Nobody gets me, you do (Do)
You do
Nobody gets me, you do
You do
Nobody gets me, you do

Took me out to the ballet
You proposеd, I went on the road
You was feelin' empty so you lеft me
Now I'm stuck dealin' with a deadbeat
If I'm real, I deserve less
If I was you, I wouldn't take me back
I pretend when I'm with a man it's you

And I know that it's too late, I don't wanna lose

What's left of you
How am I supposed to tell you
I don't wanna see you with anyone but me?
Nobody gets me like you
How am I supposed to let you go?
Only like myself when I'm with you
Nobody gets me, you do (Do)
You do
Nobody gets me, you do (Do)
You do
Nobody gets me, you do (Do)

You do
Nobody gets me, you do (Do)
Nobody gets me, you do "
78,Rich Men North of Richmond,Oliver Anthony Music," 
I've been sellin' my soul, workin' all day
Overtime hours for bullshit pay
So I can sit out here and waste my life away
Drag back home and drown my troubles away

It's a damn shame what the world's gotten to
For people like me and people like you
Wish I could just wake up and it not be true
But it is, oh, it is

Livin' in the new world
With an old soul
These rich men north of Richmond
Lord knows they all just wanna have total control
Wanna know what you think, wanna know what you do
And they don't think you know, but I know that you do
'Cause your dollar ain't shit and it's taxed to no end
'Cause of rich men north of Richmond

I wish politicians would look out for miners
And not just minors on an island somewhere
Lord, we got folks in the street, ain't got nothin' to eat
And the obese milkin' welfare
Well, God, if you're five-foot-three and you're three-hundred pounds
Taxes ought not to pay for your bags of Fudge Rounds
Young men are puttin' themselves six feet in the ground
'Cause all this damn country does is keep on kickin' them down

Lord, it's a damn shame what the world's gotten to
For people like me and people like you
Wish I could just wake up and it not be true
But it is, oh, it is

Livin' in the new world
With an old soul
These rich men north of Richmond
Lord knows they all just wanna have total control
Wanna know what you think, wanna know what you do
And they don't think you know, but I know that you do
'Cause your dollar ain't shit and it's taxed to no end
'Cause of rich men north of Richmond

I've been sellin' my soul, workin' all day
Overtime hours for bullshit pay "
79,Super Freaky Girl,Nicki Minaj," 
She's alright
That girl’s alright with me, yeah
Ayo (Hey, hey, hey, hey)

I can lick it, I can ride it while you slippin' and slidin'
I can do all them little tricks and keep the dick up inside it
You can smack it, you can grip it, you can go down and kiss it
And every time he leave me ’lone, he always tell me he miss it

He want a F-R-E-A-K (Freaky girl)
F-R-E-A-K (Freaky girl)
A-K, A-K, A-K
E-A-K (Freaky girl)
F-R-E-A-K (Freaky girl)

One thing about me, I'm the baddest alive
He know the prettiest bitch didn't come until I arrive
I don't let bitches get to me, I fuck they man if they try
I got a princess face, a killer body, samurai mind
They can't be Nicki, they so stupid, I just laugh when they try
A thong bikini up my ass, I think I'll go for a dive
His ex-bitch went up against me, but she didn't survive
On applications I write ""pressure"" 'cause that’s what I apply (Brr)
P-P-P-Pressure applied, can’t fuck a regular guy
Wetter than umbrellas and stickier than apple pie

I can lick it, I can ride it while you slippin' and slidin’
I can do all them little tricks and keep the dick up inside it
You can smack it, you can grip it, you can go down and kiss it
And every time he leave me 'lone, he always tell me he miss it

He want a F-R-E-A-K (Freaky girl)
F-R-E-A-K (Freaky girl)
A-K, A-K, A-K
E-A-K (Freaky girl)
F-R-E-A-K (Freaky girl)

'Cause, what the fuck? This ain't Chanel, nigga, custom down?
Like, what the fuck? This ain’t Burberry, custom brown
He said ""Could you throw it back while you touch the ground?""
Then he said ""Do that pussy purr?"" I said ""Yup, meow""
Hold up, fuck-boys, ain't need no for you to roll up
Ain't no need for you to double tap neither, scroll up
Keep these bitches on they toes like Manolo
Be on the lookout when I come through, BOLO
Oh, woah, elegant bitch with a ho glow
If it ain't big, then I won't blow
Eeny, meeny, miny, moe
Fuck is the tea? I just F'd a G (Let's go)
Made him say ""Uh,"" just ask Master P (Let's go)
Ball so hard, I just took a knee (Let's go)
Get me rocky ASAP, nigga, word to Rih (Let's go)
Freak
F-F-Freak
Some gyal a freak, gyal a freak
Gyal a freak, freak, freak, freak

I can lick it, I can ride it while you slippin' and slidin'
I can do all them little tricks and keep the dick up inside it
You can smack it, you can grip it, you can go down and kiss it
And every time he leave me 'lone, he always tell me he miss it

He want a F-R-E-A-K (Freaky girl)
F-R-E-A-K (Freaky girl)
A-K, A-K, A-K
E-A-K (Freaky girl)
F-R-E-A-K (Freaky girl) "
80,Dial Drunk,Noah Kahan Post Malone," 
I'm rememberin' I promised to forget you now
But it's rainin' and I'm callin' drunk
And my medicine is drownin' your perspective out
So I ain't takin' any fault
Am I honest still? Am I half the man I used to be?
I doubt it, forget about it, whatever
And the dial tone is all I have

I ain't proud of all the punches that I've thrown
In the name of someone I no longer know
For the shame of bein' young, drunk, and alone
Traffic lights and a transmitter radio
I don't like that when they threw me in the car
I gave your name as my emеrgency phone call
Honey, it rang and rang
Evеn the cops thought you were wrong for hangin' up
I dial drunk, I'll die a drunk, I'd die for you

I'll die

Drinks pourin', couldn't stop it
Turn another slow dance into a mosh pit
Tuck my head, then I heard the lock and
Told him that my first car was a Crown Vic
Talkin' 'bout last time I was in the back of a cop car
I fell in love
And my face on the cold window
Try to sober back up and loosen my cuffs
And it's all the same anyway

Mm, I ain't proud of all the punches that I've thrown
In the name of someone I no longer know
For the shame of bein' young, drunk, and alone
Traffic lights and a transmitter radio
I don't like that when they threw me in the car
I gave your name as my emergency phone call
Honey, it rang and rang
Even the cops thought you were wrong for hangin' up
I dial drunk, I'll die a drunk, I'd die for you

Well, I'd die for you

I beg you, sir, just let me call
I'll give you my blood alcohol
I'll rot with all the burnouts in the cell
I'll change my faith, I'll praise the flag
Let's wait, I swear she'll call me back
""Son, are you a danger to yourself?""
Fuck that, sir, just let me call
I'll give you my blood alcohol
I'll rot with all the burnouts in the cell
I'll change my faith, I'll kiss the badge
Let's wait, I swear she'll call me back
""Son, why do you do this to yourself?""
And I said I ain't proud of all the punches that I've thrown, ah
In the name of someone I no longer know (I no longer know)
For the shame of bein' young, drunk, and alone
Traffic lights and a transmitter radio, ah
I don't like that when they threw me in the car
I gave your name as my emergency phone call
Honey, it rang and rang
Even the cops thought you were wrong for hangin' up
I dial drunk, I'll die a drunk, I'd die for you"
81,What Was I Made For?,Billie Eilish,"
I used to float, now I just fall down
I used to know, but I'm not sure now
What I was made for
What was I made for?

Takin' a drive, I was an ideal
Looked so alive, turns out I'm not real
Just somethin' you paid for
What was I made for?

'Cause I, I
I don't know how to feel
But I wanna try
I don't know how to feel
But someday, I might
Someday, I might

Mm, mm, ah
Mm, mm, mm

When did it end? All the enjoyment
I'm sad again, don't tell my boyfriend
It's not what he's made for
What was I made for?

'Cause I, 'cause I
I don't know how to feel
But I wanna try
I don't know how to feel
But someday, I might
Someday, I might

Think I forgot how to be happy
Somethin' I'm not, but somethin' I can be
Somethin' I wait for
Somethin' I'm made for
Somethin' I'm made for "
82,Seven,Jungkook,"Weight of the world on your shoulders
I kiss your waist and ease your mind
I must be favored to know ya
I take my hands and trace your lines

It's the way that you can ride
It's the way that you can ride (oh-oh-oh-oh)
Think I met you in another life
So break me off another time (oh-oh-oh-oh)
You wrap around me and you give me life
And that's why night after night
I'll be fuckin' you right

Monday, Tuesday, Wednesday, Thursday, Friday, Saturday, Sunday (a week)
Monday, Tuesday, Wednesday, Thursday, Friday, seven days a week
Every hour, every minute, every second, you know night after night
I'll be fuckin' you right seven days a week

You love when I jump right in
All of me I'm offering
Show you what devotion is
Deeper than the ocean is

Wind it back, I'll take it slow
Leave you with that afterglow
Show you what devotion is
Deeper than the ocean is

It's the way that you can ride
It's the way that you can ride (oh-oh-oh-oh)
Think I met you in another life
So break me off another time (oh-oh-oh-oh)
You wrap around me and you give me life
And that's why night after night
I'll be fuckin' you right

Monday, Tuesday, Wednesday, Thursday, Friday, Saturday, Sunday (a week)
Monday, Tuesday, Wednesday, Thursday, Friday, seven days a week
Every hour, every minute, every second, you know night after night
I'll be fuckin' you right seven days a week

Monday, Tuesday, Wednesday, Thursday, Friday, Saturday, Sunday (a week)
Monday, Tuesday, Wednesday, Thursday, Friday, seven days a week
Every hour, every minute, every second, you know night after night
I'll be fuckin' you right seven days a week

(Big Latto)
Tightly take control, tightly take his soul
Take your phone and put it in the camera roll (uh)
Leave them clothes at the door
What you waiting for? Better come and hit ya goals
Uh, he jump in it both feet
Going to the Sun-up, we ain't gettin' no sleep
Seven days a week, seven different sheets
Seven different angles, I can be your fantasy
Open up, say: Ah
Come here, baby, let me swallow your pride
What you on? I can match your vibe
Hit me up and I'ma Cha Cha Slide
You make Mondays feel like weekends
I make him never think about cheatin'
Got you skippin' work and meetings
Fuck it, let's sleep in, yeah (seven days a week, ooh)

Monday, Tuesday, Wednesday, Thursday, Friday, Saturday, Sunday (a week)
Monday, Tuesday, Wednesday, Thursday, Friday, seven days a week
Every hour, every minute, every second, you know night after night
I'll be fuckin' you right seven days a week

Monday, Tuesday, Wednesday, Thursday, Friday, Saturday, Sunday (a week)
Monday, Tuesday, Wednesday, Thursday, Friday, seven days a week
Every hour, every minute, every second, you know night after night
I'll be fuckin' you right seven days a week"
83,Wait for U,Future ," 
I will wait for you, for you
Early in the mornin', late at night (I will wait for you)
It doesn't even matter what time it is (I will wait for you)
Presidential Rollie, RM, wait (Higher, sayin' higher-er-er-er)
Whenever I find time, it's okay (Ayy)
ATL Jacob, ATL Jacob

You pray for my demons, girl, I got you
Every time I sip on codeine, I get vulnerable
I'm knowin' the sounds of the storm when it come
She understand I can't take her everywhere a nigga going
I been in the field like thе children of the corn

I can hear your tеars when they drop over the phone
Get mad at yourself 'cause you can't leave me alone
Gossip, bein' messy, that ain't what we doing (World was ending)
Travel around the world (Would you cry or would you try to get me?)
Over the phone, dropping tears (Tell me now, I want you to be clear, yeah)
I get more vulnerable when I do pills (Tell me now, I need you to be clear, yeah)
When you drunk, you tell me exactly how you feel (I will wait for you, for you)
When I'm loaded, I keep it real (I will wait for you, I will wait for you)
Please tell a real one exactly what it is (I will wait, will wait, for you, for you)
Don't say it 'cause you know that's what I wanna hear (I will wait for you, I will wait for you)

Yeah, I been trappin' 'round the world
I sit on my balcony and wonder how you feelin'
I got a career that takes my time away from women
I cannot convince you that I love you for a livin' (Will wait for you, for you)
I be on your line, feelings flowin' like a river
You be textin' back you at Kiki on the river (I will wait for you)
Message say delivered (I will wait for you), but I know that you don't get it
Why you introduce us if you knew that you was with him? (I will wait for you, for you, for you)
Made me shake his hand when y'all been fuckin' for a minute (I will wait for you, for you)
Walk me off the plank because you know that I'm a swimmer (I will wait for you)
Supposed to be your dog, but you done put me in a kennel
Girl, put a muzzle on it, all that barkin' over dinner
I was fuckin' with you when you had the tiny Presidential
You got better when you met me and that ain't coincidental
Tried to bring the best out you, guess I'm not that influential
Guess I'm not the one that's meant for you

I can hear your tears when they drop over the phone
Get mad at myself 'cause I can't leave you alone
Gossip, bein' messy, that ain't what we doing, yeah (World was ending)
Trappin' around the world (Would you cry or would you try to get me?)
Over the phone, dropping tears (Tell me now, I want you to be clear, yeah)
I get more vulnerable when I do pills (Tell me now, I need you to be clear, yeah)
When you drunk, you tell me exactly how you feel (I will wait for you, for you)
When I'm loaded, I keep it real (I will wait for you, I will wait for you)
Please tell a real one exactly what it is (I will wait, will wait, for you, for you)
Don't say it 'cause you know that's what I wanna hear (I will wait for you, I will wait for you)
Early in the mornin', late at night
It don't even matter what time it is
World was ending, would you cry or would you try to get me?
Tell me now, I want you to be clear, yeah
Tell me now "
84,Last Christmas,Wham!," 
(Happy Christmas)
Ah, ah-ah
Ooh-woah
Oh-oh

Last Christmas, I gave you my heart
But the very next day, you gave it away
This year, to save me from tears
I'll give it to someone special
Last Christmas, I gave you my heart
But the very next day, you gave it away (You gave it away)
This year, to save me from tears
I'll give it to someone special (Special)

Once bitten and twice shy
I keep my distance, but you still catch my eye
Tell me, baby, do you recognise me?
Well, it's been a year, it doesn't surprise me
""Happy Christmas,"" I wrapped it up and sent it
With a note saying, ""I love you,"" I meant it
Now I know what a fool I've been
But if you kissed me now, I know you'd fool me again

Last Christmas, I gave you my heart
But the very next day, you gave it away (You gave it away)
This year, to save me from tears
I'll give it to someone special (Special)
Last Christmas, I gave you my heart
But the very next day, you gave it away
This year, to save me from tears
I'll give it to someone special (Special, oh)
Oh, oh, baby

A crowded room, friends with tired eyes
I'm hiding from you and your soul of ice
My God, I thought you were someone to rely on
Me? I guess I was a shoulder to cry on
A face of a lover with a fire in his heart
A man undercover, but you tore me apart
Ooh-ooh
Now I've found a real love, you'll never fool me again

Last Christmas, I gave you my heart
But the very next day, you gave it away (You gave it away)
This year, to save me from tears
I'll give it to someone special (Special)
Last Christmas, I gave you my heart
But the very next day, you gave it away (You gave me away)
This year, to save me from tears
I'll give it to someone special (Special)
A face on a lover with a fire in his heart (I gave you my heart)
A man undercover, but you tore him apart
Maybe next year
I'll give it to someone, I'll give it to someone special

Special
Someone
Someone
I'll give it to someone, I'll give it to someone special
Who give me something in return
(I'll give it to someone, I'll give it to someone)
Hold my heart and watch it burn
I'll give it to someone, I'll give it to someone special
I thought you were here to stay
How could you love me for a day?
I thought you were someone special
I gave you my heart
I'll give it to someone, I'll give it to someone

Last Christmas, I gave you my heart
You gave it away
I'll give it to someone, I'll give it to someone
La-la
La-la-la-la-la
La-la
La-la-la-la-la
La-la-la-la-la-la-la
La-la-la-la-la-la-la-la
La-la-la
La-la-la-la-la
La-la-la-la-la
La-la-la-la-la-la-la
La-la-la-la-la-la-la-la "
85,Handle on You,Parker McCollum," 
I went and bought the biggest bottle they got 'cause you're gone
Drop a needle on a vinyl and cry to an old Haggard song
Sittin' at the table, baby, breakin' the seal
Gonna see how much of this pain I can kill
I went and bought the biggest bottle they got 'cause you're gone

Tennessee and Kentucky
'Cause you ain't here to love me
I drink now that there's nothing to lose
I've been fightin' with your memory
I hate the way it hits me
I wake up every day black and blue
After all this back and forth, a fifth won't do
Yeah, I finally got a handle, finally got a handle on you

I tell myself that I should quit, but I don't listen to drunks
I keep on sippin' 'til ""I miss you"" don't roll off my tongue
Since you poured our love down the sink
I think I'll just stay here and drink
I tell myself that I should quit, but I don't listen to drunks

Tennessee and Kentucky
'Cause you ain't here to love me
I drink now that there's nothing to lose
I've been fightin' with your memory
I hate the way it hits me
I wake up every day black and blue
After all this back and forth, a fifth won't do
Well, I finally got a handle on you

After all this back and forth, a fifth won't do
Yeah, I finally got a handle, finally got a handle on you
Handle on you
Yeah, I finally got a handle on you"
86,Por Las Noches,Peso Pluma," 
Cuando por las noches recordaba todo
El olor de aquel perfume sobre todo
Las sábanas blancas donde te escondías dentro
Eres intocable como joya de oro
Esas piernas largas comerme yo solo
Y tus ojos grandes, me perdí en un laberinto
Y pensar
Que tú ya no vas a estar
Pasará
Solito me dejará
Intentar
Solo un beso y tú te vas
De mi vida, ah, ah
Como tú no hay nadie más
No hay nadie más
Ah
¿Y qué?
Si te sientes sola no me llames porfa
Me pongo sensible, me imagino tu sombra
Clase Azul es el tequila e interior la ropa
Rico Prat champaña, el polvo es color rosa
Me contactó un ángel, eres tú mi hermosa
La que me alegra los días y sigo tomando
Y pensar
Que tú ya no vas a estar
Pasará
Solito me dejarás
Intentar
Solo un beso y tú te vas
De mi vida, ah, ah
Como tú no hay nadie más
No hay nadie más"
