Rank,Musica,Artista,Letra
24,Industry Baby,Lil Nas X & Jack Harlow," 
(D-D-Daytrip took it to ten, hey)
Baby back, ayy, couple racks, ayy
Couple Grammys on him, couple plaques, ayy
That's a fact, ayy, throw it back, ayy
Throw it back, ayy
And this one is for the champions
I ain't lost since I began, yeah
Funny how you said it was the end, yeah
Then I went did it again, yeah

I told you long ago on the road
I got what they waiting for
I don't run from nothing, dog
Get your soldiers, tell 'em I ain't layin' low
You was never really rooting for me anyway
When I'm back up at the top, I wanna hear you say
He don't run from nothin', dog
Get your soldiers, tell 'em that the break is over

Uh, need to, uh
Need to get this album done
Need a couple number onеs
Need a plaque on every song
Need mе like one with Nicki now
Tell a rap nigga I don't see ya, hah
I'm a pop nigga like Bieber, hah
I don't fuck bitches, I'm queer, hah
But these niggas bitches like Madea, yeah, yeah, yeah, ayy (Yeah)
Oh, let's do it
I ain't fall off, I just ain't release my new shit
I blew up, now everybody tryna sue me
You call me Nas, but the hood call me Doobie, yeah

And this one is for the champions
I ain't lost since I began, yeah
Funny how you said it was the end, yeah
Then I went did it again, yeah

I told you long ago on the road
I got what they waiting for (I got what they're waiting for)
I don't run from nothing, dog
Get your soldiers, tell 'em I ain't layin' low (Bitch, I ain't runnin' from nowhere)
You was never really rooting for me anyway (Ooh, ooh)
When I'm back up at the top, I wanna hear you say (Ooh, ooh)
He don't run from nothin', dog
Get your soldiers, tell 'em that the break is over (Yeah)

My track record so clean, they couldn't wait to just bash me
I must be gettin' too flashy, y'all shouldn't have let the world gas me (Woo)
It's too late 'cause I'm here to stay and these girls know that I'm nasty (Mmm)
I sent her back to her boyfriend with my handprint on her ass cheek
City talkin', we takin' notes
Tell 'em all to keep makin' posts
Wish he could, but he can't get close
OG so proud of me that he chokin' up while he makin' toasts
I'm the type that you can't control, said I would, then I made it so
I don't clear up rumors (Ayy), where's y'all sense of humor? (Ayy)
I'm done makin' jokes 'cause they got old like baby boomers
Turned my haters to consumers, I make vets feel like they juniors (Juniors)
Say your time is comin' soon, but just like Oklahoma (Mmm)
Mine is comin' sooner (Mmm), I'm just a late bloomer (Mmm)
I didn't peak in high school, I'm still out here gettin' cuter (Woo)
All these social networks and computers
Got these pussies walkin' 'round like they ain't losers
I told you long ago on the road
I got what they waiting for (I got what they waiting for)
I don't run from nothing, dog
Get your soldiers, tell 'em I ain't layin' low (Bitch, I ain't runnin' from nowhere)
You was never really rooting for me anyway
When I'm back up at the top, I wanna hear you say
He don't run from nothin', dog
Get your soldiers, tell 'em that the break is over
Yeah
I'm the industry baby, mmm
I'm the industry baby
Yeah "
25,Therefore I Am,Billie Eilish,"
I'm not your friend
Or anything, damn
You think that you're the man
I think, therefore, I am
I'm not your friend
Or anything, damn
You think that you're the man
I think, therefore, I am

Stop, what the hell are you talking about? Ha
Get my pretty name out of your mouth
We are not the same with or without
Don't talk 'bout me like how you might know how I feel
Top of the world, but your world isn't real
Your world's an ideal

So go have fun
I really couldn't care less
And you can give 'em my best, but just know

I'm not your friend
Or anything, damn
You think that you're the man
I think, therefore, I am
I'm not your friend
Or anything, damn
You think that you're the man
I think, therefore, I am

I don't want press to put your name next to mine
We're on different lines, so I
Wanna be nice enough, they don't call my bluff
'Cause I hate to find
Articles, articles, articles
Rather you remain unremarkable (Got a lotta)
Interviews, interviews, interviews
When they say your name, I just act confused

Did you have fun?
I really couldn't care less
And you can give 'em my best, but just know

I'm not your friend
Or anything, damn
You think that you're the man
I think, therefore, I am
I'm not your friend
Or anything, damn
You think that you're the man
I think, therefore, I am

I'm sorry
I don't think I caught your name
I'm sorry
I don't think I caught your name
I'm not your friend (I'm not your friend)
Or anything, damn
You think that you're the man (They wanna, they can try)
I think, therefore, I am
I'm not your friend (I'm not your friend)
Or anything, damn (They wanna)
You think that you're the man
I think, therefore, I am "
26,Up,Cardi B," 
Up, up, up (Ayy), up (Uh), up, look (This is fire)
Once upon a time, man, I heard that I was ugly
Came from a bitch who nigga wanna fuck on me

I said my face bomb, ass tight
Racks stack up Shaq height
Jewelry on me, flashlight
I been lit since last night
Hit him with that good good
Make a nigga act right
Broke boys don't deserve no pussy
(I know that's right)

Big bag bussin' out the Bentley Bentayga
Man, Balenciaga Bardi back and all these bitches fucked
It's big bags bussin' out the Bentley Bentayga, man
Birkin bag, Bardi back and all you bitches fucked
If it's up, then it's up, then it's up, then it's stuck
If it's up, then it's up, then it's up, then it's stuck, huh (Ayy)
Up, then it's up, if it's up, then it's stuck (Huh)
If it's up, then it's up, then it's up, then it's stuck, huh (Woo)

I could make the party hot, I could make your body rock
Bitches say they fuckin' with me, chances are they probably not
If I had a dick, you'd probably lick it like a lollipop
Hoes speakin' cap-enese, hit 'em with karate chop
I'm forever poppin' shit, pullin' up and droppin' shit
Gotta argue with him 'cause a nigga love a toxic bitch
Niggas out here playin', gotta make 'em understand
If ain't no ring on my finger, you ain't goin' on my 'Gram

I said my face bomb, ass tight (Yeah)
Racks stack up Shaq height (Yeah)
Jewelry on me, flashlight (Huh)
I been lit since last night (Woo)
Hit him with that good good
Make a nigga act right (Ah)
Broke boys don't deserve no pussy
(I know that's right)

Big bag bussin' out the Bentley Bentayga
Man, Balenciaga Bardi back and all these bitches fucked (Woo)
It's big bags bussin' out the Bentley Bentayga, man
Birkin bag, Bardi back and all you bitches fucked
If it's up, then it's up, then it's up, then it's stuck
If it's up, then it's up, then it's up, then it's stuck, huh (Ayy)
Up, then it's up, if it's up, then it's stuck
If it's up, then it's up, then it's up, then it's stuck, huh (Ayy)

Bitches ain't fuckin' with me now and I can see why
Dirty-ass, dusty-ass bitch, you got pink eye
Bitches want smoke until I bring it to they doorstep
Tell that bitch back back, breath smell like horse sex (Ha)
Put it on him now, he will never be the same (He won't)
Tatted on my ass 'cause I really like the pain (Ah)
He nutted on my butt, I said, ""I'm glad that you came""
If that nigga had a twin, I would let 'em run a train (Skrrt)

Big bag bussin' out the Bentley Bentayga
Man, Balenciaga Bardi back and all these bitches fucked (Woo)
It's big bags bussin' out the Bentley Bentayga, man
Birkin bag, Bardi back and all you bitches fucked (Ooh)
If it's up, then it's up, then it's up, then it's stuck
If it's up, then it's up, then it's up, then it's stuck, huh (Woo)
Up, then it's up, if it's up, then it's stuck (Woo)
If it's up, then it's up, then it's up, then it's stuck, huh
Look, gotta play it safe, huh
No face, no case (Hahaha) "
27,Fancy Like,Walker Hayes," 
Ayy
My girl is bangin', she's so low maintenance
Don't need no champagne-poppin' entertainment
Take her to Wendy's, can't keep her off me
She wanna dip me like them fries in her Frosty

But every now and then, when I get paid
I gotta spoil my baby with an upgrade (Yeah)
Ayy, ayy, ayy

Yeah, we fancy like Applebee's on a date night
Got some Bourbon Street steak with the Oreo shake
Get some whipped cream on the top, too
Two straws, one check, girl, I got you
Bougie like Natty in the styrofoam
Squeaky-squeakin' in the truck bed all the way home
With some Alabama-jamma, she my Dixieland delight (Hey)
That's how we do, how we do, fancy like

Ooh
Fancy like, ooh
Fancy like, ooh
Fancy like, ooh

Uh
Don't need no Tesla to impress her (Don't need no Tesla to impress her)
My girl is happy rollin' on a Vespa (There she go)
Don't need no mansion to get romancin' (Ooh, woo)
She's super fine, double wide, slow dancin' (Slow dancin')

But every now and then, when I get paid
I gotta spoil my baby with an upgrade (Yeah)
Ayy, ayy, ayy

Yeah, we fancy like Applebee's on a date night (That's right)
Got some Bourbon Street steak with the Oreo shake (Ayy)
Get some whipped cream on the top, too (Gotta add that whipped cream)
Two straws, one check, girl, I got you (Girl, I got you)
Bougie like Natty in the styrofoam (Styrofoam)
Squeaky-squeakin' in the truck bed all the way home (All the way home)
With some Alabama-jamma, she my Dixieland delight (Hey)
That's how we do, how we do, fancy like

My new, clean blue jeans without the holes in 'em
Country kisses on my lips without  the Skoal in 'em
Yeah, she probably gon' be keepin' some Victoria's Secrets
Maybe a little Maybelline but she don't need it
In the kitchen light, radio slows down
Boxed wine, then her up-do goes down
Ayy
Yeah, we fancy like Applebee's on a date night (That's right)
Got some Bourbon Street steak with the Oreo shake (Ayy)
Get some whipped cream on the top, too (Gotta add that whipped cream)
Two straws, one check, girl, I got you
Bougie like Natty in the styrofoam (Styrofoam)
Squeaky-squeakin' in the truck bed all the way home (All the way home)
With some Alabama-jamma, she my Dixieland delight (Hey)
That's how we do, how we do, fancy like "
28,Dakiti,Bad Bunny & Jhay Cortez," 

Baby, ya yo me enteré, se nota cuando me ve'
Ahí donde no has llega'o sabe' que yo te llevaré
Y dime qué quiere' beber, es que tú ere' mi bebé
¿Y de nosotro' quién va a hablar? Si no nos dejamo' ver

Y a vece' e' Dolce, a vece' Bulgari
Cuando te lo quito despué' de lo' partie'
Las copa' de vino, las libra' de mari
Tú estás bien suelta, yo de safari
Tú muevе' el culo fenomenal
Pa' yo dеvorarte como animal
Si no te ha' venío', yo te vo'a esperar
En mi cama y lo vo'a celebrar

Baby, a ti no me opongo
Y siempre te lo pongo
Y si tú me tira', vamo' a nadar en lo hondo
Si e' por mí te lo pongo
De septiembre hasta agosto
A mí sin cojone' lo que digan tu' amiga'

Ya yo me enteré, se nota cuando me ve'
Ahí donde no ha' llega'o sabe' que yo te llevaré
Y dime qué quiere' beber, e' que tú ere' mi bebé
¿Y de nosotro' quién va a hablar? Si no nos dejamo' ver (¿Me sigue'?)

Mami, me tiene' juquea'o, sí
Si fuera' la Uru', me tuviese' parquea'o
Dando vuelta' por Condado, contigo siempre arrebata'o
Tú no ere' mi señora, pero
Toma cinco mil, gástalo en Sephora
Louis Vuitton, ya no compra en Pandora
Como piercing, a los hombre' perfora, eh-eh-eh

Hace tiempo le rompieron el cora (El cora)
Estudiosa, puesta pa' ser doctora (Doctora)
Pero (Pero), le gustan los títere' wheeleando motora (Motora)
Yo estoy pa' ti las veinticuatro hora'

Baby, a ti no me opongo
Y siempre te lo pongo (-pre te lo pongo)
Y si tú me tira', vamo' a nadar en lo hondo (Nadar en lo hondo)
Si es por mí te lo pongo
De septiembre hasta agosto
Y a mí sin cojone' lo que digan tu' amiga'
Ya yo me enteré, se nota cuando me ve'
Ahí donde no ha' llega'o sabe' que yo te llevaré
Y dime qué quiere' beber, e' que tú ere' mi bebé
¿Y de nosotro' quién va a hablar? Si no nos dejamo' ver

Y a vece' e' Dolce, a vece' Bulgari
Cuando te lo quito despué' de lo' partie'
La' copa' de vino, las libra' de mari
Tú estás bien suelta, yo de safari
Tú mueve' el culo fenomenal
Pa' yo devorarte como animal
Si no te ha' venío', yo te vo'a esperar
En mi cama y lo vo'a celebrar "
29,Best Friend,Saweetie," 
That's my best friend, she a real bad bitch
Got her own money, she don't need no nig'
On the dance floor, she had two, three drinks
Now she twerkin', she throw it out and come back in
That's my best friend, she a real bad bitch
Drive her own car (Alright), she don't need no Lyft
In the strip club (Oh yeah), know my girl gon' tip
Now she twerkin' (Huh), she throw it out and come back in (Ha)

Beep-beep, is that my bestie in a Tessie?
Fresh blow out, skin on ten, ooh, she ready
Bitch, you look goodt, with a T at the end
I'ma hype her every time, that my mothеrfuckin' friend
She been down since thе jellies and the bobos
Now we steppin' out the G in Manolos
When we pull up to the scene, they be filled with jealousy
If a bitch get finicky, she gon' bring that energy (Pop-pop-pop)
I hit her phone with the tea, like, ""Bitch, guess what?
All the rich-ass boys wanna fuck on us""
All this ass sittin' up, you could look, don't touch
And I'm bad bussin' bands every time we link up

That's my best friend, she a real bad bitch
Got her own money, she don't need no nig'
On the dance floor, she had two, three drinks
Now she twerkin', she throw it out and come back in
That's my best friend, she a real bad bitch
Drive her own car (Alright), she don't need no Lyft
In the strip club (Oh yeah), know my girl gon' tip
Now she twerkin' (Huh), she throw it out and come back in (Ha)

That's my best friend, if you need a freak
I ain't dumb, but motherfucker, she my Tweedledee
If she ride for me (Ride), she don't need a key
If you sideways, she'll straighten you if needed be
And she so bad that I just can't take that bitch nowhere
She off her fifth shot, said, ""Mm-mm, don't go there""
Bitch, break her back, she protect and attack
Get that strap like them buckle, foot on neck, give no air
Whole world wanna be us
And my main bitch, she my day-one
On my way, bitch, let you get drunk
And celebrate 'cause we the baddest in the club

That's my best friend, she a real bad bitch
Got her own money, she don't need no nig'
On the dance floor, she had two, three drinks
Now she twerkin', she throw it out and come back in
That's my best friend, she a real bad bitch
Drive her own car (Alright), she don't need no Lyft
In the strip club (Oh yeah), know my girl gon' tip
Now she twerkin' (Huh), she throw it out and come back in

Hah, best friend, you the baddest and you know it (You know)
Uh-oh, girl, I think our booty growin' (Ayy, yeah)
Fuck it up in the mirror, hit them poses (Pose)
Best friend, damn, you motherfuckin' glowin' (Woo, woo)
Best friend, damn, your wrist look like it's frozen (It froze)
Uh-oh, girl, I think our booty growin' (Uh-oh)
Fuck it up in the mirror, hit them poses (Hit the pose)
Best friend, you my motherfuckin' soulmate (Soulmate) "
30,Rapstar,Polo G," 
(Shout out my nigga Synco)

Uh (Tuned up), copped a BMW, new deposit, I picked up another bag
Like fuck it, I'ma count while I'm in it
I hear planes flyin', crowds screamin', money counters, chains clangin'
Shit, I guess that's how it sound when you winnin'
I ain't jokin', do it sound like I'm kiddin'?
I been makin' like two thousand a minute
So high up through the clouds, I was swimmin'
I'm probably gon' drown when I'm in it
I bet she gon' get loud when I'm in it
And we might have a child when I'm finished

Uh, I won't love a ho, after we fuck, she can't get near me
Only bitch I give a conversation to is Siri
My pants Amiri, yes, I'm winnin', clearly
I'm the chosen one, seen my potential, so they fear me
Lately I've been prayin', God, I wonder, can You hear me?
Thinkin' 'bout the old me, I swear I miss you dearly
Stay down 'til you come up, I've been stickin' to that theory
Every day a battle, I'm exhausted and I'm weary
Make sure I smile in public, when alone, my eyes teary
I fought through it all, but that shit hurt me severely
I've been gettin' high to hide behind my insecurities
Takin' different pills, but I know it ain't gon'—

Uh, copped a BMW, new deposit, I picked up another bag
Like fuck it, I'ma count while I'm in it
I hear planes flyin', crowds screamin', money counters, chains clangin'
Shit, I guess that's how it sound when you winnin'
I ain't jokin', do it sound like I'm kiddin'?
I been makin' like two thousand a minute
So high up through the clouds, I was swimmin'
I'm probably gon' drown when I'm in it
I bet she gon' get loud when I'm in it (Uh, uh)
And we might have a child when I'm finished

They say I'm Pac rebirth, never put out a weak verse
Homicides when we lurk, I'ma step 'til my feet hurt
Been puttin' them streets first
White tees turned burgundy t-shirts
Lookin' for somethin' real, he stuck in a deep search
Anxiety killin' me, I just want to leave Earth
When they ask if I'm okay, it just make everything seem worse
Try and explain your feelings, sound like something you rehearsed
Stabbed me in my back with a clean smirk
Lookin' so deep into your eyes, I can read your thoughts, so
Shut the fuck—, I mean, please don't talk
I done been through too much and I don't need another loss
Put that on every war scar for every battle I fought
Uh, copped a BMW, new deposit, I picked up another bag
Like fuck it, I'ma count while I'm in it
I hear planes flyin', crowds screamin', money counters, chains clangin'
Shit, I guess that's how it sound when you winnin'
I ain't jokin', do it sound like I'm kiddin'?
I been makin' like two thousand a minute
So high up through the clouds, I was swimmin'
I'm probably gon' drown when I'm in it
I bet she gon' get loud when I'm in it
And we might have a child when I'm finished

When I'm finished, when I'm finished "
31,Heartbreak Anniversary,Giveon," 
Ooh

Balloons are deflated
Guess they look lifeless like me
We miss you on your side of the bed, mmm
Still got your things here
And they stare at me like souvenirs
Don't wanna let you out my head

Just like the day that I met you, the day I thought forever
Said that you love me, but that'll last for never
It's cold outside like when you walked out my life
Why you walk out my life?

I get like this every time
On these days that feel like you and me
Heartbreak anniversary
'Cause I remember every time
On these days that feel like you and me
Heartbreak anniversary, do you ever think of me?
(Oh-ooh) No
(Ooh) No, no, no
(Ooh, ooh) Ooh, nah (Ooh)

I'm buildin' my hopes up
Like presents unopened 'til this day
I still see the messages you read, mmm
I'm foolishly patient (Foolishly patient)
Can't get past the taste of your lips (Taste of your lips)
Don't wanna let you out my head

Just like the day that I met you, the day I thought forever
Said that you love me but that'll last for never
It's cold outside like when you walked out my life
Why you walk out my life? (My life)

I get like this every time
On these days that feel like you and me
Heartbreak anniversary
'Cause I remember every time
On these days that feel like you and me
Heartbreak anniversary, do you ever think of me?
(Oh-ooh) Of me
(Ooh) 'Cause I think of you, think of you
(Ooh, ooh, ooh-ooh) "
32,For the Night,Pop Smoke," 
CashMoneyAP
Kill 'em, get 'em, get 'em, oh
Oh (I'm tryna fuckin' get 'em), oh (I'm tryna fuck on a thot)
Oh, oh (Get 'em), oh
Oh (Gettin' big on this), oh, oh, oh
Oh, oh, oh, oh
Oh, oh, oh
What do you want? Won't tell you twice, yeah
I'm a thief in the night (Thief in the night), oh

I did some wrong (Oh, oh), but I'm always right (Oh, oh)
Said I know how to shoot (Oh, oh) and I know how to fight
Boy, I'll tell you once, won't tell you twice
I'm real discreet, like a thief in the night (Look)

If I call you bae, you bae for the day
Or a bae for the night, you not my wife
She want a killer to fuck all night
I wanna fuck on a thot, gimme head all night
AP, big rocks, in the hood with the 'rillas
Five K on the dinner, bring three hundred thou' to the dealer

I did some wrong (Oh, oh), but I'm always right (Oh, oh)
Said I know how to shoot (Oh, oh) and I know how to fight
Boy, I'll tell you once, won't tell you twice
I'm real discreet, like a thief in the night (Baby)

I'm rich but I'm ridin', I'm low on exotic, I'm 'bout to fly out and go get me some
Nothin' ain't seen, all this money on me, hunnid racks in the bag, that's a honey bun
Baby OG, I been runnin' these streets, got the game from Lashawn, I'm my mama's son
Learned 'bout the triple cross when I was young and I know I ain't goin' so I keep a gun
I flew to Paris just to buy some Dior
She beggin' for attention, I don't see her
C.I.P. Pop, I wish that you could see us
Million cash plus whenever I go re-up
I got some niggas in the street, won't beat me
I got the industry tryna be me
I just go Ray Charles, they can't see me
I'm in a Rolls-Royce with a RiRi

I did some wrong (Oh, oh), but I'm always right (Oh, oh)
Said I know how to shoot (Oh, oh) and I know how to fight
Boy, I'll tell you once, won't tell you twice
I'm real discreet, like a thief in the night (Yeah)

Like a thief in the night (Thief)
I pull up, give her D for the night (Uh-huh)
Tryna fuck in the V, it's aight (Let's fuck)
We can't fuck up my seats 'cause they white (That's my seats, watch my motherfuckin' seats)
I'm livin' like ""Thriller,"" I only come out at the night time
She don't fuck with liquor, don't like bein' tipsy
She don't do the Henny, just white wine (What she do?)
Pop the cork on some new Pinot Grigio (Yeah)
I pull up in the Porsche wit' a freaky ho (Zoom)
Park the Porsche then pull up in a Lambo (Hmph)
I hop out, Major Payne, rockin' camo (Yessir)
Think she cute, make her fuck, let her man go (She cute)
Like to shoot, light you up, bitch, I'm Rambo
Cuban link full of rocks, it's a choker (Oh)
Rest in peace to the Pop, make me smoke ya
I did some wrong (Oh, oh), but I'm always right (Oh, oh)
Said I know how to shoot (Oh, oh) and I know how to fight
Boy, I'll tell you once, won't tell you twice
I'm real discreet, like a thief in the night "
33,Calling My Phone,Lil Tjay and 6lack," 
Steady callin' my phone
I done told you before that it's over, leave me 'lone
Know it's hurtin' you to see me gone
Dark clouds, you gon' see me storm
I won't go back
But trust me, you're gon' hold that
Hold that (Mmm, mmm)

Get you off my mind now
I can't get you off my mind now
I can't get you off my mind now
I can't get you off my mind now (Mmm, mmm)
I can't get you off my mind now
I can't get you off my mind now
I can't get you off my mind now
I can't get you off my mind now (Mmm, mmm)

I ain't tryna play these games no more
I don't wanna be textin' your name no more
I ain't tryna feel this pain no more
Girl, I'm sorry, but my feelings ain't the same no more (No)
Used to be my homie, you ain't gang no more (No)
I am not a nigga you could claim no more (No)
Traumatized, hoping it don't rain no more
You done put me through some things that done changed my aura
Now all around the world, I explore, no Dora
New bitch, I might drip her in Dior
Ass fat, shawty straight heat, no Florida
Bad and she do it for herself, I applaud her
No needs, yeah, I'm talkin' my boo
So please, leave me alone I'm through
And it's all 'cause what you started
I been told you you gon' lose (Mmm)

Steady callin' my phone (Brrt)
I done told you before that it's over, leave me 'lone
Know it's hurtin' you to see me gone
Dark clouds, you gon' see me storm
I won't go back (Go back)
But trust me, you're gon' hold that
Hold that (Mmm, mmm)

Get you off my mind now (Ooh, wow)
I can't get you off my mind now (Yeah, yeah)
I can't get you off my mind now (My mind)
I can't get you off my mind now (Mmm, mmm) (Alright)
I can't get you off my mind now (Woah)
I can't get you off my mind now (Woah)
I can't get you off my mind now (Yeah)
I can't get you off my mind now (Mmm, mmm)

I ain't tryna play no games, my love
I'm one of a kind, couldn't fake, my love
Earthquake, make somethin' shake, my love
Most of them can't even relate, my love
Used to be gang, oh, now you're not gang
Used to have fun, no, now you got shame
Used to catch flights, but now I'm not playin'
Play on words, she love it when a nigga sing
I ain't tryna play your game no more
No, you can't wear my chain no more
We are not a thing, can't take no more
Waitin' on your king, you could wait some more
Yeah, I remember days when I used to adore her
Funny how this shit just flipped like a quarter
Get a new thing, I'ma Fendi and Dior her
Get a mood swing, I'll be gone by tomorrow (Mmm, mmm)
Steady callin' my phone (Brrt)
I done told you before that it's over, leave me 'lone (Yeah, yeah)
Know it's hurtin' you to see me gone
Dark clouds, you gon' see me storm
I won't go back (I won't go back)
But trust me, you're gon' hold that (Hold that)
Hold that (Mmm, mmm)

Get you off my mind now (Mind)
I can't get you off my mind now (Mind)
I can't get you off my mind now (Mind)
I can't get you off my mind now (Mmm, mmm) (Mind)
I can't get you off my mind now (Mind)
I can't get you off my mind now (Mind)
I can't get you off my mind now (Yeah)
I can't get you off my mind now (Mmm, mmm)
I can't "
