Rank,Musica,Artista,Letra
1,Last Night,Morgan Wallen," 
Last night, we let the liquor talk
I can't remember everything we said, but we said it all
You told me that you wish I was somebody you never met
But, baby, baby, something's tellin' me this ain't over yet

No way it was our last night I kissed your lips
Make you grip the sheets with your fingertips
Last bottle of Jack, we split a fifth
Just talkin' 'bout life, goin' sip for sip
Yeah, you, you know you love to fight
And I say shit I don't mean
But I'm still gon' wake up wantin' you and me

I know that last night, we let the liquor talk
I can't remember everything we said, but we said it all
You told me that you wish I was somebody you never met
But, baby, baby, something's tellin' me this ain't over yet
No way it was our last night (Last night)
No way it was our last night (Last night)

No way it was the last night that we break up
I see your tail lights in the dust
You call your mama, I call your bluff
In the middle of the night, pull it right back up
Yeah, my, my friends say, ""Let her go""
Your friends say, ""What the hell?""
I wouldn't trade your kind of love for nothin' else

Oh, baby, last night, we let the liquor talk
I can't remember everything we said, but we said it all
You told me that you wish I was somebody you never met
But, baby, baby, something's tellin' me this ain't over yet
No way it was our last night, we said we'd had enough
I can't remember everything we said, but we said too much
I know you packed your shit and slammed the door right before you left
But, baby, baby, something's tellin' me this ain't over yet
No way it was our last night (Last night)
No way it was our last night (Last night)

I know you said this time you really weren't comin' back again
But, baby, baby, something's tellin' me this ain't over yet
No way it was our last night (Last night)
No way it was our last night (Last night) "
2,Flowers,Miley Cyrus," 
We were good, we were gold
Kinda dream that can't be sold
We were right 'til we weren't
Built a home and watched it burn

Mm, I didn't wanna leave you, I didn't wanna lie
Started to cry, but then remembered I

I can buy myself flowers
Write my name in the sand
Talk to myself for hours
Say things you don't understand
I can take myself dancing
And I can hold my own hand
Yeah, I can love me better than you can

Can love me better, I can love me better, baby
Can love me better, I can love me better, baby

Paint my nails cherry-red
Match the roses that you left
No remorse, no regret
I forgive every word you said

Ooh, I didn't wanna leave you, baby, I didn't wanna fight
Started to cry, but then remembered I

I can buy myself flowers
Write my name in the sand
Talk to myself for hours, yeah
Say things you don't understand
I can take myself dancing, yeah
I can hold my own hand
Yeah, I can love me better than you can

Can love me better, I can love me better, baby
Can love me better, I can love me better, baby
Can love me better, I can love me better, baby
Can love me better, I (Ooh, I)

I didn't wanna leave you, I didn't wanna fight
Started to cry, but then remembered I

I can buy myself flowers (Uh-huh)
Write my name in the sand
Talk to myself for hours (Yeah)
Say things you don't understand (You never will)
I can take myself dancing, yeah
I can hold my own hand
Yeah, I can love me better than
Yeah, I can love me better than you can
Can love me better, I can love me better, baby (Uh)
Can love me better, I can love me better, baby (Than you can)
Can love me better, I can love me better, baby
Can love me better, I "
3,Kill Bill,SZA," 
I'm still a fan even though I was salty
Hate to see you with some other broad, know you happy
Hate to see you happy if I'm not the one drivin'

I'm so mature, I'm so mature
I'm so mature, I got me a therapist to tell me there's other men
I don't want none, I just want you
If I can't have you, no one should

I might
I might kill my ex, not the best idea
His new girlfriend's next, how'd I get here?
I might kill my ex, I still love him though
Rather be in jail than alone

I get the sense that it's a lost cause
I get the sense that you might really love her
This text gon' be evidence, this text is evidence
I tried to ration with you, no murders or crime of passion, but damn
You was out of reach
You was at the farmer's market with your perfect peach
Now I'm in the basement plannin' home invasion
Now you layin' face-down, got me singin' over a beat

I'm so mature, I'm so mature
I'm so mature, I got me a therapist to tell me there's other men
I don't want none, I just want you
If I can't have you, no one will

I might (I)
I might kill my ex, not the best idea
His new girlfriend's next, how'd I get here?
I might kill my ex, I still love him though
Rather be in jail than alone

I did it all for love (Love)
I did it all on no drugs (Drugs)
I did all of this sober
I did it all for us, oh
I did it all for love (Love)
I did all of this on no drugs (Drugs)
I did all of this sober
Don't you know I did it all for us? (I'm gon' kill your ass tonight)

Oh, I just killed my ex (My ex, oops), not the best idea (Idea)
Killed his girlfriend next, how'd I get here? (He left me no choice)
I just killed my ex (My ex), I still love him though (I do)
Rather be in Hell than alone "
4,Anti-Hero,Taylor Swift,"
I have this thing where I get older, but just never wiser
Midnights become my afternoons
When my depression works the graveyard shift, all of the people
I've ghosted stand there in the room

I should not be left to my own devices
They come with prices and vices
I end up in crisis
(Tale as old as time)
I wake up screaming from dreaming
One day, I'll watch as you're leaving
'Cause you got tired of my scheming
(For the last time)

It's me, hi
I'm the problem, it's me
At teatime, everybody agrees
I'll stare directly at the sun, but never in the mirror
It must be exhausting always rooting for the anti-hero

Sometimes, I feel like everybody is a sexy baby
And I'm a monster on the hill
Too big to hang out, slowly lurching toward your favorite city
Pierced through the heart, but never killed

Did you hear my covert narcissism I disguise as altruism
Like some kind of congressman?
(A tale as old as time)
I wake up screaming from dreaming
One day, I'll watch as you're leaving
And life will lose all its meaning
(For the last time)

It's me, hi
I'm the problem, it's me (I'm the problem, it's me)
At teatime, everybody agrees
I'll stare directly at the sun, but never in the mirror
It must be exhausting always rooting for the anti-hero

I have this dream my daughter-in-law kills me for the money
She thinks I left them in the will
The family gathers 'round and reads it and then someone screams out
""She's laughing up at us from Hell""

It's me, hi
I'm the problem, it's me
It's me, hi
I'm the problem, it's me
It's me, hi
Everybody agrees, everybody agrees
It's me, hi (Hi)
I'm the problem, it's me (I'm the problem, it's me)
At teatime (Teatime), everybody agrees (Everybody agrees)
I'll stare directly at the sun, but never in the mirror
It must be exhausting always rooting for the anti-hero "
5,Creepin',Metro Boomin The Weeknd 21 Savage," 
(Just can't believe this, man)
(Metro Boomin want some more, nigga)
Somebody said they saw you
The person you were kissing wasn't me
And I would never ask you
I just kept it to myself

I don't wanna know
If you're playin' me, keep it on the low
'Cause my heart can't take it anymore
And if you creepin', please don't let it show
Oh, baby, I don't wanna know

I think about it when I hold you
When lookin' in your eyes, I can't believe
And I don't need to know the truth
Baby, keep it to yourself

I don't wanna know
If you're playin' me, keep it on the low
'Cause my heart can't take it anymore
And if you creepin', please don't let it show
Oh, baby, I don't wanna know

Did he touch you better than me? (Touch you better than me)
Did he watch you fall asleep? (Watch you fall asleep)
Did you show him all those things that you used to do to me?
If you're better off that way (Better off that way)
There ain't more that I can say (More that I can say)
Just go on and do your thing and don't come back to me

Woah, woah, woah, 21
Had me crushin', I was cuffin' like the precinct
How you go from housewife to a sneaky link?
Got you riding 'round in all type of Benzes and Rovers
Girl, you used to ride in the rinky-dink
I'm the one put you in Eliantte (On God)
Fashion Nova model, I put you on the runway (On God)
You was rockin' Coach bags, got you Chane'-ne'
Side bitch in Frisco, I call her my Bay-bae (21)
I got a girl, but I still feel alone (On God)
If you playin' me that mean my home ain't home (On God)
Havin' nightmares of goin' through your phone (21)
Can't even record, you got me out my zone

I don't wanna know
If you're playin' me, keep it on the low
'Cause my heart can't take it anymore
And if you creepin', please don't let it show
Oh, baby, I don't wanna know
If you're playin' me, keep it on the low
'Cause my heart can't take it anymore
And if you creepin', please don't let it show
Oh, baby, I don't wanna know
If you creepin', just don't let me find out (On God)
Get a hotel, never bring 'em to the house (On God)
If you're better off that way
Baby, all that I can say
If you're gonna do your thing, then don't come back to me "
6,Calm Down,Rema Selena Gomez,"
Another banger

Baby, calm down, calm down
Girl, this your body e put in my heart for lockdown, for lockdown, oh, lockdown
Girl, you sweet like Fanta, ooh, Fanta, ooh
If I tell you say, ""I love you"", you no dey form yanga-oh, oh, yanga-oh
No, tell me no, no, no, no, woah, woah, woah, woah
Oh-oh-oh-oh-oh-oh-oh-oh-oh-oh-oh
Baby, come gimme your lo-lo-lo-lo-lo-lo-lo-lo-love
You got me like woah-woah-woah-woah-woah-woah-woah-woah-woah
Shawty, come gimme your lo-lo-lo-lo-lo-lo-lo-lo-love, hmm

I see this fine girl, for my party, she wear yellow
Every other girl they dey do too much, but this girl mellow
Naim, I dey find situation, I go use take tell am ""Hello""
Finally, I find way to talk to the girl, but she no wan' follow
Who you come dey form for? Woah (Mhmm)
Why you no wan' conform? Woah (Mhmm)
Then I start to feel her bum-bum, woah (Mhmm)
But she dey gimme small, small, woah
I know say shе sabi pass that one, one (Mhmm)
But she feeling insеcure, woah
'Cause her friends go dey gum her like chewing gum, woah (Mhmm)
Go dey gum her like chewing gum, oh-woah

Yeah, I know I look shy but for you I get down, oh, woah
And my hips make you cry when I'm moving around you (Yeah)
Do it once, do it twice (Do it twice)
I push back, you hold me tight
Get a taste for a night

Baby, show me you can calm down, calm down
Dance with me and take the lead now, lead now (Lead now)
Got you so high that you can't come down, come down
Don't you ask, you know you're allowed, allowed (Oh, no)
When it's you, I can't say no-oh-oh-oh-oh-oh-oh-oh-oh-oh-oh
Baby, give me lo-lo-lo-lo-lo-lo-lo-lo-love
You got me like woah-woah-woah-woah-woah-woah-woah-woah-woah
Shawty, come gimme your lo-lo-lo-lo-lo-lo-lo-lo-love, mm-hmm

As I reach my house, I say make a rest small, oh-woah (Make a rest small, oh-woah)
As me I wake up na she dey my mind, oh-woah (Na she dey my mind, oh-woah)
Day one, day two-wo, I no fit foc-o-us (I no fit focus)
Na so me I call am, say ""Make we link up"", oh-woah (I say make we link up, oh-woah)
Got my hand on your heart, now, I can feel it race
If I leave then you say you can never love again
Wanna give you it all but can't promise that I'll stay
And that's the risk you take (You take)
Baby, calm down, calm down
Girl, this your body e put in my heart for lockdown, for lockdown, oh, lockdown
Girl, you sweet like Fanta, ooh, Fanta, ooh
If I tell you say, ""I love you"", you no dey form yanga, oh, oh, yanga, oh
No tell me no, no, no, no, woah, woah, woah, woah
Oh-oh-oh-oh-oh-oh-oh-oh-oh-oh-oh (Your love, your love)
Baby, come gimme your lo-lo-lo-lo-lo-lo-lo-lo-love
You got me like woah-woah-woah-woah-woah-woah-woah-woah-woah
Shawty, come gimme your lo-lo-lo-lo-lo-lo-lo-lo-love (Oh, woah), hmm
"
7,Die for You,The Weeknd Ariana Grande,"
I'm findin' ways to articulate the feelin' I'm goin' through
I just can't say I don't love you (Yeah)
'Cause I love you, yeah
It's hard for me to communicate the thoughts that I hold
But tonight, I'm gon' let you know
Let me tell the truth
Baby, let me tell the truth, yeah

You know what I'm thinkin', see it in your eyes
You hate that you want me, hate it when you cry
You're scared to be lonely, 'specially in the night
I'm scared that I'll miss you, happens every time
I don't want this feelin', I can't afford love
I try to find a reason to pull us apart
It ain't workin' 'cause you're perfеct
And I know that you're worth it
I can't walk away, oh
Even though we'rе goin' through it (Ah)
And it makes you feel alone
Just know that I would die for you (Ooh, ooh)
Baby, I would die for you, yeah
The distance and the time between us (Distance and the time)
It'll never change my mind 'cause
Baby, I would die for you (I would die for you)
Baby, I would die for you, yeah

I'm findin' ways to stay concentrated on what I gotta do
But, baby boy, it's so hard 'round you
And yes, I'm blamin' you
And you know I can't fake it, now or never
And you insinuatin' that you think we might be better
Better me and you
Yeah, I know you do

You know what I'm thinkin', see it in your eyes
You hate that you want me, hate it when you cry
It ain't workin' 'cause you're perfect (Mm)
And I know you deserve it
I can't walk away

Even though we're goin' through it
And it makes you (Me) feel alone
Just know that I would die for you (I would die for you)
Baby, I would die for you, yeah
The distance and the time between us
It'll never change my mind 'cause
Baby, I would die for you (I would die for you, uh)
Baby, I would die for you, yeah (I would die for you)
I would die for you, I would lie for you
Keep it real with you, I would kill for you, my baby
I'm just sayin', yeah
I would die for you, I would lie for you
Keep it real with you, I would kill for you, my baby
Na-na-na, na-na-na, na-na-na

Even though we're goin' through it (Ooh)
And it makes you feel alone (No, no)
Just know that I would die for you (No)
Baby, I would die for you, yeah
The distance and the time between us (Ooh)
It'll never change my mind 'cause (No, no)
Baby, I would die for you (No)
Baby, I would die for you, yeah (Oh, babe) "
8,Fast Car,Luke Combs," 
You got a fast car
And I want a ticket to anywhere
Maybe we make a deal
Maybe together we can get somewhere
Any place is better
Startin' from zero, got nothin' to lose
Maybe we'll make something
Me, myself, I got nothin' to prove

You got a fast car
And I got a plan to get us out of here
I've been workin' at the convenience store
Managed to save just a little bit of money
Won't have to drive too far
Just across thе border and into the city
And you and I can both get jobs
Finally see what it mеans to be livin'

See, my old man's got a problem
He live in the bottle, that's the way it is
He said his body's too old for working
His body's too young to look like his
So Mama went off and left him
She wanted more from life than he could give
I said, ""Somebody's gotta take care of him""
So I quit school and that's what I did

You got a fast car
Is it fast enough so we can fly away?
Still gotta make a decision
Leave tonight or live and die this way

So I remember when we were driving, driving in your car
Speed so fast, I felt like I was drunk
City lights lay out before us and your arm felt nice wrapped around my shoulder
And I had a feeling that I belonged
I had a feeling I could be someone, be someone, be someone

You got a fast car
We go cruising, entertain ourselves
You still ain't got a job
So I work in the market as a checkout girl
I know things will get better
You'll find work and I'll get promoted
And we'll move out of the shelter
Buy a bigger house, live in the suburbs

So I remember when we were driving, driving in your car
Speed so fast, I felt like I was drunk
City lights lay out before us and your arm felt nice wrapped around my shoulder
And I had a feeling that I belonged
I had a feeling I could be someone, be someone, be someone
You got a fast car
I got a job that pays all our bills
You stay out drinking late at the bar
See more of your friends than you do your kids
I'd always hoped for better
Thought maybe together you and me would find it
I got no plans, I ain't goin' nowhere
Take your fast car and keep on driving

So I remember when we were driving, driving in your car
Speed so fast, I felt like I was drunk
City lights lay out before us and your arm felt nice wrapped around my shoulder
And I had a feeling that I belonged
I had a feeling I could be someone, be someone, be someone


You got a fast car
Is it fast enough so we can fly away?
Still gotta make a decision
Leave tonight or live and die this way "
9,Snooze,SZA," 
Ooh
I think I know

I'll touch that fire for you
I do that three, four times again, I testify for you
I told that lie, I'd kill that bitch
I do what all of them around you scared to do, I'm not
Long as you juggin' out here for me, I got it
Mobbin', schemin', lootin', hide your bodies
Long as you dreamin' 'bout me, ain't no problem
I don't got nobody, just with you right now
Tell the truth, I look better under you

I can't lose when I'm with you
How can I snooze and miss the moment?
You just too important
Nobody do body like you do
I can't lose when I'm with you
I can't just snooze and miss the moment
You just too important
Nobody do body like you do, you do

In a droptop ride with you, I feel like Scarface (Scarface)
Like that white bitch with the bob, I'll be your main one (Your main one)
Lеt's take this argument back up to my place (My placе)
Sex remind you I'm nonviolent, I'm your day one (Day one)
We ain't have shit yet, it was magic, yeah
Smash and grab shit, yeah
Nasty habits take a hold when you not here
Ain't a home when you not here
Hard to grow when you not here, I'm sayin'

I can't lose when I'm with you
How can I snooze and miss the moment?
You just too important
Nobody do body like you do
I can't lose when I'm with you
How can I snooze and miss the moment?
You just too important
Nobody do body like you do, you do

Main one ridin'
How you frontin' on me and I'm the main one tryin'?
How you blame it on me and you the main one lyin'?
How you threatenin' to leave and I'm the main one cryin'?
Just tryna be your everything
Main one ridin'
How you frontin' on me and I'm the main one tryin'?
How you blame it on me and you the main one lyin'?
How you threatenin' to leave and I'm the main one cryin'?

I can't lose when I'm with you (Like you, like you)
How can I snooze and miss the moment? (Like you)
You just too important
Nobody do body like you do
I can't lose when I'm with you (Like you)
How can I snooze and miss the moment? (Like you)
You just too important
Nobody do body like you do, you do
Nah, nah, nah, nah
I think I know, woah
See, no, I can't lose, oh
I think I know, oh "
10,I'm Good Blue,David Guetta Bebe Rexha,"
I'm good, yeah, I'm feelin' alright
Baby, I'ma have the best fuckin' night of my life
And wherever it takes me, I'm down for the ride
Baby, don't you know I'm good, yeah, I'm feelin' alright
'Cause I'm good, yeah, I'm feelin' alright
Baby, I'ma have the best fuckin' night of my life
And wherever it takes me, I'm down for the ride
Baby, don't you know I'm good, yeah, I'm feelin' alright

Don't you know I'm good, yeah, I'm feelin' alright

You know I'm down for whatever tonight
I don't need the finer things in life
No matter where I go, it's a good time, yeah
And I, I don't need to sit in VIP
Middle of the floor, that's where I'll be
Don't got a lot, but that's enough for me, yeah

'Cause I'm good, yeah, I'm feelin' alright
Baby, I'ma have the best fuckin' night of my life
And wherever it takes me, I'm down for the ride
Baby, don't you know I'm good, yeah, I'm feelin' alright

I'm good
Good
I'm good
Don't you know I'm good, yeah, I'm feelin' alright

So I just let it go, let it go
Oh, na-na-na-na-na
No, I don't care no more, care no more
Oh, na-na-na-na-na
So come on, let me know, let me know
Put your hands up, na-na-na
No, baby, nothing's gonna stop us tonight

'Cause I'm good, yeah, I'm feelin' alright
Baby, I'ma have the best fuckin' night of my life
And wherever it takes me, I'm down for the ride
Baby, don't you know I'm good, yeah, I'm feelin' alright "
11,Unholy,Sam Smith Kim Petras," 
Mummy don't know Daddy's getting hot
At the Body Shop
Doing something unholy
He like it, like it, yeah (Ooh)
He like it, like it, yeah (Yeah, yeah)
He like it, like it, yeah (Uh)
He like it, like it, yeah

A lucky, lucky girl
She got married to a boy like you
She'd kick you out if she ever, ever knew
'Bout all the **** you tell me that you do
Dirty, dirty boy
You know everyone is talkin' on the scene
I hear them whisperin' 'bout the places that you've been
And how you don't know how to keep your business clean

Mummy don't know Daddy's getting hot
At the Body Shop
Doin' something unholy
He's sat back while she's droppin' it
She be poppin' it
Yeah, she put it down slowly
Oh-ee-oh-ee-oh, he left his kids at
Ho-ee-oh-ee-ome so he can get that
Mummy don't know Daddy's getting hot
At the Body Shop
Doin' something unholy (Woo)

Mm, daddy, daddy, if you want it, drop the addy (Yeah, yeah)
Give me love, give me Fendi, my Balenciaga daddy
You gon' need to bag it up 'cause I'm spendin' on Rodeo (Woo)
You can watch me back it up, I'll be gone in the A.M. (Yeah)
And he, he get me Prada, get me Miu Miu like Rihanna (Ah)
He always call me 'cause I never cause no drama (Drama)
And when you want it, baby, I know I got you covered (Yeah, yeah)
And when you need it, baby, just jump under the covers (Yeah)

Mummy don't know Daddy's getting hot (Hot)
At the Body Shop (Shop)
Doin' something unholy
He's sat back while she's droppin' it (She)
She be poppin' it (She)
Yeah, she put it down slowly
Oh-ee-oh-ee-oh, he left his kids at
Ho-ee-oh-ee-ome so he can get that
Mummy don't know Daddy's getting hot (Unholy)
At the Body Shop (Ah)
Doin' something unholy (Unholy)

Oh-oh, oh-ee-oh-ee, ee-oh (Unholy)
Oh-oh, oh-ee-oh-ee, ee-oh (Unholy)
Oh-oh, oh-ee-oh-ee, ee-oh (Yeah, yeah)
Oh-oh, oh-ee-oh-ee, ee-oh "
12,You Proof,Morgan Wallen," 
Yeah, I've been throwin' down the whiskey
I oughta get my money back
Someone said it drowns the memory
Aw, but it ain't doin' jack
Yeah, I been sippin', I been buzzin'
Shootin' doubles like it's nothin'
Aw, but nothin' makes you go away

I need somethin' you proof
Somethin' stronger than I'm used to
Yeah, I been pullin' ninety to a hundred
Feel like nothing's gonna cut it
That's the hard truth
Yeah, I need somethin' you proof
Aw, I need somethin' you proof

Poured 'em up 'til they shuttin' 'em down, yeah
You never ain't not around, yeah
Don't matter what time or town
I can't get you gone
Turned the bar, yeah, upside down
Just lookin' for somethin' that does it
I'd give 'em all my money

Ain't nobody sellin' nothin' you proof
Somethin' stronger than I'm used to
Yeah, I been pullin' ninety to a hundred
Feel like nothing's gonna cut it
That's the hard truth
Yeah, I need somethin' you proof
Aw, I need somethin' you proof

Hey, I been mixin' liquors tryna get you gone
Aw, but I must be doin' somethin' wrong
'Cause I been workin' hard to fade your memory
Baby, but the only thing faded is me

I need somethin' you proof
Somethin' stronger than I'm used to
Yeah, I been pullin' ninety to a hundred
Feel like nothing's gonna cut it
That's the hard truth
I need somethin' you proof
(Poured 'em up 'til they shuttin' 'em down, yeah)
(You never ain't not around, yeah)
Aw, I need somethin' you proof
(Don't matter what time or town)
(I can't get you gone)
(Turned the bar, yeah, upside down)
(Just lookin' for somethin' that does it)
(I'd give 'em all my money)
(Ain't nobody sellin' nothin' you proof) "
13,Something in the Orange,Zach Bryan," 
It'll be fine by dusk light, I'm tellin' you, baby
These things eat at your bones and drive your young mind crazy
But when you place your head between my collar and jaw
I don't know much, but there's no weight at all

And I'm damned if I do and I'm damned if I don't
'Cause if I say I miss you, I know that you won't
But I miss you in the mornings when I see the sun
Somethin' in the orange tells me we're not done

To you, I'm just a man; to me, you're all I am
Where the hell am I supposed to go?
I poisoned myself again, somethin' in the orange
Tells me you're never comin' home

I need to hear you say you've been waitin' all night
There's orange dancin' in your eyes from bulb light
Your voice only trembles when you try to speak
Take me back to us dancin', this wood used to creak

To you, I'm just a man; to me, you're all I am
Where the hell am I supposed to go?
I poisoned myself again, somethin' in the orange
Tells me you're never comin' home

To you, I'm just a man; to me, you're all I am
Where the hell am I supposed to go?
I poisoned myself again, somethin' in the orange
Tells me you're never comin' home
If you leave today, I'll just stare at the way
The orange touches all things around
The grass, trees, and dew, how I just hate you
Please turn those headlights around
Please turn those headlights around "
